metric_name,metric_type,interval,unit_name,per_unit_name,description,orientation,integration,short_name
elasticsearch.thread_pool.percolate.active,gauge,,thread,,The number of active threads in the percolate pool.,0,elasticsearch,active percolate threads
elasticsearch.thread_pool.percolate.queue,gauge,,thread,,The number of queued threads in the percolate pool.,0,elasticsearch,queued percolate threads
elasticsearch.thread_pool.percolate.threads,gauge,,thread,,The total number of threads in the percolate pool.,0,elasticsearch,total percolate threads
elasticsearch.thread_pool.percolate.rejected,gauge,,thread,,The number of rejected threads in the percolate pool.,0,elasticsearch,rejected percolate threads
elasticsearch.thread_pool.refresh.active,gauge,,thread,,The number of active threads in the refresh pool.,0,elasticsearch,active refresh threads
elasticsearch.thread_pool.refresh.queue,gauge,,thread,,The number of queued threads in the refresh pool.,0,elasticsearch,queued refresh threads
elasticsearch.thread_pool.refresh.threads,gauge,,thread,,The total number of threads in the refresh pool.,0,elasticsearch,total refresh threads
elasticsearch.thread_pool.refresh.rejected,gauge,,thread,,The number of rejected threads in the refresh pool.,0,elasticsearch,rejected refresh threads
elasticsearch.thread_pool.search.active,gauge,,thread,,The number of active threads in the search pool.,0,elasticsearch,active search threads
elasticsearch.thread_pool.search.queue,gauge,,thread,,The number of queued threads in the search pool.,0,elasticsearch,queued search threads
elasticsearch.thread_pool.search.threads,gauge,,thread,,The total number of threads in the search pool.,0,elasticsearch,total search threads
elasticsearch.thread_pool.search.rejected,gauge,,thread,,The number of rejected threads in the search pool.,0,elasticsearch,rejected search threads
elasticsearch.thread_pool.snapshot.active,gauge,,thread,,The number of active threads in the snapshot pool.,0,elasticsearch,active snapshot threads
elasticsearch.thread_pool.snapshot.queue,gauge,,thread,,The number of queued threads in the snapshot pool.,0,elasticsearch,queued snapshot threads
elasticsearch.thread_pool.snapshot.threads,gauge,,thread,,The total number of threads in the snapshot pool.,0,elasticsearch,total snapshot threads
elasticsearch.thread_pool.snapshot.rejected,gauge,,thread,,The number of rejected threads in the snapshot pool.,0,elasticsearch,rejected snapshot threads
elasticsearch.thread_pool.write.active,gauge,,thread,,The number of active threads in the write pool.,0,elasticsearch,active write threads
elasticsearch.thread_pool.write.queue,gauge,,thread,,The number of queued threads in the write pool.,0,elasticsearch,queued write threads
elasticsearch.thread_pool.write.threads,gauge,,thread,,The total number of threads in the write pool.,0,elasticsearch,total write threads
elasticsearch.thread_pool.write.rejected,gauge,,thread,,The number of rejected threads in the write pool.,0,elasticsearch,rejected write threads
elasticsearch.transport.rx_count,gauge,,packet,,The total number of packets received in cluster communication.,0,elasticsearch,transport packets received
elasticsearch.transport.rx_size,gauge,,byte,,The total size of data received in cluster communication.,0,elasticsearch,transport bytes received
elasticsearch.transport.server_open,gauge,,connection,,The number of connections opened for cluster communication.,0,elasticsearch,transport open connections
elasticsearch.transport.tx_count,gauge,,packet,,The total number of packets sent in cluster communication.,0,elasticsearch,transport packets sent
elasticsearch.transport.tx_size,gauge,,byte,,The total size of data sent in cluster communication.,0,elasticsearch,transport bytes sent
elasticsearch.unassigned_shards,gauge,,shard,,The number of shards that are unassigned to a node.,0,elasticsearch,unassigned shards
jvm.gc.collection_count,gauge,,garbage collection,,The total number of garbage collections run by the JVM.,0,elasticsearch,jvm gc count
jvm.gc.collection_time,gauge,,second,,The total time spent on garbage collection in the JVM.,0,elasticsearch,jvm gc time
jvm.gc.collectors.old.collection_time,gauge,,second,,The total time spent in major GCs in the JVM that collect old generation objects.,0,elasticsearch,jvm old gc time
jvm.gc.collectors.old.count,gauge,,garbage collection,,The total count of major GCs in the JVM that collect old generation objects.,0,elasticsearch,jvm old gc count
jvm.gc.collectors.young.collection_time,gauge,,second,,The total time spent in minor GCs in the JVM that collects young generation objects.,0,elasticsearch,jvm young gc time
jvm.gc.collectors.young.count,gauge,,garbage collection,,The total count of minor GCs in the JVM that collects young generation objects.,0,elasticsearch,jvm young gc count
jvm.gc.concurrent_mark_sweep.collection_time,gauge,,second,,"The total time spent on ""concurrent mark & sweep"" GCs in the JVM.",0,elasticsearch,jvm concurrent mark and sweep gc time
jvm.gc.concurrent_mark_sweep.count,gauge,,garbage collection,,"The total count of ""concurrent mark & sweep"" GCs in the JVM.",0,elasticsearch,jvm concurrent mark and sweep gc count
jvm.gc.par_new.collection_time,gauge,,second,,"The total time spent on ""parallel new"" GCs in the JVM.",0,elasticsearch,jvm parnew gc time
jvm.gc.par_new.count,gauge,,garbage collection,,"The total count of ""parallel new"" GCs in the JVM.",0,elasticsearch,jvm parnew gc count
jvm.mem.heap_committed,gauge,,byte,,The amount of memory guaranteed to be available to the JVM heap.,0,elasticsearch,jvm heap committed
jvm.mem.heap_in_use,gauge,,,,The amount of memory currently used by the JVM heap as a value between 0 and 1.,0,elasticsearch,jvm heap in use
jvm.mem.heap_max,gauge,,byte,,The maximum amount of memory that can be used by the JVM heap.,0,elasticsearch,jvm heap max
jvm.mem.heap_used,gauge,,byte,,The amount of memory in bytes currently used by the JVM heap.,0,elasticsearch,jvm heap used
jvm.mem.non_heap_committed,gauge,,byte,,The amount of memory guaranteed to be available to JVM non-heap.,0,elasticsearch,jvm non-heap committed
jvm.mem.non_heap_used,gauge,,byte,,The amount of memory in bytes currently used by the JVM non-heap.,0,elasticsearch,jvm non-heap used
jvm.mem.pools.young.used,gauge,,byte,,The amount of memory in bytes currently used by the Young Generation heap reagion.,0,elasticsearch,jvm young used
jvm.mem.pools.young.max,gauge,,byte,,The maximum amount of memory that can be used by the Young Generation heap reagion.,0,elasticsearch,jvm young max
jvm.mem.pools.old.used,gauge,,byte,,The amount of memory in bytes currently used by the Old Generation heap reagion.,0,elasticsearch,jvm old used
jvm.mem.pools.old.max,gauge,,byte,,The maximum amount of memory that can be used by the Old Generation heap reagion.,0,elasticsearch,jvm old max
jvm.mem.pools.survivor.used,gauge,,byte,,The amount of memory in bytes currently used by the Survivor Space.,0,elasticsearch,jvm survivor used
jvm.mem.pools.survivor.max,gauge,,byte,,The maximum amount of memory that can be used by the Survivor Space.,0,elasticsearch,jvm survivor max
jvm.threads.count,gauge,,thread,,The number of active threads in the JVM.,0,elasticsearch,jvm threads
jvm.threads.peak_count,gauge,,thread,,The peak number of threads used by the JVM.,0,elasticsearch,jvm peak threads
elasticsearch.index.health,gauge,,,,The status of the index,0,elasticsearch,index health
elasticsearch.index.docs.count,gauge,,document,,The number of documents in the index,0,elasticsearch,index doc count
elasticsearch.index.docs.deleted,gauge,,document,,The number of deleted documents in the index,0,elasticsearch,index doc deleted count
elasticsearch.index.primary_shards,gauge,,shard,,The number of primary shards in the index,0,elasticsearch,index primary shards count
elasticsearch.index.replica_shards,gauge,,shard,,The number of replica shards in the index,0,elasticsearch,index replica shards count
elasticsearch.index.primary_store_size,gauge,,byte,,The store size of primary shards in the index,0,elasticsearch,index primary store size
elasticsearch.index.store_size,gauge,,byte,,The store size of primary and replica shards in the index,0,elasticsearch,index pri and rep store size
