metric_name,metric_type,interval,unit_name,per_unit_name,description,orientation,integration,short_name
cilium.agent.api_process_time.seconds.count,count,,second,,"Count of processing time for all API calls",0,cilium,api proc time count
cilium.agent.api_process_time.seconds.sum,gauge,,second,,"Sum of processing time for all API calls",0,cilium,api proc time sum
cilium.agent.bootstrap.seconds.count,count,,second,,"Count of bootstrap durations",0,cilium,bootstrap time count
cilium.agent.bootstrap.seconds.sum,gauge,,second,,"Sum of bootstrap durations",0,cilium,bootstrap time sum
cilium.bpf.map_ops.total,count,,operation,,"Total BPF map operations performed",0,cilium,bpf map ops
cilium.controllers.failing.count,count,,unit,,"Number of failing controllers",-1,cilium, fail controllers
cilium.controllers.runs_duration.seconds.count,count,,second,,"Count of controller processes duration",0,cilium,controller dur count
cilium.controllers.runs_duration.seconds.sum,gauge,,second,,"Sum of controller processes duration",0,cilium,controller dur sum
cilium.controllers.runs.total,count,,unit,,"Total number of controller runs",0,cilium,controller runs
cilium.datapath.conntrack_gc.duration.seconds.count,count,,second,,"Count of garbage collector process duration",0,cilium,gc dur count
cilium.datapath.conntrack_gc.duration.seconds.sum,gauge,,second,,"Sum of garbage collector process duration",0,cilium,gc dur sum
cilium.datapath.conntrack_gc.entries,gauge,,garbage collection,,"The number of alive and deleted conntrack entries",0,cilium,conntrack entries
cilium.datapath.conntrack_gc.key_fallbacks.total,count,,garbage collection,,"The total number of conntrack entries",-1,cilium,conntrack entries total
cilium.datapath.conntrack_gc.runs.total,count,,garbage collection,,"Total number of the conntrack garbage collector process runs",0,cilium,gc runs
cilium.datapath.errors.total,count,,error,,"Total number of errors in datapath management",-1,cilium,datapath errors
cilium.drop_bytes.total,count,,byte,,"Total dropped bytes",-1,cilium,drop bytes
cilium.drop_count.total,count,,packet,,"Total dropped packets",-1,cilium,drop packets
cilium.endpoint.count,count,,unit,,"Total endpoints managed by agent",0,cilium,total endpoints
cilium.endpoint.regeneration_time_stats.seconds.count,count,,second,,"Count of endpoint regeneration time stats",0,cilium,endpoint regen time count
cilium.endpoint.regeneration_time_stats.seconds.sum,gauge,,second,,"Sum of endpoint regeneration time stats",0,cilium,endpoint regen time sum
cilium.endpoint.regenerations.count,count,,unit,,"Count of completed endpoint regenerations",1,cilium,endpoint regen count
cilium.endpoint.state,gauge,,unit,,"Count of all endpoints",0,cilium,endpoint count
cilium.errors_warning.total,count,,error,,"Total error warnings",-1,cilium,error total
cilium.event_timestamp,gauge,,time,,"Last timestamp of event received",0,cilium,event ts
cilium.forward_bytes.total,count,,byte,,"Total forwarded bytes",1,cilium,forward bytes
cilium.forward_count.total,count,,packet,,"Total forwarded packets",1,cilium,forward packet
cilium.fqdn.gc_deletions.total,count,,unit,,"Total number of FQDNs cleaned in FQDN garbage collector job",0,cilium,fdqn total
cilium.identity.count,gauge,,unit,,"Number of identities allocated",0,cilium,id count
cilium.ip_addresses.count,gauge,,unit,,"Number of allocated ip_addresses",0,cilium,ip count
cilium.ipam.events.total,count,,event,,"Number of IPAM events received by action and datapath family type",0,cilium,ipam total
cilium.k8s_client.api_calls.count,count,,request,,"Number of API calls made to kube-apiserver",0,cilium,api call count
cilium.k8s_client.api_latency_time.seconds.count,count,,second,,"Count of processed API call duration",-1,cilium,api latency count
cilium.k8s_client.api_latency_time.seconds.sum,gauge,,second,,"Sum of processed API call duration",-1,cilium,api latency sum
cilium.kubernetes.events_received.total,count,,event,,"Number of Kubernetes received events processed",0,cilium,k8s events rcv count
cilium.kubernetes.events.total,count,,event,,"Number of Kubernetes events processed",0,cilium,k8s events count
cilium.nodes.all_datapath_validations.total,count,,unit,,"Number of validation calls to implement the datapath implemention of a node",0,cilium,node validations
cilium.nodes.all_events_received.total,count,,event,,"Number of node events received",0,cilium,node events rcvd
cilium.nodes.managed.total,gauge,,node,,"Number of nodes managed",0,cilium,node managed
cilium.policy.count,gauge,,unit,,"Number of policies currently loaded",0,cilium,policy count
cilium.policy.endpoint_enforcement_status,gauge,,unit,,"Number of endpoints labeled by polict enforcement status",0,cilium,policy enforces endpoint count
cilium.policy.import_errors.count,count,,error,,"Number of failed policy imports",-1,cilium,failed policy
cilium.policy.l7_denied.total,count,,unit,,"Number of total L7 denied requests/responses due to policy",-1,cilium,denied l7 policy
cilium.policy.l7_forwarded.total,count,,unit,,"Number of total L7 forwarded requests/responses",1,cilium,forwarded l7 policy
cilium.policy.l7_parse_errors.total,count,,error,,"Number of total L7 parse errors",-1,cilium,l7 policy error
cilium.policy.l7_received.total,count,,unit,,"Number of total L7 received requests/responses",1,cilium,l7 policy received
cilium.policy.max_revision,gauge,,unit,,"Highest policy revision number in the agent",0,cilium,max policy
cilium.policy.regeneration_time_stats.seconds.count,count,,second,,"Policy regeneration time stats count",0,cilium,policy regen time count
cilium.policy.regeneration_time_stats.seconds.sum,gauge,,second,,"Policy regeneration time stats count",0,cilium,policy regen time sum
cilium.policy.regeneration.total,count,,unit,,"Total number of successful policy regenerations",0,cilium,policy regen count
cilium.process.cpu.seconds.total,gauge,,second,,"Process CPU time in seconds",0,cilium,proc cpu second
cilium.process.max_fds,gauge,,file,,"Process file descriptor maximum",0,cilium,max fd
cilium.process.open_fds,gauge,,file,,"Number of open file descriptors",0,cilium,open fd
cilium.process.resident_memory.bytes,gauge,,byte,,"Total resident memory bytes",0,cilium,mem bytes
cilium.process.start_time.seconds,gauge,,second,,"Processes start time",0,cilium,proc start time
cilium.process.virtual_memory.bytes,gauge,,byte,,"Virtual memory bytes",0,cilium,virtual mem bytes
cilium.process.virtual_memory.max.bytes,gauge,,byte,,"Maximum virtual memory bytes",0,cilium,max virtual mem bytes
cilium.subprocess.start.total,count,,unit,,"Number of times that Cilium has started a subprocess",0,cilium,subproc start
cilium.triggers_policy.update_call_duration.seconds.count,count,,second,,"Count of policy update trigger duration",0,cilium,trigger policy time count
cilium.triggers_policy.update_call_duration.seconds.sum,count,,secound,,"Sum of policy update trigger duration",0,cilium,trigger policy time sum
cilium.triggers_policy.update_folds,gauge,,unit,,"Number of folds",0,cilium,fold count
cilium.triggers_policy.update.total,count,,unit,,"Total number of policy update trigger invocations",0,cilium,policy update trigger count
cilium.unreachable.health_endpoints,gauge,,unit,,"Number of health endpoints that cannot be reached",0,cilium,unreachable health endpoint
cilium.unreachable.nodes,gauge,,node,,"Number of nodes that cannot be reached",0,cilium,unreachable nodes
cilium.operator.process.cpu.seconds,count,,second,,"Total user and system CPU time spent in seconds",0,cilium,cpu proc time operator
cilium.operator.process.max_fds,gauge,,file,,"Maximum number of open file descriptors",0,cilium,operator max fd
cilium.operator.process.open_fds,gauge,,file,,"Number of open file descriptors",0,cilium,operator open fd
cilium.operator.process.resident_memory.bytes,gauge,,byte,,"Resident memory size in bytes",0,cilium,operator mem size
cilium.operator.process.start_time.second,gauge,,second,,"Start time of the process since unix epoch in seconds",0,cilium,proc start time operator
cilium.operator.process.virtual_memory.bytes,gauge,,byte,,"Virtual memory size in bytes",0,cilium,virtual mem size operator
cilium.operator.process.virtual_memory_max.bytes,gauge,,byte,,"Maximum amount of virtual memory available in bytes",0,cilium,virtual mem size max operator