metric_name,metric_type,interval,unit_name,per_unit_name,description,orientation,integration,short_name,curated_metric,sample_tags
supabase.auth_users.user_count,gauge,,user,,The number of users in the project database.,0,supabase,,,
supabase.db.sql.connection_closed_max_idle.count,count,,connection,,The total number of connections closed due to SetConnMaxIdleTime.,0,supabase,,,
supabase.db.sql.connection_closed_max_idle_time.count,count,,connection,,The total number of connections closed due to SetMaxIdleConns.,0,supabase,,,
supabase.db.sql.connection_closed_max_lifetime.count,count,,connection,,The total number of connections closed due to SetConnMaxLifetime.,0,supabase,,,
supabase.db.sql.connection_max_open,gauge,,connection,,The maximum number of open connections to the database.,0,supabase,,,
supabase.db.sql.connection_open,gauge,,connection,,The number of established connections both in use and idle.,0,supabase,,,
supabase.db.sql.connection_wait.count,count,,connection,,The total number of connections waited for.,0,supabase,,,
supabase.db.sql.connection_wait_duration.count,count,,millisecond,,The total time blocked waiting for a new connection.,0,supabase,,,
supabase.db.transmit_bytes.count,count,,byte,,Postgres and PGbouncer network transmit bytes.,0,supabase,,,
supabase.go.gc.duration.seconds.count,count,,,,,0,supabase,,,
supabase.go.gc.duration.seconds.quantile,gauge,,,,,0,supabase,,,
supabase.go.gc.duration.seconds.sum,count,,,,,0,supabase,,,
supabase.go.goroutines,gauge,,,,,0,supabase,,,
supabase.go.memstats.alloc_bytes,gauge,,byte,,,0,supabase,,,
supabase.go.memstats.alloc_bytes.count,count,,byte,,,0,supabase,,,
supabase.go.memstats.buck_hash.sys_bytes,gauge,,byte,,,0,supabase,,,
supabase.go.memstats.frees.count,count,,,,,0,supabase,,,
supabase.go.memstats.gc.sys_bytes,gauge,,byte,,,0,supabase,,,
supabase.go.memstats.heap.alloc_bytes,gauge,,byte,,,0,supabase,,,
supabase.go.memstats.heap.idle_bytes,gauge,,byte,,,0,supabase,,,
supabase.go.memstats.heap.inuse_bytes,gauge,,byte,,,0,supabase,,,
supabase.go.memstats.heap.objects,gauge,,,,,0,supabase,,,
supabase.go.memstats.heap.released_bytes,gauge,,byte,,,0,supabase,,,
supabase.go.memstats.heap.sys_bytes,gauge,,byte,,,0,supabase,,,
supabase.go.memstats.last_gc_time.seconds,gauge,,,,,0,supabase,,,
supabase.go.memstats.lookups.count,count,,,,,0,supabase,,,
supabase.go.memstats.mallocs.count,count,,,,,0,supabase,,,
supabase.go.memstats.mcache.inuse_bytes,gauge,,byte,,,0,supabase,,,
supabase.go.memstats.mcache.sys_bytes,gauge,,byte,,,0,supabase,,,
supabase.go.memstats.mspan.inuse_bytes,gauge,,byte,,,0,supabase,,,
supabase.go.memstats.mspan.sys_bytes,gauge,,byte,,,0,supabase,,,
supabase.go.memstats.next.gc_bytes,gauge,,byte,,,0,supabase,,,
supabase.go.memstats.other.sys_bytes,gauge,,byte,,,0,supabase,,,
supabase.go.memstats.stack.inuse_bytes,gauge,,byte,,,0,supabase,,,
supabase.go.memstats.stack.sys_bytes,gauge,,byte,,,0,supabase,,,
supabase.go.memstats.sys_bytes,gauge,,byte,,,0,supabase,,,
supabase.go.threads,gauge,,,,The number of OS threads created.,0,supabase,,,
supabase.http.server.duration.bucket,count,,,,The distribution buckets for the duration of inbound HTTP requests.,0,supabase,,,
supabase.http.server.duration.count,count,,,,,0,supabase,,,
supabase.http.server.duration.sum,count,,,,The total duration of inbound HTTP requests.,0,supabase,,,
supabase.http.server.request.size_bytes.count,count,,byte,,The size of HTTP request messages.,0,supabase,,,
supabase.http.server.response.size_bytes.count,count,,byte,,The size of HTTP response messages.,0,supabase,,,
supabase.http.status_codes.count,count,,,,The number of returned HTTP status codes,0,supabase,,,
supabase.node.cpu.guest_seconds.count,count,,second,,The number of seconds the CPUs spent in guests (VMs) for each mode.,0,supabase,,,
supabase.node.cpu.seconds.count,count,,second,,The number of seconds the CPUs spent in each mode.,0,supabase,,,
supabase.node.disk.discard_time_seconds.count,count,,second,,This is the total number of seconds spent by all discards,0,supabase,,,
supabase.node.disk.discarded_sectors.count,count,,,,The total number of sectors discarded successfully.,0,supabase,,,
supabase.node.disk.discards_completed.count,count,,,,The total number of discards completed successfully.,0,supabase,,,
supabase.node.disk.discards_merged.count,count,,,,The total number of discards merged.,0,supabase,,,
supabase.node.disk.flush_requests.count,count,,,,The total number of flush requests completed successfully.,0,supabase,,,
supabase.node.disk.flush_requests_time_seconds.count,count,,second,,TThe total number of seconds spent by all flush requests.,0,supabase,,,
supabase.node.disk.io_now,gauge,,,,The number of I/Os currently in progress.,0,supabase,,,
supabase.node.disk.io_time_seconds.count,count,,second,,The total seconds spent doing I/Os.,0,supabase,,,
supabase.node.disk.io_time_weighted_seconds.count,count,,,,The weighted # of seconds spent doing I/Os.,0,supabase,,,
supabase.node.disk.read_bytes.count,count,,byte,,The total number of bytes read successfully.,0,supabase,,,
supabase.node.disk.read_time_seconds.count,count,,,,The total number of seconds spent by all reads.,0,supabase,,,
supabase.node.disk.reads_completed.count,count,,,,The total number of reads completed successfully.,0,supabase,,,
supabase.node.disk.reads_merged.count,count,,,,The total number of reads merged.,0,supabase,,,
supabase.node.disk.write_time_seconds.count,count,,second,,This is the total number of seconds spent by all writes.,0,supabase,,,
supabase.node.disk.writes_completed.count,count,,,,The total number of writes completed successfully.,0,supabase,,,
supabase.node.disk.writes_merged.count,count,,,,The number of writes merged.,0,supabase,,,
supabase.node.disk.written_bytes.count,count,,byte,,The total number of bytes written successfully.,0,supabase,,,
supabase.node.filesystem.available_bytes,gauge,,byte,,The filesystem space available to non-root users in bytes.,0,supabase,,,
supabase.node.filesystem.device_error,gauge,,,,Whether an error occurred while getting statistics for the given device.,0,supabase,,,
supabase.node.filesystem.files,gauge,,,,Filesystem total file nodes.,0,supabase,,,
supabase.node.filesystem.files_free,gauge,,,,Filesystem total free file nodes.,0,supabase,,,
supabase.node.filesystem.free_bytes,gauge,,byte,,Filesystem free space in bytes.,0,supabase,,,
supabase.node.filesystem.readonly,gauge,,,,Filesystem read-only status.,0,supabase,,,
supabase.node.filesystem.size_bytes,gauge,,byte,,,0,supabase,,,
supabase.node.load1,gauge,,,,1m load average.,0,supabase,,,
supabase.node.load15,gauge,,,,15m load average.,0,supabase,,,
supabase.node.load5,gauge,,,,5m load average.,0,supabase,,,
supabase.node.memory.active_anon_bytes,gauge,,byte,,Memory information field Active_anon_bytes.,0,supabase,,,
supabase.node.memory.active_bytes,gauge,,byte,,Memory information field Active_bytes.,0,supabase,,,
supabase.node.memory.active_file_bytes,gauge,,byte,,Memory information field Active_file_bytes.,0,supabase,,,
supabase.node.memory.anon_huge_pages_bytes,gauge,,byte,,Memory information field AnonHugePages_bytes.,0,supabase,,,
supabase.node.memory.anon_pages_bytes,gauge,,byte,,Memory information field AnonPages_bytes.,0,supabase,,,
supabase.node.memory.bounce_bytes,gauge,,byte,,Memory information field Bounce_bytes.,0,supabase,,,
supabase.node.memory.buffers_bytes,gauge,,byte,,Memory information field Buffers_bytes.,0,supabase,,,
supabase.node.memory.cached_bytes,gauge,,byte,,Memory information field Cached_bytes.,0,supabase,,,
supabase.node.memory.commit_limit_bytes,gauge,,byte,,Memory information field CommitLimit_bytes.,0,supabase,,,
supabase.node.memory.committed_as_bytes,gauge,,byte,,Memory information field Committed_AS_bytes.,0,supabase,,,
supabase.node.memory.dirty_bytes,gauge,,byte,,Memory information field Dirty_bytes.,0,supabase,,,
supabase.node.memory.file_huge_pages_bytes,gauge,,byte,,Memory information field FileHugePages_bytes.,0,supabase,,,
supabase.node.memory.file_pmd_mapped_bytes,gauge,,byte,,Memory information field FilePmdMapped_bytes.,0,supabase,,,
supabase.node.memory.hardware_corrupted_bytes,gauge,,byte,,Memory information field HardwareCorrupted_bytes.,0,supabase,,,
supabase.node.memory.huge_page_size_bytes,gauge,,byte,,Memory information field HugePagesSize_Bytes.,0,supabase,,,
supabase.node.memory.huge_pages_free,gauge,,,,Memory information field HugePages_Free.,0,supabase,,,
supabase.node.memory.huge_pages_reserved,gauge,,,,Memory information field HugePages_Rsvd.,0,supabase,,,
supabase.node.memory.huge_pages_surp,gauge,,,,Memory information field HugePages_Surp.,0,supabase,,,
supabase.node.memory.huge_pages_total,gauge,,,,Memory information field HugePages_Total.,0,supabase,,,
supabase.node.memory.hugetlb_bytes,gauge,,byte,,Memory information field Hugetlb_bytes.,0,supabase,,,
supabase.node.memory.inactive_anon_bytes,gauge,,byte,,Memory information field Inactive_anon_bytes.,0,supabase,,,
supabase.node.memory.inactive_bytes,gauge,,byte,,Memory information field Inactive_bytes.,0,supabase,,,
supabase.node.memory.inactive_file_bytes,gauge,,byte,,Memory information field Inactive_file_bytes.,0,supabase,,,
supabase.node.memory.kernel_stack_bytes,gauge,,byte,,Memory information field KernelStack_bytes.,0,supabase,,,
supabase.node.memory.kreclaimable_bytes,gauge,,byte,,Memory information field KernelStack_bytes.,0,supabase,,,
supabase.node.memory.mapped_bytes,gauge,,byte,,Memory information field Mapped_bytes.,0,supabase,,,
supabase.node.memory.mem_available_bytes,gauge,,byte,,Memory information field MemAvailable_bytes.,0,supabase,,,
supabase.node.memory.mem_free_bytes,gauge,,byte,,Memory information field MemFree_bytes.,0,supabase,,,
supabase.node.memory.mem_total_bytes,gauge,,byte,,Memory information field MemTotal_bytes.,0,supabase,,,
supabase.node.memory.mlocked_bytes,gauge,,byte,,Memory information field Mlocked_bytes.,0,supabase,,,
supabase.node.memory.nfs_unstable_bytes,gauge,,byte,,Memory information field NFS_Unstable_bytes.,0,supabase,,,
supabase.node.memory.page_tables_bytes,gauge,,byte,,Memory information field PageTables_bytes.,0,supabase,,,
supabase.node.memory.percpu_bytes,gauge,,byte,,Memory information field Percpu_bytes.,0,supabase,,,
supabase.node.memory.shmem_bytes,gauge,,byte,,Memory information field Shmem_bytes.,0,supabase,,,
supabase.node.memory.shmem_huge_pages_bytes,gauge,,byte,,Memory information field ShmemHugePages_bytes.,0,supabase,,,
supabase.node.memory.shmem_pmd_mapped_bytes,gauge,,byte,,Memory information field ShmemPmdMapped_bytes.,0,supabase,,,
supabase.node.memory.slab_bytes,gauge,,byte,,Memory information field Slab_bytes.,0,supabase,,,
supabase.node.memory.sreclaimable_bytes,gauge,,byte,,Memory information field SReclaimable_bytes.,0,supabase,,,
supabase.node.memory.sunreclaim_bytes,gauge,,byte,,Memory information field SUnreclaim_bytes.,0,supabase,,,
supabase.node.memory.swap_cached_bytes,gauge,,byte,,Memory information field SwapCached_bytes.,0,supabase,,,
supabase.node.memory.swap_free_bytes,gauge,,byte,,Memory information field SwapFree_bytes.,0,supabase,,,
supabase.node.memory.swap_total_bytes,gauge,,byte,,Memory information field SwapTotal_bytes.,0,supabase,,,
supabase.node.memory.unevictable_bytes,gauge,,byte,,Memory information field Unevictable_bytes.,0,supabase,,,
supabase.node.memory.vm_alloc_chunk_bytes,gauge,,byte,,Memory information field VmallocChunk_bytes.,0,supabase,,,
supabase.node.memory.vm_alloc_total_bytes,gauge,,byte,,Memory information field VmallocTotal_bytes.,0,supabase,,,
supabase.node.memory.vm_alloc_used_bytes,gauge,,byte,,Memory information field VmallocUsed_bytes.,0,supabase,,,
supabase.node.memory.writeback_bytes,gauge,,byte,,Memory information field Writeback_bytes.,0,supabase,,,
supabase.node.memory.writeback_tmp_bytes,gauge,,byte,,Memory information field WritebackTmp_bytes.,0,supabase,,,
supabase.node.network.receive_bytes.count,count,,byte,,Network device statistic receive_bytes.,0,supabase,,,
supabase.node.network.receive_compressed.count,count,,,,Network device statistic receive_compressed.,0,supabase,,,
supabase.node.network.receive_drop.count,count,,,,Network device statistic receive_drop.,0,supabase,,,
supabase.node.network.receive_errors.count,count,,,,Network device statistic receive_errs.,0,supabase,,,
supabase.node.network.receive_fifo.count,count,,,,Network device statistic receive_fifo.,0,supabase,,,
supabase.node.network.receive_frame.count,count,,,,Network device statistic receive_frame.,0,supabase,,,
supabase.node.network.receive_multicast.count,count,,,,Network device statistic receive_multicast.,0,supabase,,,
supabase.node.network.receive_packets.count,count,,,,Network device statistic receive_packets.,0,supabase,,,
supabase.node.network.transmit_bytes.count,count,,byte,,Network device statistic transmit_bytes.,0,supabase,,,
supabase.node.network.transmit_carrier.count,count,,,,Network device statistic transmit_carrier.,0,supabase,,,
supabase.node.network.transmit_colls.count,count,,,,Network device statistic transmit_colls.,0,supabase,,,
supabase.node.network.transmit_compressed.count,count,,,,Network device statistic transmit_compressed.,0,supabase,,,
supabase.node.network.transmit_drop.count,count,,,,Network device statistic transmit_drop.,0,supabase,,,
supabase.node.network.transmit_errors.count,count,,,,Network device statistic transmit_errs.,0,supabase,,,
supabase.node.network.transmit_fifo.count,count,,,,Network device statistic transmit_fifo.,0,supabase,,,
supabase.node.network.transmit_packets.count,count,,,,Network device statistic transmit_packets.,0,supabase,,,
supabase.node.scrape.collector_duration_seconds,gauge,,,,The duration of a collector scrape.,0,supabase,,,
supabase.node.scrape.collector_success,gauge,,,,Whether a collector succeeded.,0,supabase,,,
supabase.node.vmstat.oom_kill.count,count,,,,/proc/vmstat information field oom_kill.,0,supabase,,,
supabase.node.vmstat.pgfault.count,count,,,,/proc/vmstat information field pgfault.,0,supabase,,,
supabase.node.vmstat.pgmajfault.count,count,,,,/proc/vmstat information field pgmajfault.,0,supabase,,,
supabase.node.vmstat.pgpgin.count,count,,,,/proc/vmstat information field pgpgin.,0,supabase,,,
supabase.node.vmstat.pgpgout.count,count,,,,/proc/vmstat information field pgpgout.,0,supabase,,,
supabase.node.vmstat.pswpin.count,count,,,,/proc/vmstat information field pswpin.,0,supabase,,,
supabase.node.vmstat.pswpout.count,count,,,,/proc/vmstat information field pswpout.,0,supabase,,,
supabase.pg.up,gauge,,,,Whether the last scrape of metrics from PostgreSQL was able to connect to the server.,0,supabase,,,
supabase.pg_database_size,gauge,,megabyte,,Disk space used by the database.,0,supabase,,,
supabase.pg_database_size.bytes,gauge,,byte,,Disk space used by the database.,0,supabase,,,
supabase.pg_exporter.last_scrape_duration_seconds,gauge,,second,,Duration of the last scrape of metrics from PostgreSQL.,0,supabase,,,
supabase.pg_exporter.last_scrape_error,gauge,,,,Whether the last scrape of metrics from PostgreSQL resulted in an error.,0,supabase,,,
supabase.pg_exporter.scrapes.count,count,,,,Total number of times PostgreSQL was scraped for metrics.,0,supabase,,,
supabase.pg_exporter.user_queries_load_error,gauge,,,,Whether the user queries file was loaded and parsed successfully.,0,supabase,,,
supabase.pg_ls.archive_statusdir_wal_pending.count,count,,,,Number of not yet archived WAL files,0,supabase,,,
supabase.pg_replication_slots.max_lag_bytes,gauge,,byte,,Max Replication Lag,0,supabase,,,
supabase.pg_scrape_collector.duration_seconds,gauge,,,,Duration of a collector scrape.,0,supabase,,,
supabase.pg_scrape_collector.success,gauge,,,,Whether a collector succeeded.,0,supabase,,,
supabase.pg_settings.default_transaction_read_only,gauge,,,,Default transaction mode set to read only,0,supabase,,,
supabase.pg_stat_activity.xact_runtime,gauge,,,,Transaction Runtime,0,supabase,,,
supabase.pg_stat_bgwriter.buffers_alloc.count,count,,,,Buffers allocated,0,supabase,,,
supabase.pg_stat_bgwriter.buffers_backend.count,count,,,,Buffers written directly by a backend,0,supabase,,,
supabase.pg_stat_bgwriter.buffers_backend_fsync.count,count,,,,fsync calls executed by a backend directly,0,supabase,,,
supabase.pg_stat_bgwriter.buffers_checkpoint.count,count,,,,Buffers written during checkpoints,0,supabase,,,
supabase.pg_stat_bgwriter.buffers_clean.count,count,,,,Buffers written by bg writter,0,supabase,,,
supabase.pg_stat_bgwriter.checkpoint_sync_time.count,count,,,,Time spent synchronizing checkpoint files to disk,0,supabase,,,
supabase.pg_stat_bgwriter.checkpoint_write_time.count,count,,,,Time spent writing checkpoint files to disk,0,supabase,,,
supabase.pg_stat_bgwriter.checkpoints_req.count,count,,,,Requested checkpoints performed,0,supabase,,,
supabase.pg_stat_bgwriter.checkpoints_timed.count,count,,,,Scheduled checkpoints performed,0,supabase,,,
supabase.pg_stat_bgwriter.maxwritten_clean.count,count,,,,Number of times bg writer stopped a cleaning scan because it had written too many buffers,0,supabase,,,
supabase.pg_stat_bgwriter.stats_reset.count,count,,,,Most recent stat reset time,0,supabase,,,
supabase.pg_stat_database.blks_hit.count,count,,,,Disk blocks found in buffer cache,0,supabase,,,
supabase.pg_stat_database.blks_read.count,count,,,,Number of disk blocks read,0,supabase,,,
supabase.pg_stat_database.conflicts.confl_bufferpin.count,count,,,,Queries cancelled due to pinned buffers,0,supabase,,,
supabase.pg_stat_database.conflicts.confl_deadlock.count,count,,,,Queries cancelled due to deadlocks,0,supabase,,,
supabase.pg_stat_database.conflicts.confl_lock.count,count,,,,Queries cancelled due to lock timeouts,0,supabase,,,
supabase.pg_stat_database.conflicts.confl_snapshot.count,count,,,,Queries cancelled due to old snapshots,0,supabase,,,
supabase.pg_stat_database.conflicts.confl_tablespace.count,count,,,,Queries cancelled due to dropped tablespaces,0,supabase,,,
supabase.pg_stat_database.conflicts.count,count,,,,Queries canceled due to conflicts with recovery,0,supabase,,,
supabase.pg_stat_database.deadlocks.count,count,,,,Deadlocks detected,0,supabase,,,
supabase.pg_stat_database.num_backends,gauge,,,,The number of active backends,0,supabase,,,
supabase.pg_stat_database.temp_bytes.count,count,,byte,,Temp data written by queries,0,supabase,,,
supabase.pg_stat_database.temp_files.count,count,,,,Temp files created by queries,0,supabase,,,
supabase.pg_stat_database.tup_deleted.count,count,,,,Rows deleted,0,supabase,,,
supabase.pg_stat_database.tup_fetched.count,count,,,,Rows fetched by queries,0,supabase,,,
supabase.pg_stat_database.tup_inserted.count,count,,,,Rows inserted,0,supabase,,,
supabase.pg_stat_database.tup_returned.count,count,,,,Rows returned by queries,0,supabase,,,
supabase.pg_stat_database.tup_updated.count,count,,,,Rows updated,0,supabase,,,
supabase.pg_stat_database.xact_commit.count,count,,,,Transactions committed,0,supabase,,,
supabase.pg_stat_database.xact_rollback.count,count,,,,Transactions rolled back,0,supabase,,,
supabase.pg_stat_statements.total_queries.count,count,,,,Number of times executed,0,supabase,,,
supabase.pg_stat_statements.total_time_seconds.count,count,,second,,Total time spent in seconds,0,supabase,,,
supabase.pg_status.in_recovery,gauge,,,,Database in recovery,0,supabase,,,
supabase.pg_wal.size,gauge,,megabyte,,Disk space used by WAL files,0,supabase,,,
supabase.pgrst.db_pool.available_connections,gauge,,connection,,Available connections in the pool,0,supabase,,,
supabase.pgrst.db_pool.connection_timeouts.count,count,,connection,,The total number of pool connection timeouts,0,supabase,,,
supabase.pgrst.db_pool.max_connections,gauge,,connection,,Max pool connections,0,supabase,,,
supabase.pgrst.db_pool.requests_waiting,gauge,,,,Requests waiting to acquire a pool connection,0,supabase,,,
supabase.pgrst.schema_cache.loads.count,count,,,,The total number of times the schema cache was loaded,0,supabase,,,
supabase.pgrst.schema_cache.query_time_seconds,gauge,,second,,The query time in seconds of the last schema cache load,0,supabase,,,
supabase.physical_replication_lag.is_connected_to_primary,gauge,,,,Monitor connection to the primary database,0,supabase,,,
supabase.physical_replication_lag.is_wal_replay_paused,gauge,,,,Check if WAL replay has been paused,0,supabase,,,
supabase.physical_replication_lag_seconds,gauge,,second,,Physical replication lag in seconds,0,supabase,,,
supabase.postgres_exporter.build_info,gauge,,,,"A metric with a constant '1' value labeled by version, revision, branch, goversion from which postgres_exporter was built, and the goos and goarch for the build.",0,supabase,,,
supabase.postgres_exporter.config_last_reload_successful,gauge,,,,Postgres exporter config loaded successfully.,0,supabase,,,
supabase.postgresql.restarts.count,count,,,,Number of times postgresql has been restarted,0,supabase,,,
supabase.process.cpu.seconds.count,count,,,,Total user and system CPU time spent in seconds.,0,supabase,,,
supabase.process.max_fds,gauge,,,,Maximum number of open file descriptors.,0,supabase,,,
supabase.process.open_fds,gauge,,,,Number of open file descriptors.,0,supabase,,,
supabase.process.resident_memory.bytes,gauge,,byte,,Resident memory size in bytes.,0,supabase,,,
supabase.process.runtime.go_mem_live_objects,gauge,,,,Number of live objects is the number of cumulative Mallocs - Frees,0,supabase,,,
supabase.process.start_time.seconds,gauge,,second,,Start time of the process since unix epoch in seconds.,0,supabase,,,
supabase.process.virtual_memory.bytes,gauge,,byte,,Virtual memory size in bytes.,0,supabase,,,
supabase.process.virtual_memory.max_bytes,gauge,,byte,,Maximum amount of virtual memory available in bytes.,0,supabase,,,
supabase.promhttp_metric_handler.requests.count,count,,,,Total number of scrapes by HTTP status code.,0,supabase,,,
supabase.promhttp_metric_handler.requests_in_flight,gauge,,,,Current number of scrapes being served.,0,supabase,,,
supabase.realtime_postgres_changes.client_subscriptions,gauge,,,,Client subscriptions listening for Postgres changes,0,supabase,,,
supabase.realtime_postgres_changes.total_subscriptions,gauge,,,,Total subscription records listening for Postgres changes,0,supabase,,,
supabase.runtime.uptime_milliseconds,gauge,,,,Milliseconds since application was initialized,0,supabase,,,
supabase.storage.storage_size,gauge,,megabyte,,The total size used for all storage buckets.,0,supabase,,,
supabase.storage_api.database_query_performance.bucket,count,,,,Latency distribution buckets for database queries in seconds.,0,supabase,,,
supabase.storage_api.database_query_performance.count,count,,,,Total count of database queries executed.,0,supabase,,,
supabase.storage_api.database_query_performance.sum,count,,second,,Total time spent executing database queries in seconds.,0,supabase,,,
supabase.storage_api.db_connections,gauge,,connection,,Current number of active database connections.,0,supabase,,,
supabase.storage_api.db_pool,gauge,,connection,,Number of database connection pools created.,0,supabase,,,
supabase.storage_api.http_pool.busy_sockets,gauge,,,,Number of busy sockets in the HTTP pool.,0,supabase,,,
supabase.storage_api.http_pool.errors,gauge,,,,Total errors in the HTTP pool.,0,supabase,,,
supabase.storage_api.http_pool.free_sockets,gauge,,,,Number of free sockets available in the HTTP pool.,0,supabase,,,
supabase.storage_api.http_pool.requests,gauge,,request,,Number of pending HTTP requests waiting for a socket.,0,supabase,,,
supabase.storage_api.http_request.duration_seconds.bucket,count,,,,Latency distribution buckets for HTTP requests in seconds.,0,supabase,,,
supabase.storage_api.http_request.duration_seconds.count,count,,,,Total count of HTTP requests processed.,0,supabase,,,
supabase.storage_api.http_request.duration_seconds.sum,count,,second,,Total time spent processing HTTP requests in seconds.,0,supabase,,,
supabase.storage_api.http_request.summary_seconds.count,count,,,,Total count of HTTP requests (summary metric).,0,supabase,,,
supabase.storage_api.http_request.summary_seconds.quantile,gauge,,second,,Quantiles of HTTP request latency.,0,supabase,,,
supabase.storage_api.http_request.summary_seconds.sum,count,,second,,Total time spent processing HTTP requests.,0,supabase,,,
supabase.storage_api.nodejs.active_handles,gauge,,,,Active libuv handles grouped by type .,0,supabase,,,
supabase.storage_api.nodejs.active_handles.total,gauge,,,,Total number of active libuv handles.,0,supabase,,,
supabase.storage_api.nodejs.active_requests.total,gauge,,request,,Total number of active libuv requests.,0,supabase,,,
supabase.storage_api.nodejs.active_resources,gauge,,,,Active resources keeping the event loop alive.,0,supabase,,,
supabase.storage_api.nodejs.active_resources.total,gauge,,,,Total number of active resources.,0,supabase,,,
supabase.storage_api.nodejs.eventloop_lag.max_seconds,gauge,,second,,Maximum observed event loop lag in seconds.,0,supabase,,,
supabase.storage_api.nodejs.eventloop_lag.mean_seconds,gauge,,second,,Mean event loop lag in seconds.,0,supabase,,,
supabase.storage_api.nodejs.eventloop_lag.p50_seconds,gauge,,second,,50th percentile (median) event loop lag in seconds.,0,supabase,,,
supabase.storage_api.nodejs.eventloop_lag.p90_seconds,gauge,,second,,90th percentile event loop lag in seconds.,0,supabase,,,
supabase.storage_api.nodejs.eventloop_lag.p99_seconds,gauge,,second,,99th percentile event loop lag in seconds.,0,supabase,,,
supabase.storage_api.nodejs.eventloop_lag.seconds,gauge,,second,,Current event loop lag in seconds.,0,supabase,,,
supabase.storage_api.nodejs.eventloop_lag.stddev_seconds,gauge,,second,,Standard deviation of event loop lag measurements.,0,supabase,,,
supabase.storage_api.nodejs.external_memory.bytes,gauge,,byte,,Memory used by Node.js for C++ objects outside the V8 heap.,0,supabase,,,
