metric_name,metric_type,interval,unit_name,per_unit_name,description,orientation,integration,short_name,curated_metric,sample_tags
supabase.storage_api.nodejs.gc_duration.seconds.bucket,count,,,,Garbage collection duration distribution buckets by GC type (minor/major/incremental).,0,supabase,,,
supabase.storage_api.nodejs.gc_duration.seconds.count,count,,,,Total garbage collection cycles.,0,supabase,,,
supabase.storage_api.nodejs.gc_duration.seconds.sum,count,,second,,Total time spent in garbage collection in seconds.,0,supabase,,,
supabase.storage_api.nodejs.heap_size.total_bytes,gauge,,byte,,Total V8 heap size allocated.,0,supabase,,,
supabase.storage_api.nodejs.heap_size.used_bytes,gauge,,byte,,Used V8 heap size.,0,supabase,,,
supabase.storage_api.nodejs.heap_space_size.available_bytes,gauge,,byte,,Available memory in a specific V8 heap space .,0,supabase,,,
supabase.storage_api.nodejs.heap_space_size.total_bytes,gauge,,byte,,Total memory allocated for a specific V8 heap space.,0,supabase,,,
supabase.storage_api.nodejs.heap_space_size.used_bytes,gauge,,byte,,Used memory in a specific V8 heap space.,0,supabase,,,
supabase.storage_api.nodejs.version_info,gauge,,,,Node.js version metadata (reported as a constant gauge with version tags).,0,supabase,,,
supabase.storage_api.nodejs_eventloop_lag.min_seconds,gauge,,second,,Minimum observed event loop lag in seconds.,0,supabase,,,
supabase.storage_api.process.heap_bytes,gauge,,byte,,Process heap memory usage in bytes.,0,supabase,,,
supabase.storage_api.process.max_fds,gauge,,,,Maximum allowed file descriptors for the process.,0,supabase,,,
supabase.storage_api.process.open_fds,gauge,,,,Currently open file descriptors.,0,supabase,,,
supabase.storage_api.process.resident_memory.bytes,gauge,,byte,,Resident memory (RSS) used by the process.,0,supabase,,,
supabase.storage_api.process.uptime.seconds,gauge,,second,,Time elapsed since process start.,0,supabase,,,
supabase.storage_api.process.virtual_memory.bytes,gauge,,byte,,Virtual memory allocated by the process.,0,supabase,,,
supabase.storage_api.process_cpu.seconds.count,count,,second,,Total CPU time (user + system) consumed by the process.,0,supabase,,,
supabase.storage_api.process_cpu.system.seconds.count,count,,second,,Total system CPU time consumed by the process.,0,supabase,,,
supabase.storage_api.process_cpu.user.seconds.count,count,,second,,Total user CPU time consumed by the process.,0,supabase,,,
supabase.usage_metrics.user_queries.count,count,,,,The total number of user queries executed.,0,supabase,,,
