metric_name,metric_type,interval,unit_name,per_unit_name,description,orientation,integration,short_name
system.net.aws.ec2.bw_in_allowance_exceeded,gauge,,packet,,The number of packets shaped because the inbound aggregate bandwidth exceeded the maximum for the instance.,0,system,bw in allowance exceeded
system.net.aws.ec2.bw_out_allowance_exceeded,gauge,,packet,,The number of packets shaped because the outbound aggregate bandwidth exceeded the maximum for the instance.,0,system,bw out allowance exceeded
system.net.aws.ec2.conntrack_allowance_exceeded,gauge,,packet,,The number of packets shaped because connection tracking exceeded the maximum for the instance and new connections could not be established.,0,system,conntrack allowance exceeded
system.net.aws.ec2.linklocal_allowance_exceeded,gauge,,packet,,The number of packets shaped because the PPS of the traffic to local proxy services exceeded the maximum for the network interface.,0,system,linklocal allowance exceeded
system.net.aws.ec2.pps_allowance_exceeded,gauge,,packet,,The number of packets shaped because the bidirectional PPS exceeded the maximum for the instance.,0,system,pps allowance exceeded
system.net.bytes_rcvd,gauge,,byte,second,The number of bytes received on a device per second.,0,system,bytes rcvd
system.net.bytes_sent,gauge,,byte,second,The number of bytes sent from a device per second.,0,system,bytes sent
system.net.conntrack.acct,gauge,,unit,,Boolean to enable connection tracking flow accounting. 64-bit byte and packet counters per flow are added.,0,system,acct
system.net.conntrack.buckets,gauge,,unit,,Size of the hash table.,0,system,buckets
system.net.conntrack.checksum,gauge,,unit,,Boolean to verify checksum of incoming packets.,0,system,checksum
system.net.conntrack.count,gauge,,connection,connection,The number of connections present in the conntrack table.,0,system,connections
system.net.conntrack.drop,count,,unit,,The number of drop in the conntrack table.,0,system,drop
system.net.conntrack.early_drop,count,,unit,,The number of early drop in the conntrack table.,0,system,early drop
system.net.conntrack.error,count,,unit,,The number of error in the conntrack table.,0,system,err
system.net.conntrack.events,count,,unit,,Boolean to enable the connection tracking code will provide userspace with connection tracking events via ctnetlink.,0,system,evts
system.net.conntrack.events_retry_timeout,gauge,,unit,,,0,system,evts retry tiemout
system.net.conntrack.expect_max,gauge,,unit,,Maximum size of expectation table.,0,system,expect max
system.net.conntrack.found,count,,unit,,The number of currently allocated flow entries.,0,system,connt found
system.net.conntrack.generic_timeout,gauge,,unit,,Default for generic timeout. This refers to layer 4 unknown/unsupported protocols.,0,system,generic timeout
system.net.conntrack.helper,gauge,,unit,,Boolean to enable automatic conntrack helper assignment.,0,system,helper
system.net.conntrack.icmp_timeout,gauge,,second,,Default for ICMP timeout.,0,system,tcmp timeout
system.net.conntrack.ignore,count,,unit,,The number of ignored in the conntrack table.,0,system,ignore
system.net.conntrack.invalid,count,,unit,,The number of invalid in the conntrack table.,0,system,invalid
system.net.conntrack.insert,count,,unit,,The number of insertion in the conntrack table.,0,system,insert
system.net.conntrack.insert_failed,count,,unit,,The number of failed insertion in the conntrack table.,0,system,insert failed
system.net.conntrack.log_invalid,gauge,,unit,,Log invalid packets of a type specified by value.,0,system,log invalid
system.net.conntrack.max,gauge,,connection,entry,Conntrack table max capacity.,0,system,table entries
system.net.conntrack.search_restart,count,,unit,,,0,system,search re
system.net.conntrack.tcp_be_liberal,gauge,,unit,,Boolean to mark only out of window RST segments as INVALID.,0,system,liberal
system.net.conntrack.tcp_loose,gauge,,unit,,Boolean to enable picking up already established connections.,0,system,tcp loose
system.net.conntrack.tcp_max_retrans,gauge,,packet,,Maximum number of packets that can be retransmitted without received an (acceptable) ACK from the destination.,0,system,max retrans
system.net.conntrack.tcp_timeout_close,gauge,,second,,,0,system,timeout close
system.net.conntrack.tcp_timeout_close_wait,gauge,,second,,,0,system,timeout close wait
system.net.conntrack.tcp_timeout_established,gauge,,second,,,0,system,timeout estab
system.net.conntrack.tcp_timeout_fin_wait,gauge,,second,,,0,system,timeout fin
system.net.conntrack.tcp_timeout_last_ack,gauge,,second,,,0,system,timeout last ack
system.net.conntrack.tcp_timeout_max_retrans,gauge,,second,,,0,system,timeout max retrans
system.net.conntrack.tcp_timeout_syn_recv,gauge,,second,,,0,system,timeout syn recv
system.net.conntrack.tcp_timeout_syn_sent,gauge,,second,,,0,system,timeout syn sent
system.net.conntrack.tcp_timeout_time_wait,gauge,,second,,,0,system,timeout time wait
system.net.conntrack.tcp_timeout_unacknowledged,gauge,,second,,,0,system,timeout unack
system.net.conntrack.tcp_timeout,gauge,,second,,,0,system,timeout
system.net.conntrack.tcp_timeout_stream,gauge,,second,,,0,system,timeout stream
system.net.conntrack.timestamp,gauge,,unit,,Boolean to enable connection tracking flow timestamping.,0,system,timestamp
system.net.packets_in.count,gauge,,packet,second,The number of packets of data received by the interface.,0,system,packets in
system.net.packets_in.error,gauge,,error,second,The number of packet receive errors detected by the device driver.,-1,system,pkts in err
system.net.packets_out.count,gauge,,packet,second,The number of packets of data transmitted by the interface.,0,system,packets out
system.net.packets_out.error,gauge,,error,second,The number of packet transmit errors detected by the device driver.,-1,system,pkts out err
system.net.tcp.failed_retransmits,gauge,,Number of TCP packets that failed to be retransmitted,0,system,failed retransmit
system.net.tcp.failed_retransmits.count,count,packet,Number of TCP packets that failed to be retransmitted,0,system,failed retransmit count
system.net.tcp.in_segs,gauge,,segment,second,The number of TCP segments received (Linux or Solaris only).,0,system,segs in
system.net.tcp.in_segs.count,count,,segment,,Total number of received TCP segments (Linux or Solaris only).,0,system,segs in
system.net.tcp.out_segs,gauge,,segment,second,The number of TCP segments transmitted (Linux or Solaris only).,0,system,segs out
system.net.tcp.out_segs.count,count,,segment,,Total number of transmitted TCP segments (Linux or Solaris only).,0,system,segs out
system.net.tcp.rcv_packs,gauge,,packet,second,The number of TCP packets received (BSD only).,0,system,pkts rcvd
system.net.tcp.retrans_packs,gauge,,packet,second,The number of TCP packets retransmitted (BSD only).,0,system,pkts retrans
system.net.tcp.retrans_segs,gauge,,segment,second,The number of TCP segments retransmitted (Linux or Solaris only).,0,system,segs retrans
system.net.tcp.retrans_segs.count,count,,segment,,Total number of retransmitted TCP segments (Linux or Solaris only).,0,system,segs retrans
system.net.tcp.sent_packs,gauge,,packet,second,The number of TCP packets transmitted (BSD only).,0,system,pkts sent
system.net.tcp.listen_overflows,gauge,,,,The number of times connections have overflowed the accept buffer (Linux only). Available since Agent v5.14.0.,-1,system,tcp listen overflows
system.net.tcp.listen_overflows.count,count,,,,Total number of times connections have overflowed the accept buffer (Linux only).,-1,system,tcp listen overflows
system.net.tcp.listen_drops,gauge,,,,The number of times connections have dropped out of listen (Linux only). Available since Agent v5.14.0.,-1,system,tcp listen drops
system.net.tcp.listen_drops.count,count,,,,Total number of times connections have dropped out of listen (Linux only).,-1,system,tcp listen drops
system.net.tcp.backlog_drops,gauge,,packet,,The number of packets dropped because there wasn't room in the TCP backlog (Linux only). Available since Agent v5.14.0.,-1,system,tcp backlog drops
system.net.tcp.backlog_drops.count,count,,packet,,Total number of packets dropped because there wasn't room in the TCP backlog (Linux only).,-1,system,tcp backlog drops
system.net.tcp.recv_q.95percentile,gauge,,byte,,The 95th percentile of the size of the TCP receive queue.,0,system,recv-q 95th
system.net.tcp.recv_q.avg,gauge,,byte,,The average TCP receive queue size.,0,system,recv-q avg
system.net.tcp.recv_q.count,rate,,connection,second,The rate of connections.,0,system,recv-q count
system.net.tcp.recv_q.max,gauge,,byte,,The maximum TCP receive queue size.,0,system,recv-q max
system.net.tcp.recv_q.median,gauge,,byte,,The median TCP receive queue size.,0,system,recv-q median
system.net.tcp.send_q.95percentile,gauge,,byte,,The 95th percentile of the size of the TCP send queue.,0,system,send-q 95th
system.net.tcp.send_q.avg,gauge,,byte,,The average TCP send queue size.,0,system,send-q avg
system.net.tcp.send_q.count,rate,,connection,second,The rate of connections.,0,system,send-q count
system.net.tcp.send_q.max,gauge,,byte,,The maximum TCP send queue size.,0,system,send-q max
system.net.tcp.send_q.median,gauge,,byte,,The median TCP send queue size.,0,system,send-q median
system.net.tcp4.closing,gauge,,connection,second,The number of TCP IPv4 closing connections. ,0,system,tcp4 closing
system.net.tcp4.established,gauge,,connection,second,The number of TCP IPv4 established connections. ,0,system,tcp4 established
system.net.tcp4.listening,gauge,,connection,second,The number of TCP IPv4 listening connections. ,0,system,tcp4 listening
system.net.tcp4.opening,gauge,,connection,second,The number of TCP IPv4 opening connections. ,0,system,tcp4 opening
system.net.tcp6.closing,gauge,,connection,second,The number of TCP IPv6 closing connections. ,0,system,tcp6 closing
system.net.tcp6.established,gauge,,connection,second,The number of TCP IPv6 established connections. ,0,system,tcp6 established
system.net.tcp6.listening,gauge,,connection,second,The number of TCP IPv6 listening connections. ,0,system,tcp6 listening
system.net.tcp6.opening,gauge,,connection,second,The number of TCP IPv6 opening connections. ,0,system,tcp6 opening
system.net.udp.in_datagrams,gauge,,datagram,second,The rate of UDP datagrams delivered to UDP users (Linux only).,0,system,udp in datagrams
system.net.udp.in_datagrams.count,count,,datagram,,Total number of UDP datagrams delivered to UDP users (Linux only).,0,system,udp in datagrams
system.net.udp.in_errors,gauge,,datagram,second,The rate of received UDP datagrams that could not be delivered for reasons other than the lack of an application at the destination port (Linux only).,-1,system,udp in errors
system.net.udp.in_errors.count,count,,datagram,,Total number of received UDP datagrams that could not be delivered for reasons other than the lack of an application at the destination port (Linux only).,-1,system,udp in errors
system.net.udp.no_ports,gauge,,datagram,second,The rate of received UDP datagrams for which there was no application at the destination port (Linux only).,-1,system,udp no_ports
system.net.udp.no_ports.count,count,,datagram,,Total number of received UDP datagrams for which there was no application at the destination port (Linux only).,-1,system,udp no_ports
system.net.udp.out_datagrams,gauge,,datagram,second,The rate of UDP datagrams sent from this entity (Linux only).,0,system,udp out datagrams
system.net.udp.out_datagrams.count,count,,datagram,,Total number of UDP datagrams sent from this entity (Linux only).,0,system,udp out datagrams
system.net.udp.rcv_buf_errors,gauge,,error,second,The rate of UDP datagrams lost because there was no room in the receive buffer (Linux only).,-1,system,udp rcv buf errs
system.net.udp.rcv_buf_errors.count,count,,error,,Total number of UDP datagrams lost because there was no room in the receive buffer (Linux only).,-1,system,udp rcv buf errs
system.net.udp.snd_buf_errors,gauge,,error,second,The rate of UDP datagrams lost because there was no room in the send buffer (Linux only).,-1,system,udp snd buf errs
system.net.udp.snd_buf_errors.count,count,,error,,Total number of UDP datagrams lost because there was no room in the send buffer (Linux only).,-1,system,udp snd buf errs
system.net.udp.in_csum_errors.count,count,,error,,Total number of UDP datagrams that failed checksum verification (Linux only).,-1,system,udp in csum errors
