metric_name,metric_type,interval,unit_name,per_unit_name,description,orientation,integration,short_name
vsphere.vmop.numDeploy.latest,gauge,,operation,,Number of virtual machine template deploy operations,0,vsphere,vmop numDeploy
vsphere.vmop.numDestroy.latest,gauge,,operation,,Number of virtual machine delete operations,0,vsphere,vmop numDestroy
vsphere.vmop.numPoweroff.latest,gauge,,operation,,Number of virtual machine power off operations,0,vsphere,vmop numPoweroff
vsphere.vmop.numPoweron.latest,gauge,,operation,,Number of virtual machine power on operations,0,vsphere,vmop numPoweron
vsphere.vmop.numRebootGuest.latest,gauge,,operation,,Number of virtual machine guest reboot operations,0,vsphere,vmop numRebootGuest
vsphere.vmop.numReconfigure.latest,gauge,,operation,,Number of virtual machine reconfigure operations,0,vsphere,vmop numReconfigure
vsphere.vmop.numRegister.latest,gauge,,operation,,Number of virtual machine register operations,0,vsphere,vmop numRegister
vsphere.vmop.numReset.latest,gauge,,operation,,Number of virtual machine reset operations,0,vsphere,vmop numReset
vsphere.vmop.numSVMotion.latest,gauge,,operation,,Number of migrations with Storage vMotion (datastore change operations for powered-on VMs),0,vsphere,vmop numSVMotion
vsphere.vmop.numShutdownGuest.latest,gauge,,operation,,Number of virtual machine guest shutdown operations,0,vsphere,vmop numShutdownGuest
vsphere.vmop.numStandbyGuest.latest,gauge,,operation,,Number of virtual machine standby guest operations,0,vsphere,vmop numStandbyGuest
vsphere.vmop.numSuspend.latest,gauge,,operation,,Number of virtual machine suspend operations,0,vsphere,vmop numSuspend
vsphere.vmop.numUnregister.latest,gauge,,operation,,Number of virtual machine unregister operations,0,vsphere,vmop numUnregister
vsphere.vmop.numVMotion.latest,gauge,,operation,,Number of migrations with vMotion (host change operations for powered-on VMs),0,vsphere,vmop numVMotion
vsphere.vmop.numXVMotion.latest,gauge,,operation,,Number of host and datastore change operations for powered-on and suspended virtual machines,0,vsphere,vmop numXVMotion
