metric_name,metric_type,interval,unit_name,per_unit_name,description,orientation,integration,short_name,curated_metric
openstack.octavia.amphora.request_errors,gauge,,request,,The total requests that were unable to be fulfilled.,0,openstack_controller,octavia amphora request errors,
openstack.octavia.amphora.total_connections,gauge,,connection,,The total connections handled.,0,openstack_controller,octavia amphora total conn,
openstack.octavia.healthmonitor.admin_state_up,gauge,,,,"The administrative state of the resource, 1 if up, 0 otherwise.",0,openstack_controller,octavia health up,
openstack.octavia.healthmonitor.delay,gauge,,second,,"The time, in seconds, between sending probes to members.",0,openstack_controller,octavia health delay,
openstack.octavia.healthmonitor.max_retries_down,gauge,,,,"The number of allowed check failures before changing the operating status of the member to ERROR.",0,openstack_controller,octavia health max retry down,
openstack.octavia.healthmonitor.max_retries,gauge,,,,"The number of successful checks before changing the operating status of the member to ONLINE.",0,openstack_controller,octavia health max retry,
openstack.octavia.healthmonitor.timeout,gauge,,second,,"The maximum time, in seconds, that a monitor waits to connect before it times out. This value must be less than the delay value.",0,openstack_controller,octavia health timeout,
openstack.octavia.listener.active_connections,gauge,,connection,,"The currently active connections.",0,openstack_controller,octavia listener active conn,
openstack.octavia.listener.bytes_in,gauge,,byte,,The total bytes received.,0,openstack_controller,octavia listener bytes in,
openstack.octavia.listener.bytes_out,gauge,,byte,,The total bytes sent.,0,openstack_controller,octavia listener bytes out,
openstack.octavia.listener.connection_limit,gauge,,connection,,"The maximum number of connections permitted for this listener. Default value is -1 which represents infinite connections or a default value defined by the provider driver.",0,openstack_controller,octavia listener conn lim,
openstack.octavia.listener.request_errors,gauge,,byte,,The total requests that were unable to be fulfilled.,0,openstack_controller,octavia listener request errors,
openstack.octavia.listener.timeout_client_data,gauge,,millisecond,,Frontend client inactivity timeout in milliseconds. Default is 50000.,0,openstack_controller,octavia listener timeout client,
openstack.octavia.listener.timeout_member_connect,gauge,,millisecond,,Backend member connection timeout in milliseconds. Default is 5000.,0,openstack_controller,octavia listener timeout member conn,
openstack.octavia.listener.timeout_member_data,gauge,,millisecond,,Backend member inactivity timeout in milliseconds. Default is 50000.,0,openstack_controller,octavia listener timeout member data,
openstack.octavia.listener.timeout_tcp_inspect,gauge,,millisecond,,"Time, in milliseconds, to wait for additional TCP packets for content inspection. Default is 0.",0,openstack_controller,octavia listener timeout tcp inspect,
openstack.octavia.listener.total_connections,gauge,,connection,,The total connections handled.,0,openstack_controller,octavia listener timeout tcp conn,
openstack.octavia.loadbalancer.admin_state_up,gauge,,,,"The administrative state of the resource, which is 1 if up, 0 otherwise.",0,openstack_controller,octavia lb admin state,
openstack.octavia.loadbalancer.stats.active_connections,gauge,,connection,,The currently active connections.,0,openstack_controller,octavia lb active conn,
openstack.octavia.loadbalancer.stats.bytes_in,gauge,,byte,,"The total bytes received.",0,openstack_controller,octavia lb bytes in,
openstack.octavia.loadbalancer.stats.bytes_out,gauge,,byte,,"The total bytes sent.",0,openstack_controller,octavia lb bytes out,
openstack.octavia.loadbalancer.stats.request_errors,gauge,,request,,"The total requests that were unable to be fulfilled.",0,openstack_controller,octavia lb request errors,
openstack.octavia.loadbalancer.stats.total_connections,gauge,,connection,,"The total connections handled.",0,openstack_controller,octavia lb total conn,
openstack.octavia.member.admin_state_up,gauge,,,,"The administrative state of the resource, which is 1 if up, 0 otherwise.",0,openstack_controller,octavia mem admin state,
openstack.octavia.member.weight,gauge,,,,"The portion of requests or connections the member services compared to the other members of the pool.",0,openstack_controller,octavia mem weight,
openstack.octavia.pool.admin_state_up,gauge,,,,"The administrative state of the resource, which is 1 if up, 0 otherwise.",0,openstack_controller,octavia pool admin state,
openstack.cinder.response_time,gauge,,millisecond,,"The response time of the Cinder API in milliseconds",0,openstack_controller,cinder response,
