metric_name,metric_type,interval,unit_name,per_unit_name,description,orientation,integration,short_name
yarn.metrics.apps_submitted,gauge,,task,,The number of submitted apps,0,yarn,yarn app submitted
yarn.metrics.apps_completed,gauge,,task,,The number of completed apps,0,yarn,yarn app compleated
yarn.metrics.apps_pending,gauge,,task,,The number of pending apps,0,yarn,yarn app pending
yarn.metrics.apps_running,gauge,,task,,The number of running apps,0,yarn,yarn app running
yarn.metrics.apps_failed,gauge,,task,,The number of failed apps,0,yarn,yarn app failed
yarn.metrics.apps_killed,gauge,,task,,The number of killed apps,0,yarn,app klld
yarn.metrics.reserved_mb,gauge,,mebibyte,,The size of reserved memory,0,yarn,mem rsvd
yarn.metrics.available_mb,gauge,,mebibyte,,The amount of available memory,0,yarn,mem avbl
yarn.metrics.allocated_mb,gauge,,mebibyte,,The amount of allocated memory,0,yarn,mem alloc
yarn.metrics.total_mb,gauge,,mebibyte,,The amount of total memory,0,yarn,mem tot
yarn.metrics.reserved_virtual_cores,gauge,,core,,The number of reserved virtual cores,0,yarn,cor rsvd
yarn.metrics.available_virtual_cores,gauge,,core,,The number of available virtual cores,0,yarn,cor avail
yarn.metrics.allocated_virtual_cores,gauge,,core,,The number of allocated virtual cores,0,yarn,cor alloc
yarn.metrics.total_virtual_cores,gauge,,core,,The total number of virtual cores,0,yarn,cor tot
yarn.metrics.containers_allocated,gauge,,,,The number of containers allocated,0,yarn,ctrs alloc
yarn.metrics.containers_reserved,gauge,,,,The number of containers reserved,0,yarn,ctrs resv
yarn.metrics.containers_pending,gauge,,,,The number of containers pending,0,yarn,ctrs pdg
yarn.metrics.total_nodes,gauge,,node,,The total number of nodes,0,yarn,nds tot
yarn.metrics.active_nodes,gauge,,node,,The number of active nodes,0,yarn,nds act
yarn.metrics.lost_nodes,gauge,,node,,The number of lost nodes,0,yarn,nds lst
yarn.metrics.unhealthy_nodes,gauge,,node,,The number of unhealthy nodes,0,yarn,nds unhlthy
yarn.metrics.decommissioned_nodes,gauge,,node,,The number of decommissioned nodes,0,yarn,nds decomm
yarn.metrics.rebooted_nodes,gauge,,node,,The number of rebooted nodes,0,yarn,nds rbtd
yarn.apps.progress_gauge,gauge,,percent,,The progress of the application as a percent,0,yarn,app prog
yarn.apps.started_time_gauge,gauge,,millisecond,,The time in which application started (in ms since epoch),0,yarn,app strt tim g
yarn.apps.finished_time_gauge,gauge,,millisecond,,The time in which the application finished (in ms since epoch),0,yarn,app fin tim g
yarn.apps.elapsed_time_gauge,gauge,,millisecond,,The elapsed time since the application started (in ms),0,yarn,app elapsd tm g
yarn.apps.allocated_mb_gauge,gauge,,mebibyte,,The sum of memory in MB allocated to the applications running containers,0,yarn,app mem alloc g
yarn.apps.allocated_vcores_gauge,gauge,,core,,The sum of virtual cores allocated to the applications running containers,0,yarn,app cros alloc g
yarn.apps.running_containers_gauge,gauge,,container,,The number of containers currently running for the application,0,yarn,app ctrs rrun g
yarn.apps.memory_seconds_gauge,gauge,,mebibyte,second,The amount of memory the application has allocated (megabyte-seconds),0,yarn,app mem tm g
yarn.apps.vcore_seconds_gauge,gauge,,core,second,The amount of CPU resources the application has allocated (virtual core-seconds),0,yarn,app cor tm g
yarn.apps.progress,rate,,percent,,Deprecated use yarn.apps.progress_gauge instead,0,yarn,app prog
yarn.apps.started_time,rate,,second,,Deprecated use yarn.apps.started_time_gauge instead,0,yarn,app strt tim
yarn.apps.finished_time,rate,,second,,Deprecated use yarn.apps.finished_time_gauge instead,0,yarn,app fin tim
yarn.apps.elapsed_time,rate,,second,,Deprecated use yarn.apps.elapsed_time_gauge instead,0,yarn,app elapsd tm
yarn.apps.allocated_mb,rate,,mebibyte,,Deprecated use yarn.apps.allocated_mb_gauge instead,0,yarn,app mem alloc
yarn.apps.allocated_vcores,rate,,core,,Deprecated use yarn.apps.allocated_vcores_gauge instead,0,yarn,app cros alloc
yarn.apps.running_containers,rate,,,,Deprecated use yarn.apps.running_containers_gauge instead,0,yarn,app ctrs rrun
yarn.apps.memory_seconds,rate,,second,,Deprecated use yarn.apps.memory_seconds_gauge instead,0,yarn,app mem tm
yarn.apps.vcore_seconds,rate,,second,,Deprecated use yarn.apps.vcore_seconds_gauge instead,0,yarn,app cor tm
yarn.node.last_health_update,gauge,,millisecond,,The last time the node reported its health (in ms since epoch),0,yarn,nd lst hlth updt
yarn.node.used_memory_mb,gauge,,mebibyte,,The total amount of memory currently used on the node (in MB),0,yarn,nd mem usd
yarn.node.avail_memory_mb,gauge,,mebibyte,,The total amount of memory currently available on the node (in MB),0,yarn,nd mem avail
yarn.node.used_virtual_cores,gauge,,core,,The total number of vCores currently used on the node,0,yarn,nd cor usd
yarn.node.available_virtual_cores,gauge,,core,,The total number of vCores available on the node,0,yarn,nd cor avail
yarn.node.num_containers,gauge,,,,The total number of containers currently running on the node,0,yarn,nd ctrs tot
yarn.queue.root.max_capacity,gauge,,percent,,The configured maximum queue capacity in percentage for root queue,0,yarn,q root max cap
yarn.queue.root.used_capacity,gauge,,percent,,The used queue capacity in percentage for root queue,0,yarn,q root usd cap
yarn.queue.root.capacity,gauge,,percent,,The configured queue capacity in percentage for root queue,0,yarn,q root cap
yarn.queue.num_pending_applications,gauge,,task,,The number of pending applications in this queue,0,yarn,q pnd apps
yarn.queue.user_am_resource_limit.memory,gauge,,mebibyte,,The maximum memory resources a user can use for Application Masters (in MB),0,yarn,q usr am res lm m
yarn.queue.user_am_resource_limit.vcores,gauge,,core,,The maximum vCpus a user can use for Application Masters,0,yarn,q usr am res lm c
yarn.queue.absolute_capacity,gauge,,percent,,The absolute capacity percentage this queue can use of entire cluster,0,yarn,q abs cap
yarn.queue.user_limit_factor,gauge,,,,The minimum user limit percent set in the configuration,0,yarn,q usr lm fac
yarn.queue.user_limit,gauge,,,,The user limit factor set in the configuration,0,yarn,q usr lm
yarn.queue.num_applications,gauge,,task,,The number of applications currently in the queue,0,yarn,q num app
yarn.queue.used_am_resource.memory,gauge,,mebibyte,,The memory resources used for Application Masters (in MB),0,yarn,q usd am res m
yarn.queue.used_am_resource.vcores,gauge,,core,,The vCpus used for Application Masters,0,yarn,q usd am res c
yarn.queue.absolute_used_capacity,gauge,,percent,,The absolute used capacity percentage this queue is using of the entire cluster,0,yarn,q abs used cap
yarn.queue.resources_used.memory,gauge,,mebibyte,,The total memory resources this queue is using (in MB),0,yarn,q res usd m
yarn.queue.resources_used.vcores,gauge,,core,,The total vCpus this queue is using,0,yarn,q res usd c
yarn.queue.am_resource_limit.vcores,gauge,,core,,The maximum vCpus this queue can use for Application Masters,0,yarn,q am res lim c
yarn.queue.am_resource_limit.memory,gauge,,mebibyte,,The maximum memory resources this queue can use for Application Masters (in MB),0,yarn,q am res lim m
yarn.queue.capacity,gauge,,percent,,The configured queue capacity in percentage relative to its parent queue,0,yarn,q cap
yarn.queue.num_active_applications,gauge,,task,,The number of active applications in this queue,0,yarn,q num act apps
yarn.queue.absolute_max_capacity,gauge,,percent,,The absolute maximum capacity percentage this queue can use of the entire cluster,0,yarn,q abs max cap
yarn.queue.used_capacity,gauge,,percent,,The used queue capacity in percentage,0,yarn,q usd cap
yarn.queue.num_containers,gauge,,,,The number of containers being used,0,yarn,q num cont
yarn.queue.max_capacity,gauge,,percent,,The configured maximum queue capacity in percentage relative to its parent queue,0,yarn,q max cap
yarn.queue.max_applications,gauge,,task,,The maximum number of applications this queue can have,0,yarn,q max app
yarn.queue.max_applications_per_user,gauge,,task,,The maximum number of active applications per user this queue can have,0,yarn,q max app usr
