metric_name,metric_type,interval,unit_name,per_unit_name,description,orientation,integration,short_name,curated_metric
sqlserver.access.extent_deallocations_rate,gauge,,operation,second,The number of extends deallocated per second.,0,sql_server,extents deallocated/s,
sqlserver.access.extents_allocated_rate,gauge,,operation,second,The number of extends allocated per second.,0,sql_server,extents allocated/s,
sqlserver.access.full_scans_rate,gauge,,scan,second,The number of full scans per second.,0,sql_server,full scans/s,
sqlserver.access.index_searches_rate,gauge,,operation,second,The number of index searches per second.,0,sql_server,index searches/s,
sqlserver.access.mixed_page_allocations_rate,gauge,,operation,second,The number of mixed page allocations per second.,0,sql_server,mixed allocations/s,
sqlserver.access.page_splits,gauge,,operation,second,The number of page splits per second.,-1,sql_server,page splits,
sqlserver.access.pages_allocated_rate,gauge,,page,second,The number of pages allocated per second.,0,sql_server,pages allocated/s,
sqlserver.access.page_deallocations_rate,gauge,,page,second,The number of pages deallocated per second.,0,sql_server,page deallocations/s,
sqlserver.access.probe_scans_rate,gauge,,scan,second,The number of probe scans per second.,0,sql_server,probe scans/s,
sqlserver.access.range_scans_rate,gauge,,scan,second,The number of range scans per second.,0,sql_server,range scans/s,
sqlserver.access.table_lock_escalations_rate,gauge,,scan,second,The number of table lock escalations per second.,0,sql_server,table lock escalations/s,
sqlserver.access.worktables_created_rate,gauge,,table,second,The number of worktables created per second.,0,sql_server,worktables/s,
sqlserver.ao.ag_sync_health,gauge,,,,"Availability group synchronization health: 0 = Not healthy, 1 = Partially healthy, 2 = Healthy",0,sql_server,ag sync health,
sqlserver.ao.replica_sync_state,gauge,,,,"Replica synchronization state: 0 = Not synchronizing, 1 = Synchronizing, 2 = Synchronized, 3 = Reverting, 4 = Initializing",0,sql_server,replica sync state,
sqlserver.ao.replica_failover_mode,gauge,,,,"Replica failover mode: 0 = Automatic failover, 1 = Manual failover",0,sql_server,replica failover mode,
sqlserver.ao.replica_failover_readiness,gauge,,,,"Replica failover readiness: 0 = Not ready for failover, 1 = Ready for failover",0,sql_server,replica failover readiness,
sqlserver.ao.primary_replica_health,gauge,,,,"Recovery health of primary replica: 0 = In progress, 1 = Online. The metric is not emitted if on a secondary replica",0,sql_server,primary replica health,
sqlserver.ao.secondary_replica_health,gauge,,,,"Recovery health of secondary replica: 0 = In progress, 1 = Online. The metric is not emitted if on a primary replica",0,sql_server,secondary replica health,
sqlserver.buffer.cache_hit_ratio,gauge,,fraction,,The ratio of data pages found and read from the buffer cache over all data page requests.,1,sql_server,buff hit ratio,
sqlserver.buffer.checkpoint_pages,gauge,,page,second,The number of pages flushed to disk per second by a checkpoint or other operation that require all dirty pages to be flushed.,-1,sql_server,checkpoint pages,
sqlserver.buffer.page_life_expectancy,gauge,,second,,Duration that a page resides in the buffer pool.,1,sql_server,buff page life expectancy,
sqlserver.buffer.page_reads,gauge,,page,,Indicates the number of physical database page reads that are issued per second. This statistic displays the total number of physical page reads across all databases.,-1,sql_server,buff page reads,
sqlserver.buffer.page_writes,gauge,,page,,Indicates the number of physical database page writes that are issued per second.,-1,sql_server,buff page writes,
sqlserver.stats.batch_requests,gauge,,request,second,The number of batch requests per second.,1,sql_server,batch requests,
sqlserver.stats.sql_compilations,gauge,,operation,second,The number of SQL compilations per second.,0,sql_server,sql compils,
sqlserver.stats.sql_recompilations,gauge,,operation,second,The number of SQL re-compilations per second.,-1,sql_server,sql recompils,
sqlserver.stats.connections,gauge,,connection,,"The number of user connections. If DBM is enabled, this metric is tagged with status, db, and user.",0,sql_server,conns,
sqlserver.stats.lock_waits,gauge,,lock,second,The number of times per second that SQL Server is unable to retain a lock right away for a resource.,-1,sql_server,lock waits,
sqlserver.stats.procs_blocked,gauge,,process,,The number of processes blocked.,-1,sql_server,procs blocked,
sqlserver.stats.auto_param_attempts,gauge,,attempt,,Number of auto-parameterization attempts per second.,-1,sql_server,stats auto param,
sqlserver.stats.failed_auto_param_attempts,gauge,,attempt,,Number of failed auto-parameterization attempts per second.,-1,sql_server,stats failed auto param,
sqlserver.stats.safe_auto_param_attempts,gauge,,attempt,,Number of safe auto-parameterization attempts per second.,0,sql_server,stats safe auto param,
sqlserver.cache.object_counts,gauge,,object,,Number of cache objects in the cache.,0,sql_server,cache obj counts,
sqlserver.cache.pages,gauge,,object,,Number of 8-kilobyte (KB) pages used by cache objects.,0,sql_server,cache pages,
sqlserver.database.backup_restore_throughput,gauge,,,,Read/write throughput for backup and restore operations of a database per second.,0,sql_server,database restore throughput,
sqlserver.database.log_bytes_flushed,gauge,,byte,,Total number of log bytes flushed.,0,sql_server,database log byte flushed,
sqlserver.database.log_flushes,gauge,,flush,,Number of log flushes per second.,0,sql_server,database log flushes,
sqlserver.database.log_flush_wait,gauge,,millisecond,,"Total wait time (in milliseconds) to flush the log. On an Always On secondary database, this value indicates the wait time for log records to be hardened to disk.",-1,sql_server,database log flush wait time,
sqlserver.database.transactions,gauge,,transaction,,Number of transactions started for the SQL Server instance per second.,0,sql_server,database trans,
sqlserver.database.write_transactions,gauge,,transaction,,"Number of transactions that wrote to all databases on the SQL Server instance and committed, in the last second.",0,sql_server,database trans write,
sqlserver.database.state,gauge,,,,"Database state: 0 = Online, 1 = Restoring, 2 = Recovering, 3 = Recovery_Pending, 4 = Suspect, 5 = Emergency, 6 = Offline, 7 = Copying, 10 = Offline_Secondary",0,sql_server,database state,
sqlserver.database.files.size,gauge,,kibibyte,,Current size of the database file,0,sql_server,database file size,
sqlserver.database.files.state,gauge,,,,"Database file state: 0 = Online, 1 = Restoring, 2 = Recovering, 3 = Recovery_Pending, 4 = Suspect, 5 = Unknown, 6 = Offline, 7 = Defunct",0,sql_server,database file status,
sqlserver.database.master_files.size,gauge,,kibibyte,,"Current size of the database file. For a database snapshot, size reflects the maximum space that the snapshot can ever use for the file. **Note**: Use `sqlserver.database.files.size` for the actual size of FILESTREAM containers.",0,sql_server,database master file size,
sqlserver.database.master_files.state,gauge,,,,"Database file state: 0 = Online, 1 = Restoring, 2 = Recovering, 3 = Recovery_Pending, 4 = Suspect, 5 = Unknown, 6 = Offline, 7 = Defunct",0,sql_server,database master file status,
sqlserver.database.active_transactions,gauge,,transaction,,Number of active transactions across all databases on the SQL Server instance.,0,sql_server,database trans active,
sqlserver.database.avg_fragment_size_in_pages,gauge,,,,"The average number of pages in one fragment on the leaf level of an IN_ROW_DATA allocation unit.",0,sql_server,avg fragment size in pages,
sqlserver.database.avg_fragmentation_in_percent,gauge,,,,"Logical fragmentation for indexes, or extent fragmentation for heaps in the IN_ROW_DATA allocation unit.",0,sql_server,avg fragmentation percent,
sqlserver.database.backup_count,gauge,,,,"The total count of successful backups made for a database.",0,sql_server,backup count,
sqlserver.database.fragment_count,gauge,,,,"The number of fragments in the leaf level of an IN_ROW_DATA allocation unit.",0,sql_server,fragment count,
sqlserver.database.is_sync_with_backup,gauge,,,,"Whether or not the database is marked for replication synchronization with backup. 0 = Not marked for replication sync, 1 = Marked for replication sync.",0,sql_server,is sync with backup,
sqlserver.deadlocks_rate,gauge,,lock,second,The number of deadlocks observed per second.,0,sql_server,deadlocks/s,
sqlserver.files.reads,count,,read,second,"Number of reads issued on the file. Tags: `logical_name`, `file_location`, `db`, `state`",0,sql_server,reads on database file,
sqlserver.files.read_bytes,count,,byte,second,"Bytes read from the file. Tags: `logical_name`, `file_location`, `db`, `state`",0,sql_server,bytes read from database file,
sqlserver.files.read_io_stall,count,,millisecond,,"Total time that users waited for reads on the file. Tags: `logical_name`, `file_location`, `db`, `state`",-1,sql_server,read wait time on database file,
sqlserver.files.read_io_stall_queued,count,,millisecond,,"Total latency from IO governance pools for reads on the file. Tags: `logical_name`, `file_location`, `db`, `state`",-1,sql_server,read io queue time on database file,
sqlserver.files.writes,count,,write,second,"Number of writes issued on the file. Tags: `logical_name`, `file_location`, `db`, `state`",0,sql_server,writes on database file,
sqlserver.files.written_bytes,count,,byte,second,"Bytes written to the file. Tags: `logical_name`, `file_location`, `db`, `state`",0,sql_server,bytes written to the database file,
sqlserver.files.write_io_stall,count,,millisecond,,"Total time that users waited for writes on the file. Tags: `logical_name`, `file_location`, `db`, `state`",-1,sql_server,write wait time on database file,
sqlserver.files.write_io_stall_queued,count,,millisecond,,"Total latency from IO governance pools for writes on the file. Tags: `logical_name`, `file_location`, `db`, `state`",-1,sql_server,write io queue time on database file,
sqlserver.files.io_stall,count,,millisecond,,"Total time that users waited for I/O to complete on the file. Tags: `logical_name`, `file_location`, `db`, `state`",-1,sql_server,io wait time on database file,
sqlserver.files.size_on_disk,gauge,,byte,,"Number of bytes used on the disk for this file. Tags: `logical_name`, `file_location`, `db`, `state`",0,sql_server,bytes used for database file,
sqlserver.latches.latch_waits_rate,gauge,,operation,second,The number of latch waits per second.,0,sql_server,latch waits/s,
sqlserver.latches.superlatch_promotions_rate,gauge,,operation,second,The number of latches promoted to superlatches per second.,0,sql_server,superlatch promotions/s,
sqlserver.latches.superlatch_demotions_rate,gauge,,operation,second,The number of superlatches demoted per second.,0,sql_server,superlatch demotions/s,
sqlserver.latches.superlatches,gauge,,operation,second,The number of latches which are currently superlatches.,0,sql_server,superlatches,
sqlserver.memory.memory_grants_pending,gauge,,,,Specifies the total number of processes waiting for a workspace memory grant,0,sql_server,memory grant pending,
sqlserver.memory.total_server_memory,gauge,,kibibyte,,Specifies the amount of memory the server has committed using the memory manager.,0,sql_server,memory total,
sqlserver.scheduler.current_tasks_count,gauge,,task,,Number of current tasks that are associated with this scheduler.,0,sql_server,task count,
sqlserver.scheduler.current_workers_count,gauge,,worker,,Number of workers that are associated with this scheduler.,0,sql_server,worker count,
sqlserver.scheduler.active_workers_count,gauge,,worker,,"Number of workers that are active. An active worker is never preemptive, must have an associated task, and is either running, runnable, or suspended.",0,sql_server,active worker,
sqlserver.scheduler.runnable_tasks_count,gauge,,task,,"Number of workers, with tasks assigned to them, that are waiting to be scheduled on the runnable queue.",0,sql_server,runnable task,
sqlserver.scheduler.work_queue_count,gauge,,unit,,Number of tasks in the pending queue. These tasks are waiting for a worker to pick them up.,0,sql_server,work queue,
sqlserver.task.context_switches_count,gauge,,unit,,Number of scheduler context switches that this task has completed.,0,sql_server,context switch,
sqlserver.task.pending_io_count,gauge,,unit,,Number of physical I/Os that are performed by this task.,0,sql_server,task io pending,
sqlserver.task.pending_io_byte_count,gauge,,byte,,Total byte count of I/Os that are performed by this task.,0,sql_server,task io byte,
sqlserver.task.pending_io_byte_average,gauge,,byte,,Average byte count of I/Os that are performed by this task.,0,sql_server,task avg io byte,
sqlserver.temp_tables_active,gauge,,table,,The number of temp tables currently in use.,0,sql_server,temp tables,
sqlserver.temp_tables_creation_rate,gauge,,table,,The number of temp tables created per second.,0,sql_server,temp tables created/s,
sqlserver.fci.status,gauge,,,,Status of the node in a SQL Server failover cluster instance,0,sql_server,fci status,
sqlserver.fci.is_current_owner,gauge,,,,Whether or not this node is the current owner of the SQL Server FCI ,0,sql_server,fci current owner,
sqlserver.queries.count,count,,query,,Total count of executed queries per query (DBM only),0,sql_server,query count,
sqlserver.queries.time,count,,nanosecond,,Total elapsed time for executed queries per query (DBM only),0,sql_server,query time,
sqlserver.queries.clr_time,count,,nanosecond,,Total time consumed inside Microsoft .NET Framework common language runtime (CLR) objects for executed queries per query (DBM only),0,sql_server,query clr time,
sqlserver.queries.worker_time,count,,nanosecond,,Total CPU time consumed by executed queries per query (DBM only),0,sql_server,query worker time,
sqlserver.queries.rows,count,,row,,Total number of rows returned by executed queries per query (DBM only),0,sql_server,query rows,
sqlserver.queries.physical_reads,count,,read,,Total number of physical reads performed by executed queries per query (DBM only),0,sql_server,query physical reads,
sqlserver.queries.logical_reads,count,,read,,Total number of logical reads performed by executed queries per query (DBM only),0,sql_server,query logical reads,
sqlserver.queries.logical_writes,count,,write,,Total number of logical writes performed by executed queries per query (DBM only),0,sql_server,query logical writes,
sqlserver.queries.columnstore_segment_reads,count,,segment,,Total columnstore segments read by executed queries per query (DBM only),0,sql_server,query columnstore segment reads,
sqlserver.queries.columnstore_segment_skips,count,,segment,,Total columnstore segments skipped by executed queries per query (DBM only),0,sql_server,query columnstore segment skips,
sqlserver.queries.memory_grant,count,,byte,,The total amount of reserved memory received by executions of this query per query. It will always be 0 for querying a memory-optimized table (DBM only).,0,sql_server,query grant kb,
sqlserver.queries.used_memory_grant,count,,byte,,The total amount of reserved memory used by executions of this query per query. It will always be 0 for querying a memory-optimized table (DBM only).,0,sql_server,query used grant kb,
sqlserver.queries.ideal_memory_grant,count,,byte,,The total amount of ideal memory grant estimated by executions of this query per query (DBM only),0,sql_server,query ideal grant kb,
sqlserver.queries.reserved_threads,count,,thread,,The total sum of reserved parallel threads used by executions of this query per query (DBM only),0,sql_server,query reserved threads,
sqlserver.queries.used_threads,count,,thread,,The total sum of used parallel threads used by executions of this query per query (DBM only),0,sql_server,query used threads,
sqlserver.queries.dop,count,,,,The total sum of degree of parallelism used by executions of this query per query (DBM only),0,sql_server,query dop,
sqlserver.queries.spills,count,,,,The total number of pages spilled by execution of this query per query (DBM only),0,sql_server,query spills,
sqlserver.queries.duration.max,gauge,,nanosecond,,"The age of the longest running query per user, db, and app. (DBM only)",0,sql_server,queries duration max,
sqlserver.queries.duration.sum,gauge,,nanosecond,,"The sum of the age of all running queries per user, db, and app. (DBM only)",0,sql_server,queries duration sum,
