metric_name,metric_type,interval,unit_name,per_unit_name,description,orientation,integration,short_name,curated_metric
postgresql.active_queries,gauge,,,,"Enabled with `collect_activity_metrics`. The number of active queries in this database. This metric (by default) is tagged with db, app, user.",0,postgres,active queries,
postgresql.active_waiting_queries,gauge,,,,"Enabled with `collect_activity_metrics`. The number of waiting queries in this database in state active. This metric (by default) is tagged with db, app, user.",0,postgres,transactions active_waiting queries,
postgresql.activity.backend_xid_age,gauge,,transaction,,"The age of the oldest backend's xid relative to latest stable xid. This metric (by default) is tagged with db, app, user.",-1,postgres,activity xid,
postgresql.activity.backend_xmin_age,gauge,,transaction,,"The age of the oldest backend's xmin horizon relative to latest stable xid. This metric (by default) is tagged with db, app, user.",-1,postgres,activity xmin,
postgresql.activity.xact_start_age,gauge,,second,,"The age of the oldest active transactions. This metric (by default) is tagged with db, app, user.",-1,postgres,activity xact,
postgresql.analyze.child_tables_done,gauge,,,,"Number of child tables scanned. This counter only advances when the phase is acquiring inherited sample rows. This metric is tagged with db, table, child_relation, phase.",0,postgres,postgres analyze child done,
postgresql.analyze.child_tables_total,gauge,,,,"Number of child tables. This metric is tagged with db, table, child_relation, phase.",0,postgres,postgres analyze child total,
postgresql.analyze.ext_stats_computed,gauge,,,,"Number of extended statistics computed. This counter only advances when the phase is computing extended statistics. This metric is tagged with db, table, child_relation, phase.",0,postgres,postgres analyze stats computed,
postgresql.analyze.ext_stats_total,gauge,,,,"Number of extended statistics. This metric is tagged with db, table, child_relation, phase.",0,postgres,postgres analyze stats total,
postgresql.analyze.sample_blks_scanned,gauge,,block,,"Number of heap blocks scanned. This metric is tagged with db, table, child_relation, phase.",0,postgres,postgres analyze blks scanned,
postgresql.analyze.sample_blks_total,gauge,,block,,"Total number of heap blocks that will be sampled. This metric is tagged with db, table, child_relation, phase.",0,postgres,postgres analyze blks total,
postgresql.analyzed,count,,,,"Enabled with `relations`. The number of times this table has been manually analyzed. This metric is tagged with db, schema, table.",0,postgres,analyze,
postgresql.autoanalyzed,count,,,,"Enabled with `relations`. The number of times this table has been analyzed by the autovacuum daemon. This metric is tagged with db, schema, table.",0,postgres,auto analyze,
postgresql.autovacuumed,count,,,,"Enabled with `relations`. The number of times this table has been vacuumed by the autovacuum daemon. This metric is tagged with db, schema, table.",0,postgres,auto vac,
postgresql.before_xid_wraparound,gauge,,transaction,,The number of transactions that can occur until a transaction wraparound.  This metric is tagged with db.,0,postgres,tx before xid wraparound,
postgresql.bgwriter.buffers_alloc,count,,,,The number of buffers allocated,0,postgres,bgw buff alloc,
postgresql.bgwriter.buffers_backend,count,,buffer,,The number of buffers written directly by a backend.,0,postgres,bgw buff bkend,
postgresql.bgwriter.buffers_backend_fsync,count,,,,The of times a backend had to execute its own fsync call instead of the background writer.,0,postgres,bgw buff bkend fsync,
postgresql.bgwriter.buffers_checkpoint,count,,,,The number of buffers written during checkpoints.,0,postgres,bgw buff cp,
postgresql.bgwriter.buffers_clean,count,,,,The number of buffers written by the background writer.,0,postgres,bgw buff clean,
postgresql.bgwriter.checkpoints_requested,count,,,,The number of requested checkpoints that were performed.,0,postgres,bgw cp req,
postgresql.bgwriter.checkpoints_timed,count,,,,The number of scheduled checkpoints that were performed.,0,postgres,bgw cp timed,
postgresql.bgwriter.maxwritten_clean,count,,,,The number of times the background writer stopped a cleaning scan due to writing too many buffers.,0,postgres,bgw maxwr clean,
postgresql.bgwriter.sync_time,count,,millisecond,,The total amount of checkpoint processing time spent synchronizing files to disk.,0,postgres,bgw sync time,
postgresql.bgwriter.write_time,count,,millisecond,,The total amount of checkpoint processing time spent writing files to disk.,0,postgres,bgw wrt time,
postgresql.buffer_hit,gauge,,hit,second,"The number of times disk blocks were found in the buffer cache, preventing the need to read from the database. This metric is tagged with db.",1,postgres,buff hit,
postgresql.checksums.checksum_failures,count,,,,"The number of checksum failures in this database. This metric is tagged with db.",0,postgres,checksums,
postgresql.checksums.enabled,count,,,,"Whether database checksums are enabled. Value is always 1 and tagged with enabled:true or enabled:false. This metric is tagged with db.",0,postgres,checksums.enabled,
postgresql.cluster_vacuum.heap_blks_scanned,gauge,,block,,"Number of heap blocks scanned. This counter only advances when the phase is seq scanning heap. Only available with PostgreSQL 12 and newer. This metric is tagged with db, table, command, phase, index.",0,postgres,postgres cluster blk_scanned,
postgresql.cluster_vacuum.heap_blks_total,gauge,,block,,"Total number of heap blocks in the table. This number is reported as of the beginning of seq scanning heap. Only available with PostgreSQL 12 and newer. This metric is tagged with db, table, command, phase, index.",0,postgres,postgres cluster blk_total,
postgresql.cluster_vacuum.heap_tuples_scanned,gauge,,,,"Number of heap tuples scanned. This counter only advances when the phase is seq scanning heap, index scanning heap or writing new heap. Only available with PostgreSQL 12 and newer. This metric is tagged with db, table, command, phase, index.",0,postgres,postgres cluster tuple_scanned,
postgresql.cluster_vacuum.heap_tuples_written,gauge,,,,"Number of heap tuples written. This counter only advances when the phase is seq scanning heap, index scanning heap or writing new heap. Only available with PostgreSQL 12 and newer. This metric is tagged with db, table, command, phase, index.",0,postgres,postgres cluster tuple_written,
postgresql.cluster_vacuum.index_rebuild_count,gauge,,,,"Number of indexes rebuilt. This counter only advances when the phase is rebuilding index. Only available with PostgreSQL 12 and newer. This metric is tagged with db, table, command, phase, index.",0,postgres,postgres cluster rebuild_count,
postgresql.commits,gauge,,transaction,second,The number of transactions that have been committed in this database. This metric is tagged with db.,0,postgres,commits,
postgresql.conflicts.bufferpin,count,,query,,Number of queries in this database that have been canceled due to pinned buffers. Buffer pin conflicts will occur when the walreceiver process tries to apply a buffer cleanup like HOT chain pruning. This require a complete lock of the buffer and any query pinning the buffer will conflict with the cleaning. This metric is tagged with db.,-1,postgres,cfl bufferpin,
postgresql.conflicts.deadlock,count,,query,,"Number of queries in this database that have been canceled due to deadlocks. Deadlock conflicts will happen when the walreceiver tries to apply a buffer like HOT chain pruning. If the conflict takes more than deadlock_timeout seconds, a deadlock check will be triggered and conflicting queries will be canceled until the buffer is unpinned. This metric is tagged with db.",-1,postgres,cfl deadlock,
postgresql.conflicts.lock,count,,query,,Number of queries in this database that have been canceled due to lock timeouts. This will occur when the walreceiver process tries to apply a change requiring an ACCESS EXCLUSIVE lock while a query on the replica is reading the table. The conflicting query will be killed after waiting up to max_standby_streaming_delay seconds. This metric is tagged with db.,-1,postgres,cfl lock,
postgresql.conflicts.snapshot,count,,query,,"Number of queries in this database that have been canceled due to old snapshots. Snapshot conflict will occur when a VACUUM is replayed, removing tuples currently read on a standby. This metric is tagged with db.",-1,postgres,cfl snapshot,
postgresql.conflicts.tablespace,count,,query,,Number of queries in this database that have been canceled due to dropped tablespaces. This will occur when a temp_tablespace is dropped while being used on a standby. This metric is tagged with db.,-1,postgres,cfl tablespace,
postgresql.connections,gauge,,connection,,"The number of active connections to this database. If DBM is enabled, this metric is tagged with state, app, db and user",0,postgres,conns,
postgresql.control.checkpoint_delay,gauge,,second,,The time since the last checkpoint.,0,postgres,control checkpoint,
postgresql.control.timeline_id,gauge,,,,The current timeline id.,0,postgres,control tid,
postgresql.create_index.blocks_done,gauge,,,,"Number of blocks already processed in the current phase. Only available with PostgreSQL 12 and newer. This metric is tagged with db, table, index, command, phase.",0,postgres,postgres index blocks done,
postgresql.create_index.blocks_total,gauge,,,,"Total number of blocks to be processed in the current phase. Only available with PostgreSQL 12 and newer. This metric is tagged with db, table, index, command, phase.",0,postgres,postgres index blocks total,
postgresql.create_index.lockers_done,gauge,,,,"Number of lockers already waited for. Only available with PostgreSQL 12 and newer. This metric is tagged with db, table, index, command, phase.",0,postgres,postgres index lockers done,
postgresql.create_index.lockers_total,gauge,,,,"Total number of lockers to wait for, when applicable. Only available with PostgreSQL 12 and newer. This metric is tagged with db, table, index, command, phase.",0,postgres,postgres index lockers total,
postgresql.create_index.partitions_done,gauge,,,,"When creating an index on a partitioned table, this column is set to the number of partitions on which the index has been created. This field is 0 during a REINDEX. Only available with PostgreSQL 12 and newer. This metric is tagged with db, table, index, command, phase.",0,postgres,postgres index partitions done,
postgresql.create_index.partitions_total,gauge,,,,"When creating an index on a partitioned table, this column is set to the total number of partitions on which the index is to be created. This field is 0 during a REINDEX. Only available with PostgreSQL 12 and newer. This metric is tagged with db, table, index, command, phase.",0,postgres,postgres index partitions total,
postgresql.create_index.tuples_done,gauge,,,,"Number of tuples already processed in the current phase. Only available with PostgreSQL 12 and newer. This metric is tagged with db, table, index, command, phase.",0,postgres,postgres index tuples done,
postgresql.create_index.tuples_total,gauge,,,,"Total number of tuples to be processed in the current phase. Only available with PostgreSQL 12 and newer. This metric is tagged with db, table, index, command, phase.",0,postgres,postgres index tuples total,
postgresql.database_size,gauge,,byte,,The disk space used by this database. This metric is tagged with db.,0,postgres,db size,
postgresql.db.count,gauge,,item,,The number of available databases.,0,postgres,db cnt,
postgresql.dead_rows,gauge,,row,,"Enabled with `relations`. The estimated number of dead rows. This metric is tagged with db, schema, table.",0,postgres,dead rows,
postgresql.deadlocks,gauge,,lock,second,The rate of deadlocks detected in this database. This metric is tagged with db.,-1,postgres,deadlocks,
postgresql.deadlocks.count,count,,lock,,The number of deadlocks detected in this database. This metric is tagged with db.,-1,postgres,deadlocks.count,
postgresql.disk_read,gauge,,block,second,The number of disk blocks read in this database. This metric is tagged with db.,0,postgres,disk read,
postgresql.function.calls,rate,,,,"Enabled with `collect_function_metrics`. The number of calls made to a function. This metric is tagged with db, schema, function.",0,postgres,postgres_function_calls,
postgresql.function.self_time,rate,,,,"Enabled with `collect_function_metrics`. Total time spent in this function itself, not including other functions called by it. This metric is tagged with db, schema, function.",0,postgres,postgres_function_self_time,
postgresql.function.total_time,rate,,,,"Enabled with `collect_function_metrics`. Total time spent in this function and all other functions called by it. This metric is tagged with db, schema, function.",0,postgres,postgres_function_total_time,
postgresql.heap_blocks_hit,gauge,,hit,second,"Enabled with `relations`. The number of buffer hits in this table. This metric is tagged with db, schema, table.",0,postgres,heap blks hit,
postgresql.heap_blocks_read,gauge,,block,second,"Enabled with `relations`. The number of disk blocks read from this table. This metric is tagged with db, schema, table.",0,postgres,heap blks read,
postgresql.index_bloat,gauge,,percent,,"Enabled with `collect_bloat_metrics`. The estimated percentage of index bloat. This metric is tagged with db, schema, table, index.",0,postgres,ibloat,
postgresql.index_blocks_hit,gauge,,hit,second,"Enabled with `relations`. The number of buffer hits in all indexes on this table. This metric is tagged with db, schema, table.",0,postgres,idx blks hit,
postgresql.index_blocks_read,gauge,,block,second,"Enabled with `relations`. The number of disk blocks read from all indexes on this table. This metric is tagged with db, schema, table.",0,postgres,idx blks read,
postgresql.index_rel_rows_fetched,gauge,,row,second,"Enabled with `relations`. The number of live rows fetched by index scans. This metric is tagged with db, schema, table.",0,postgres,idx rows fetch,
postgresql.index_rel_scans,gauge,,scan,second,"Enabled with `relations`. The overall number of index scans initiated on this table. This metric is tagged with db, schema, table.",0,postgres,idx scans,
postgresql.index_rows_fetched,gauge,,row,second,"Enabled with `relations`. The number of live rows fetched by index scans. This metric is tagged with db, schema, table, index.",0,postgres,idx rows fetch,
postgresql.index_rows_read,gauge,,row,second,"Enabled with `relations`. The number of index entries returned by scans on this index. This metric is tagged with db, schema, table, index.",0,postgres,idx rows read,
postgresql.index_scans,gauge,,scan,second,"Enabled with `relations`. The number of index scans initiated on this table.  This metric is tagged with db, schema, table, index",0,postgres,idx scans,
postgresql.index_size,gauge,,byte,,"Enabled with `relations`. The total disk space used by indexes attached to the specified table. This metric is tagged with db, schema, table.",0,postgres,idx size,
postgresql.individual_index_size,gauge,,byte,,"The disk space used by a specified index. This metric is tagged with db, schema, table, index.",0,postgres,idx size,
postgresql.last_analyze_age,gauge,,second,,"Last time at which this table was manually analyzed. This metric is tagged with db, schema, table.",0,postgres,age analyze,
postgresql.last_autoanalyze_age,gauge,,second,,"Last time at which this table was analyzed by the autovacuum daemon. This metric is tagged with db, schema, table.",0,postgres,age autoanalyze,
postgresql.last_autovacuum_age,gauge,,second,,"Last time at which this table was vacuumed by the autovacuum daemon. This metric is tagged with db, schema, table.",0,postgres,age autovacuum,
postgresql.last_vacuum_age,gauge,,second,,"Last time at which this table was manually vacuumed (not counting VACUUM FULL). This metric is tagged with db, schema, table.",0,postgres,age vacuum,
postgresql.live_rows,gauge,,row,,"Enabled with `relations`. The estimated number of live rows. This metric is tagged with db, schema, table.",0,postgres,live rows,
postgresql.locks,gauge,,lock,,"Enabled with `relations`. The number of locks active for this database. This metric is tagged with db, lock_mode, lock_type, schema, table, granted.",0,postgres,locks,
postgresql.max_connections,gauge,,connection,, The maximum number of client connections allowed to this database.,0,postgres,max conns,
postgresql.percent_usage_connections,gauge,,fraction,,The number of connections to this database as a fraction of the maximum number of allowed connections.,0,postgres,pct usg conns,
postgresql.pg_stat_statements.dealloc,count,,,,The number of times pg_stat_statements had to evict least executed queries because pg_stat_statements.max was reached.,-1,postgres,pgss dealloc,
postgresql.queries.blk_read_time,count,,nanosecond,,"Total time spent reading blocks per query_signature, db, and user. (DBM only)",0,postgres, postgres queries block read time,
postgresql.queries.blk_write_time,count,,nanosecond,,"Total time spent writing blocks per query_signature, db, and user. (DBM only)",0,postgres, postgres queries block write time,
postgresql.queries.count,count,,query,,"The total query execution count per query_signature, db, and user. (DBM only)",0,postgres,postgres queries count,
postgresql.queries.duration.max,gauge,,nanosecond,,"The age of the longest running query per user, db and app. (DBM only)",0,postgres,postgres queries duration max,
postgresql.queries.duration.sum,gauge,,nanosecond,,"The sum of the age of all running queries per user, db and app. (DBM only)",0,postgres,postgres queries duration sum,
postgresql.queries.local_blks_dirtied,count,,block,,"Total number of local blocks dirtied per query_signature, db, and user. (DBM only)",0,postgres,postgres queries local blocks dirtied,
postgresql.queries.local_blks_hit,count,,block,,"Total number of local block cache hits per query_signature, db, and user. (DBM only)",0,postgres,postgres queries local blocks hit,
postgresql.queries.local_blks_read,count,,block,,"Total number of local blocks read per query_signature, db, and user. (DBM only)",0,postgres,postgres queries local blocks read,
postgresql.queries.local_blks_written,count,,block,,"Total number of local blocks written per query_signature, db, and user. (DBM only)",0,postgres,postgres queries local blocks written,
postgresql.queries.rows,count,,row,,"The total number of rows retrieved or affected per query_signature, db, and user. (DBM only)",0,postgres,postgres queries rows,
postgresql.queries.shared_blks_dirtied,count,,block,,"Total number of shared blocks dirtied per query_signature, db, and user. (DBM only)",0,postgres,postgres queries shared blocks dirtied,
postgresql.queries.shared_blks_hit,count,,block,,"Total number of shared block cache hits per query_signature, db, and user. (DBM only)",0,postgres,postgres queries shared blocks hit,
postgresql.queries.shared_blks_read,count,,block,,"Total number of shared blocks read per query_signature, db, and user. (DBM only)",0,postgres,postgres queries shared blocks read,
postgresql.queries.shared_blks_written,count,,block,,"Total number of shared blocks written per query_signature, db, and user. (DBM only)",0,postgres,postgres queries shared blocks written,
postgresql.queries.temp_blks_read,count,,block,,"Total number of temp blocks read per query_signature, db, and user. (DBM only)",0,postgres,postgres queries temp blocks read,
postgresql.queries.temp_blks_written,count,,block,,"Total number of temp blocks written per query_signature, db, and user. (DBM only)",0,postgres,postgres queries temp blocks written,
postgresql.queries.time,count,,nanosecond,,"The total query execution time per query_signature, db, and user. (DBM only)",0,postgres,postgres queries time,
postgresql.relation.all_visible,gauge,,,,"Number of pages that are marked as all visible in the table's visibility map. This is only an estimation used by the planner and is updated by VACUUM or ANALYZE. This metric is tagged with db, schema, table, partition_of",0,postgres,relation all_visible,
postgresql.relation.pages,gauge,,,,"Size of a table in pages (1 page == 8KB by default). This is only an estimation used by the planner and is updated by VACUUM or ANALYZE. This metric is tagged with db, schema, table, partition_of.",0,postgres,relation pages,
postgresql.relation.tuples,gauge,,,,"Number of live rows in the table. This is only an estimation used by the planner and is updated by VACUUM or ANALYZE. If the table has never been vacuumed or analyze, -1 will be reported. This metric is tagged with db, schema, table, partition_of",0,postgres,relation tuples,
postgresql.relation_size,gauge,,byte,,"The disk space used by the specified table. TOAST data, indexes, free space map and visibility map are not included. This metric is tagged with db, schema, table.",0,postgres,relation size,
postgresql.replication.backend_xmin_age,gauge,,,,The age of the standby server's xmin horizon (relative to latest stable xid) reported by hot_standby_feedback.,-1,postgres,repl backend xmin,
postgresql.replication.wal_flush_lag,gauge,,second,,Time elapsed between flushing recent WAL locally and receiving notification that this standby server has written and flushed it (but not yet applied it). This can be used to gauge the delay that synchronous_commit level on incurred while committing if this server was configured as a synchronous standby. Only available with postgresql 10 and newer.,-1,postgres,repl flush lag,
postgresql.replication.wal_replay_lag,gauge,,second,,"Time elapsed between flushing recent WAL locally and receiving notification that this standby server has written, flushed and applied it. This can be used to gauge the delay that synchronous_commit level remote_apply incurred while committing if this server was configured as a synchronous standby. Only available with postgresql 10 and newer.",-1,postgres,repl replay lag,
postgresql.replication.wal_write_lag,gauge,,second,,Time elapsed between flushing recent WAL locally and receiving notification that this standby server has written it (but not yet flushed it or applied it). This can be used to gauge the delay that synchronous_commit level remote_write incurred while committing if this server was configured as a synchronous standby. Only available with postgresql 10 and newer.,-1,postgres,repl write lag,
postgresql.replication_delay,gauge,,second,,The current replication delay in seconds. Only available with postgresql 9.1 and newer,-1,postgres,repl delay,
postgresql.replication_delay_bytes,gauge,,byte,,The current replication delay in bytes. Only available with postgresql 9.2 and newer,-1,postgres,repl delay bytes,
postgresql.replication_slot.confirmed_flush_delay_bytes,gauge,,byte,,"The delay in bytes between the current WAL position and last position this slot's consumer confirmed. This is only available for logical replication slots. This metric is tagged with slot_name, slot_type, slot_persistence, slot_state.",-1,postgres,repslot flush,
postgresql.replication_slot.restart_delay_bytes,gauge,,byte,,"The amount of WAL bytes that the consumer of this slot may require and won't be automatically removed during checkpoints unless it exceeds max_slot_wal_keep_size parameter. Nothing is reported if there's no WAL reservation for this slot. This metric is tagged with slot_name, slot_type, slot_persistence, slot_state.",-1,postgres,repslot restart,
postgresql.replication_slot.spill_bytes,count,,byte,,"Amount of decoded transaction data spilled to disk while performing decoding of changes from WAL for this slot. This and other spill counters can be used to gauge the I/O occurred during logical decoding and allow tuning logical_decoding_work_mem. Extracted from pg_stat_replication_slots. Only available with PostgreSQL 14 and newer. This metric is tagged with slot_name, slot_type, slot_state.",-1,postgres,repslot spill_byte,
postgresql.replication_slot.spill_count,count,,,,"Number of times transactions were spilled to disk while decoding changes from WAL for this slot. This counter is incremented each time a transaction is spilled, and the same transaction may be spilled multiple times. Extracted from pg_stat_replication_slots. Only available with PostgreSQL 14 and newer. This metric is tagged with slot_name, slot_type, slot_state.",-1,postgres,repslot spill_cnt,
postgresql.replication_slot.spill_txns,count,,transaction,,"Number of transactions spilled to disk once the memory used by logical decoding to decode changes from WAL has exceeded logical_decoding_work_mem. The counter gets incremented for both top-level transactions and subtransactions. Extracted from pg_stat_replication_slots. Only available with PostgreSQL 14 and newer. This metric is tagged with slot_name, slot_type, slot_state.",-1,postgres,repslot spill_txn,
postgresql.replication_slot.stream_bytes,count,,byte,,"Amount of transaction data decoded for streaming in-progress transactions to the decoding output plugin while decoding changes from WAL for this slot. Extracted from pg_stat_replication_slots. Only available with PostgreSQL 14 and newer. This metric is tagged with slot_name, slot_type, slot_state.",-1,postgres,repslot stream_bytes,
postgresql.replication_slot.stream_count,count,,,,"Number of times in-progress transactions were streamed to the decoding output plugin while decoding changes from WAL for this slot. Extracted from pg_stat_replication_slots. Only available with PostgreSQL 14 and newer. This metric is tagged with slot_name, slot_type, slot_state.",-1,postgres,repslot stream_count,
