metric_name,metric_type,interval,unit_name,per_unit_name,description,orientation,integration,short_name,curated_metric
postgresql.replication_slot.stream_txns,count,,transaction,,"Number of in-progress transactions streamed to the decoding output plugin after the memory used by logical decoding to decode changes from WAL for this slot has exceeded logical_decoding_work_mem. Extracted from pg_stat_replication_slots. Only available with PostgreSQL 14 and newer. This metric is tagged with slot_name, slot_type, slot_state.",-1,postgres,repslot stream_txn,
postgresql.replication_slot.total_bytes,count,,byte,,"Amount of transaction data decoded for sending transactions to the decoding output plugin while decoding changes from WAL for this slot. Extracted from pg_stat_replication_slots. Only available with PostgreSQL 14 and newer. This metric is tagged with slot_name, slot_type, slot_state.",0,postgres,repslot total_bytes,
postgresql.replication_slot.total_txns,count,,transaction,,"Number of decoded transactions sent to the decoding output plugin for this slot. Extracted from pg_stat_replication_slots. Only available with PostgreSQL 14 and newer. This metric is tagged with slot_name, slot_type, slot_state.",0,postgres,repslot total_txn,
postgresql.replication_slot.xmin_age,gauge,,transaction,,"The age of the oldest transaction that this slot needs the database to retain. Only physical replication slot will have a xmin. Orphaned replication slot (no consumer or consumer is not connected) will prevent the xmin horizon from progressing. This metric is tagged with slot_name, slot_type, slot_persistence, slot_state.",-1,postgres,repslot xmin,
postgresql.rollbacks,gauge,,transaction,second,The number of transactions that have been rolled back in this database. This metric is tagged with db.,-1,postgres,rollbacks,
postgresql.rows_deleted,gauge,,row,second,Enabled with `relations`. The number of rows deleted by queries in this database. This metric is tagged with db.,0,postgres,rows del,
postgresql.rows_fetched,gauge,,row,second,The number of rows fetched by queries in this database. This metric is tagged with db.,0,postgres,rows fetch,
postgresql.rows_hot_updated,gauge,,row,second,"Enabled with `relations`. The number of rows HOT updated, meaning no separate index update was needed. This metric is tagged with db, schema, table.",0,postgres,rows hot updated,
postgresql.rows_inserted,gauge,,row,second,Enabled with `relations`. The number of rows inserted by queries in this database. This metric is tagged with db.,0,postgres,rows insrt,
postgresql.rows_returned,gauge,,row,second,The number of rows returned by queries in this database. This metric is tagged with db.,0,postgres,rows ret,
postgresql.rows_updated,gauge,,row,second,Enabled with `relations`. The number of rows updated by queries in this database. This metric is tagged with db.,0,postgres,rows updt,
postgresql.running,gauge,,,,The number of instances running.,0,postgres,running,
postgresql.seq_rows_read,gauge,,row,second,"Enabled with `relations`. The number of live rows fetched by sequential scans. This metric is tagged with db, schema, table.",0,postgres,seq rows rd,
postgresql.seq_scans,gauge,,scan,second,"Enabled with `relations`. The number of sequential scans initiated on this table. This metric is tagged with db, schema, table.",0,postgres,seq scans,
postgresql.sessions.abandoned,count,,session,,Number of database sessions to this database that were terminated because connection to the client was lost. This metric is tagged with db.,-1,postgres,postgres sessions abandoned,
postgresql.sessions.active_time,count,,millisecond,,"Time spent executing SQL statements in this database, in milliseconds (this corresponds to the states active and fastpath function call in pg_stat_activity). This metric is tagged with db.",0,postgres,postgres active time,
postgresql.sessions.count,count,,session,,Total number of sessions established to this database. This metric is tagged with db.,0,postgres,postgres sessions,
postgresql.sessions.fatal,count,,session,,Number of database sessions to this database that were terminated by fatal errors. This metric is tagged with db.,-1,postgres,postgres sessions fatal,
postgresql.sessions.idle_in_transaction_time,count,,millisecond,,"Time spent idling while in a transaction in this database, in milliseconds (this corresponds to the states idle in transaction and idle in transaction (aborted) in pg_stat_activity). This metric is tagged with db.",0,postgres,postgres idle time,
postgresql.sessions.killed,count,,session,,Number of database sessions to this database that were terminated by operator intervention. This metric is tagged with db.,-1,postgres,postgres sessions killed,
postgresql.sessions.session_time,count,,millisecond,,"Time spent by database sessions in this database, in milliseconds (note that statistics are only updated when the state of a session changes, so if sessions have been idle for a long time, this idle time won't be included). This metric is tagged with db.",0,postgres,postgres session time,
postgresql.slru.blks_exists,count,,block,,Number of blocks checked for existence for SLRU (simple least-recently-used) cache. Only CommitTs and MultiXactOffset caches are checking if blocks are already present on disk. This metric is tagged with slru_name.,0,postgres,postgres slru exists,
postgresql.slru.blks_hit,count,,block,,"Number of times disk blocks were found already in the SLRU (simple least-recently-used), so that a read was not necessary (this only includes hits in the SLRU, not the operating system's file system cache). This metric is tagged with slru_name.",0,postgres,postgres slru hit,
postgresql.slru.blks_read,count,,block,,"Number of disk blocks read for SLRU (simple least-recently-used) cache. SLRU caches are created with a fixed number of pages. When all pages are used, the least recently used block is dumped on disk to create space. Access to the evicted block will require data to be read from the disk and loaded back in an SLRU cache page, increasing the block read count. This metric is tagged with slru_name.",-1,postgres,postgres slru read,
postgresql.slru.blks_written,count,,block,,"Number of disk blocks written for SLRU (simple least-recently-used) cache. SLRU caches are created with a fixed number of pages. When all pages are used, the least recently used block is dumped on disk to create space. A block eviction doesn't necessarily generate disk write as the block could have been written in a previous eviction. This metric is tagged with slru_name.",-1,postgres,postgres slru written,
postgresql.slru.blks_zeroed,count,,block,,"Number of blocks zeroed during initializations of SLRU (simple least-recently-used) cache. SLRU caches are created with a fixed number of pages. For Subtrans, Xact and CommitTs caches, the global transactionId is used to get the page number. Thus, it will increase with the transaction throughput. This metric is tagged with slru_name.",0,postgres,postgres slru zeroed,
postgresql.slru.flushes,count,,,,"Number of flush of dirty data for SLRU (simple least-recently-used) cache. CommitTs, MultiXact, Subtrans, Xact caches flush will happen during checkpoint. MultiXact cache flush may happen during vacuum. This metric is tagged with slru_name.",0,postgres,postgres slru flushes,
postgresql.slru.truncates,count,,,,"Number of truncates for SLRU (simple least-recently-used) cache. For CommitTs, Xact and MultiXact, truncates will happen when the frozenID progresses. For Subtrans, a truncate can occur during restartpoint and a checkpoint. This metric is tagged with slru_name.",0,postgres,postgres slru truncates,
postgresql.snapshot.xip_count,gauge,,,,Report the number of active transactions based on pg_snapshot_xip(pg_current_snapshot()).,0,postgres,snapshot xip,
postgresql.snapshot.xmax,gauge,,,,Report the next transaction ID that will be assigned based on pg_snapshot_xmax(pg_current_snapshot()).,0,postgres,snapshot xmax,
postgresql.snapshot.xmin,gauge,,,,"Report the lowest transaction ID still active based on pg_snapshot_xmin(pg_current_snapshot()). All transaction IDs less than xmin are either committed and visible, or rolled back and dead.",0,postgres,snapshot xmin,
postgresql.subscription.apply_error,count,,,,Number of errors that occurred while applying changes. Extracted from pg_stat_subscription_stats. Only available on PostgreSQL 15 or higher. This metric is tagged with subscription_name.,-1,postgres,sub apply_error,
postgresql.subscription.last_msg_receipt_age,gauge,,second,,Age of receipt time of the last message received from origin WAL sender. Extracted from pg_stat_subscription. Only available on PostgreSQL 12 or higher. This metric is tagged with subscription_name.,-1,postgres,sub last_received,
postgresql.subscription.last_msg_send_age,gauge,,second,,Age of last message received from origin WAL sender. Extracted from pg_stat_subscription. Only available on PostgreSQL 12 or higher. This metric is tagged with subscription_name.,-1,postgres,sub last_send,
postgresql.subscription.latest_end_age,gauge,,second,,Age of last write-ahead log location reported to origin WAL sender. Extracted from pg_stat_subscription. Only available on PostgreSQL 12 or higher. This metric is tagged with subscription_name.,-1,postgres,sub latest_end,
postgresql.subscription.state,gauge,,,,"State of a subscription per relation and subscription. Extracted from pg_subscription_rel. Only available on PostgreSQL 14 or higher. This metric is tagged with subscription_name, relation, state.",0,postgres,sub state,
postgresql.subscription.sync_error,count,,,,Number of errors that occurred during the initial table synchronization. Extracted from pg_stat_subscription_stats. Only available on PostgreSQL 15 or higher. This metric is tagged with subscription_name.,-1,postgres,sub sync_error,
postgresql.table.count,gauge,,table,,"The number of user tables in this database. This metric is tagged with db, schema.",0,postgres,tbl count,
postgresql.table_bloat,gauge,,percent,,"Enabled with `collect_bloat_metrics`. The estimated percentage of table bloat. This metric is tagged with db, schema, table.",0,postgres,tbloat,
postgresql.table_size,gauge,,byte,,"Enabled with `relations`. The disk space used by the specified table with TOAST data. Free space map and visibility map are not included. This metric is tagged with db, schema, table.",0,postgres,tbl size,
postgresql.temp_bytes,gauge,,byte,second,The amount of data written to temporary files by queries in this database. This metric is tagged with db.,0,postgres,temp bytes,
postgresql.temp_files,gauge,,file,second,The number of temporary files created by queries in this database. This metric is tagged with db.,0,postgres,temp files,
postgresql.toast_blocks_hit,gauge,,hit,second,"Enabled with `relations`. The number of buffer hits in this table's TOAST table. This metric is tagged with db, schema, table.",0,postgres,toast blks hit,
postgresql.toast_blocks_read,gauge,,block,second,"Enabled with `relations`. The number of disk blocks read from this table's TOAST table. This metric is tagged with db, schema, table.",0,postgres,toast blks read,
postgresql.toast_index_blocks_hit,gauge,,block,second,"Enabled with `relations`. The number of buffer hits in this table's TOAST table index. This metric is tagged with db, schema, table.",0,postgres,toast idx blks hit,
postgresql.toast_index_blocks_read,gauge,,block,second,"Enabled with `relations`. The number of disk blocks read from this table's TOAST table index. This metric is tagged with db, schema, table.",0,postgres,toast idx blks read,
postgresql.toast_size,gauge,,byte,,"The total disk space used by the toast table attached to the specified table. This metric is tagged with db, schema, table.",0,postgres,toast size,
postgresql.total_size,gauge,,byte,,"Enabled with `relations`. The total disk space used by the table, including indexes and TOAST data. This metric is tagged with db, schema, table.",0,postgres,tot size,
postgresql.transactions.duration.max,gauge,,nanosecond,,"The age of the longest running transaction per user, db and app. (DBM only)",0,postgres,postgres transactions duration max,
postgresql.transactions.duration.sum,gauge,,nanosecond,,"The sum of the age of all running transactions per user, db and app. (DBM only)",0,postgres,postgres transactions duration sum,
postgresql.transactions.idle_in_transaction,gauge,,transaction,,"Enabled with `collect_activity_metrics`. The number of 'idle in transaction' transactions in this database. This metric (by default) is tagged with db, app, user.",0,postgres,transactions idle_in_transaction,
postgresql.transactions.open,gauge,,transaction,,"Enabled with `collect_activity_metrics`. The number of open transactions in this database. This metric (by default) is tagged with db, app, user.",0,postgres,transactions open,
postgresql.uptime,gauge,,second,,The uptime of the server in seconds.,0,postgres,postgres uptime,
postgresql.vacuum.heap_blks_scanned,gauge,,block,,"Number of heap blocks scanned. Because the visibility map is used to optimize scans, some blocks will be skipped without inspection; skipped blocks are included in this total, so that this number will eventually become equal to heap_blks_total when the vacuum is complete. This counter only advances when the phase is scanning heap. This metric is tagged with db, table, phase.",0,postgres,postgres vacuum heap_scanned,
postgresql.vacuum.heap_blks_total,gauge,,block,,"Total number of heap blocks in the table. This number is reported as of the beginning of the scan; blocks added later will not be (and need not be) visited by this VACUUM. This metric is tagged with db, table, phase.",0,postgres,postgres vacuum heap_total,
postgresql.vacuum.heap_blks_vacuumed,gauge,,block,,"Number of heap blocks vacuumed. Unless the table has no indexes, this counter only advances when the phase is vacuuming heap. Blocks that contain no dead tuples are skipped, so the counter may sometimes skip forward in large increments. This metric is tagged with db, table, phase.",0,postgres,postgres vacuum heap_scanned,
postgresql.vacuum.index_vacuum_count,gauge,,block,,"Number of completed index vacuum cycles. This metric is tagged with db, table, phase.",0,postgres,postgres vacuum index_count,
postgresql.vacuum.max_dead_tuples,gauge,,,,"Number of dead tuples that we can store before needing to perform an index vacuum cycle, based on maintenance_work_mem. This metric is tagged with db, table, phase.",0,postgres,postgres vacuum max_dead,
postgresql.vacuum.num_dead_tuples,gauge,,,,"Number of dead tuples collected since the last index vacuum cycle. This metric is tagged with db, table, phase.",0,postgres,postgres vacuum num_dead,
postgresql.vacuumed,count,,,,"Enabled with `relations`. The number of times this table has been manually vacuumed. This metric is tagged with db, schema, table.",0,postgres,vac,
postgresql.waiting_queries,gauge,,,,"Enabled with `collect_activity_metrics`. The number of waiting queries in this database. This metric (by default) is tagged with db, app, user.",0,postgres,transactions waiting queries,
postgresql.wal.buffers_full,count,,,,"Number of times WAL data was written to disk because WAL buffers became full. WAL changes are stored in WAL buffers first. If the buffer is full, WAL insertions will be blocked until buffer is flushed. The size of this buffer is set by wal_buffers configuration. By default, it will use 3% of the shared_buffers value.",-1,postgres,postgres wal buffer full,
postgresql.wal.bytes,count,,byte,,Total amount of WAL generated in bytes.,0,postgres,postgres wal bytes,
postgresql.wal.full_page_images,count,,page,,Total number of WAL full page images generated. Full page write will happen when a block is modified for the first time after a checkpoint.,0,postgres,postgres wal fpi,
postgresql.wal.records,count,,record,,Total number of WAL records generated.,0,postgres,postgres wal records,
postgresql.wal.sync,count,,,,Number of times WAL files were synced to disk.,0,postgres,postgres wal sync,
postgresql.wal.sync_time,count,,millisecond,,"Total amount of time spent syncing WAL files to disk, in milliseconds (if track_wal_io_timing is enabled, fsync is on, and wal_sync_method is either fdatasync, fsync or fsync_writethrough, otherwise zero).",-1,postgres,postgres wal sync time,
postgresql.wal.write,count,,write,,Number of times WAL buffers were written out to disk.,0,postgres,postgres wal write,
postgresql.wal.write_time,count,,millisecond,,"Total amount of time spent writing WAL buffers to disk, in milliseconds (if track_wal_io_timing is enabled, otherwise zero).",-1,postgres,postgres wal write time,
postgresql.wal_age,gauge,,second,,Enabled with `collect_wal_metrics`. The age in seconds of the oldest WAL file.,0,postgres,wal age,
postgresql.wal_count,gauge,,,,The number WAL files on disk.,-1,postgres,wal count,
postgresql.wal_receiver.connected,gauge,,,,The status of the WAL receiver. This metric will be set to 1 with a 'status:disconnected' tag if the instance doesn't have a running WAL receiver. Otherwise it will use status value from pg_stat_wal_receiver. This metric is tagged with status.,0,postgres,wal receiver connected,
postgresql.wal_receiver.last_msg_receipt_age,gauge,,second,,Time since the reception of the last message from the WAL sender. This metric is tagged with status.,0,postgres,wal receiver receipt age,
postgresql.wal_receiver.last_msg_send_age,gauge,,second,,The age of the latest message's send time received from the WAL sender. This metric is tagged with status.,0,postgres,wal receiver send age,
postgresql.wal_receiver.latest_end_age,gauge,,second,,Time since the reception of the last message from the WAL sender with an WAL location update. This metric is tagged with status.,0,postgres,wal receiver latest end,
postgresql.wal_receiver.received_timeline,gauge,,,,"Timeline number of last write-ahead log location received and flushed to disk, the initial value of this field being the timeline number of the first log location used when WAL receiver is started. This metric is tagged with status.",0,postgres,wal receiver tli,
postgresql.wal_size,gauge,,byte,,The sum of all WAL files on disk.,-1,postgres,wal size,
