metric_name,metric_type,interval,unit_name,per_unit_name,description,orientation,integration,short_name,curated_metric,sample_tags
temporal.server.shardinfo.transfer.failover_latency.sum,count,,millisecond,,,0,temporal,shardinfo transfer failover latency sum,,
temporal.server.shardinfo.transfer.lag.bucket,count,,,,,0,temporal,shardinfo transfer lag bucket,,
temporal.server.shardinfo.transfer.lag.count,count,,,,,0,temporal,shardinfo transfer lag count,,
temporal.server.shardinfo.transfer.lag.sum,count,,,,,0,temporal,shardinfo transfer lag sum,,
temporal.server.shardinfo.transfer.standby.pending_task.bucket,count,,,,,0,temporal,shardinfo transfer standby pending task bucket,,
temporal.server.shardinfo.transfer.standby.pending_task.count,count,,,,,0,temporal,shardinfo transfer standby pending task count,,
temporal.server.shardinfo.transfer.standby.pending_task.sum,count,,,,,0,temporal,shardinfo transfer standby pending task sum,,
temporal.server.shardinfo.visibility.lag.bucket,count,,,,,0,temporal,shardinfo visibility lag bucket,,
temporal.server.shardinfo.visibility.lag.count,count,,,,,0,temporal,shardinfo visibility lag count,,
temporal.server.shardinfo.visibility.lag.sum,count,,,,,0,temporal,shardinfo visibility lag sum,,
temporal.server.shardinfo.visibility.pending_task.bucket,count,,,,,0,temporal,shardinfo visibility pending task bucket,,
temporal.server.shardinfo.visibility.pending_task.count,count,,,,,0,temporal,shardinfo visibility pending task count,,
temporal.server.shardinfo.visibility.pending_task.sum,count,,,,,0,temporal,shardinfo visibility pending task sum,,
temporal.server.sharditem.acquisition_latency.bucket,count,,,,,0,temporal,sharditem acquisition latency bucket,,
temporal.server.sharditem.acquisition_latency.count,count,,,,,0,temporal,sharditem acquisition latency count,,
temporal.server.sharditem.acquisition_latency.sum,count,,millisecond,,,0,temporal,sharditem acquisition latency sum,,
temporal.server.sharditem.created.count,count,,,,,0,temporal,sharditem created count,,
temporal.server.sharditem.removed.count,count,,,,,0,temporal,sharditem removed count,,
temporal.server.signal_external_workflow_command.count,count,,,,,0,temporal,signal external workflow command count,,
temporal.server.signal_info.bucket,count,,,,,0,temporal,signal info bucket,,
temporal.server.signal_info.count,count,,,,,0,temporal,signal info count,,
temporal.server.signal_info.size.bucket,count,,,,,0,temporal,signal info size bucket,,
temporal.server.signal_info.size.count,count,,,,,0,temporal,signal info size count,,
temporal.server.signal_info.size.sum,count,,byte,,,0,temporal,signal info size sum,,
temporal.server.signal_info.sum,count,,,,,0,temporal,signal info sum,,
temporal.server.signal_request_id_count.bucket,count,,,,,0,temporal,signal request id count bucket,,
temporal.server.signal_request_id_count.count,count,,,,,0,temporal,signal request id count count,,
temporal.server.signal_request_id_count.sum,count,,,,,0,temporal,signal request id count sum,,
temporal.server.signal_request_id_size.bucket,count,,,,,0,temporal,signal request id size bucket,,
temporal.server.signal_request_id_size.count,count,,,,,0,temporal,signal request id size count,,
temporal.server.signal_request_id_size.sum,count,,byte,,,0,temporal,signal request id size sum,,
temporal.server.signal_with_start_skip_delay_count.count,count,,,,,0,temporal,signal with start skip delay count count,,
temporal.server.speculative_workflow_task.commits.count,count,,,,,0,temporal,speculative workflow task commits count,,
temporal.server.speculative_workflow_task.rollbacks.count,count,,,,,0,temporal,speculative workflow task rollbacks count,,
temporal.server.stale_mutable_state.count,count,,,,,0,temporal,stale mutable state count,,
temporal.server.stale_replication_events.count,count,,,,,0,temporal,stale replication events count,,
temporal.server.start_deployment.transition_count.count,count,,,,,0,temporal,start deployment transition count count,,
temporal.server.start_timer_command.count,count,,,,,0,temporal,start timer command count,,
temporal.server.start_to_close.timeout.count,count,,,,,0,temporal,start to close timeout count,,
temporal.server.start_workflow_request_deduped.count,count,,,,,0,temporal,start workflow request deduped count,,
temporal.server.started.count,count,,,,,0,temporal,started count,,
temporal.server.state_machine_timer.processing_failures.count,count,,,,,0,temporal,state machine timer processing failures count,,
temporal.server.state_machine_timer.skips.count,count,,,,,0,temporal,state machine timer skips count,,
temporal.server.state_transition.bucket,count,,,,,0,temporal,state transition bucket,,
temporal.server.state_transition.count,count,,,,,0,temporal,state transition count,,
temporal.server.state_transition.sum,count,,,,,0,temporal,state transition sum,,
temporal.server.stopped.count,count,,,,,0,temporal,stopped count,,
temporal.server.sync_throttle.count,count,,,,,0,temporal,sync throttle count,,
temporal.server.syncmatch.latency.bucket,count,,,,,0,temporal,syncmatch latency bucket,,
temporal.server.syncmatch.latency.count,count,,,,,0,temporal,syncmatch latency count,,
temporal.server.syncmatch.latency.sum,count,,millisecond,,,0,temporal,syncmatch latency sum,,
temporal.server.syncshard.remote.count,count,,,,,0,temporal,syncshard remote count,,
temporal.server.syncshard.remote.failed.count,count,,,,,0,temporal,syncshard remote failed count,,
temporal.server.task.attempt.bucket,count,,,,Distribution of the number of attempts on each task execution.,0,temporal,task attempt bucket,,
temporal.server.task.attempt.count,count,,,,Count of the number of attempts on each task execution.,0,temporal,task attempt count,,
temporal.server.task.attempt.sum,count,,,,Sum of the number of attempts on each task execution.,0,temporal,task attempt sum,,
temporal.server.task.batch_complete_counter.count,count,,,,,0,temporal,task batch complete counter count,,
temporal.server.task.bucket,count,,,,,0,temporal,task bucket,,
temporal.server.task.count,count,,,,,0,temporal,task count,,
temporal.server.task.deleted,gauge,,,,,0,temporal,task deleted,,
temporal.server.task.dependency_task_not_completed.count,count,,,,,0,temporal,task dependency task not completed count,,
temporal.server.task.dispatch_latency.bucket,count,,,,,0,temporal,task dispatch latency bucket,,
temporal.server.task.dispatch_latency.count,count,,,,,0,temporal,task dispatch latency count,,
temporal.server.task.dispatch_latency.sum,count,,millisecond,,,0,temporal,task dispatch latency sum,,
temporal.server.task.dlq_failures.count,count,,,,,0,temporal,task dlq failures count,,
temporal.server.task.dlq_latency.bucket,count,,,,,0,temporal,task dlq latency bucket,,
temporal.server.task.dlq_latency.count,count,,,,,0,temporal,task dlq latency count,,
temporal.server.task.dlq_latency.sum,count,,millisecond,,,0,temporal,task dlq latency sum,,
temporal.server.task.errors.corruption.count,count,,,,,0,temporal,task errors corruption count,,
temporal.server.task.errors.count,count,,,,Number of task process errors.,0,temporal,task errors count,,
temporal.server.task.errors.discarded.count,count,,,,,0,temporal,task errors discarded count,,
temporal.server.task.errors.internal.count,count,,,,,0,temporal,task errors internal count,,
temporal.server.task.errors.limit_exceeded_counter.count,count,,,,,0,temporal,task errors limit exceeded counter count,,
temporal.server.task.errors.namespace_handover.count,count,,,,,0,temporal,task errors namespace handover count,,
temporal.server.task.errors.not_active_counter.count,count,,,,,0,temporal,task errors not active counter count,,
temporal.server.task.errors.standby_retry_counter.count,count,,,,,0,temporal,task errors standby retry counter count,,
temporal.server.task.errors.throttled.count,count,,,,,0,temporal,task errors throttled count,,
temporal.server.task.errors.version_mismatch.count,count,,,,,0,temporal,task errors version mismatch count,,
temporal.server.task.errors.workflow_busy.count,count,,,,,0,temporal,task errors workflow busy count,,
temporal.server.task.lag_per_tl,gauge,,,,,0,temporal,task lag per tl,,
temporal.server.task.latency.bucket,count,,,,Distribution of in-memory latencies across multiple attempts.,0,temporal,task latency bucket,,
temporal.server.task.latency.count,count,,,,Count of in-memory latencies across multiple attempts.,0,temporal,task latency count,,
temporal.server.task.latency.load.bucket,count,,,,Distribution of durations from task generation to task loading.,0,temporal,task latency load bucket,,
temporal.server.task.latency.load.count,count,,,,Count of durations from task generation to task loading.,0,temporal,task latency load count,,
temporal.server.task.latency.load.sum,count,,millisecond,,Sum of durations from task generation to task loading.,0,temporal,task latency load sum,,
temporal.server.task.latency.processing.bucket,count,,,,Distribution of task processing latencies per attempt.,0,temporal,task latency processing bucket,,
temporal.server.task.latency.processing.count,count,,,,Count of task processing latencies per attempt.,0,temporal,task latency processing count,,
temporal.server.task.latency.processing.sum,count,,millisecond,,Sum of task processing latencies per attempt.,0,temporal,task latency processing sum,,
temporal.server.task.latency.queue.bucket,count,,,,Distribution of durations from when a task is fired to when the task is done.,0,temporal,task latency queue bucket,,
temporal.server.task.latency.queue.count,count,,,,Count of durations from when a task is fired to when the task is done.,0,temporal,task latency queue count,,
temporal.server.task.latency.queue.sum,count,,millisecond,,Sum of durations from when a task is fired to when the task is done.,0,temporal,task latency queue sum,,
temporal.server.task.latency.schedule.bucket,count,,,,Distribution of durations from task submission to processing.,0,temporal,task latency schedule bucket,,
temporal.server.task.latency.schedule.count,count,,,,Count of durations from task submission to processing.,0,temporal,task latency schedule count,,
temporal.server.task.latency.schedule.sum,count,,millisecond,,Sum of durations from task submission to processing.,0,temporal,task latency schedule sum,,
temporal.server.task.latency.sum,count,,millisecond,,Sum of in-memory latencies across multiple attempts.,0,temporal,task latency sum,,
temporal.server.task.latency.user.bucket,count,,,,,0,temporal,task latency user bucket,,
temporal.server.task.latency.user.count,count,,,,,0,temporal,task latency user count,,
temporal.server.task.latency.user.sum,count,,millisecond,,,0,temporal,task latency user sum,,
temporal.server.task.processed,gauge,,,,,0,temporal,task processed,,
temporal.server.task.requests.count,count,,,,Number of task process requests.,0,temporal,task requests count,,
temporal.server.task.schedule_to_start_latency.bucket,count,,,,,0,temporal,task schedule to start latency bucket,,
temporal.server.task.schedule_to_start_latency.count,count,,,,,0,temporal,task schedule to start latency count,,
temporal.server.task.schedule_to_start_latency.sum,count,,millisecond,,,0,temporal,task schedule to start latency sum,,
temporal.server.task.skipped.count,count,,,,,0,temporal,task skipped count,,
temporal.server.task.sum,count,,,,,0,temporal,task sum,,
temporal.server.task.terminal_failures.count,count,,,,,0,temporal,task terminal failures count,,
temporal.server.task.throttled_counter.count,count,,,,,0,temporal,task throttled counter count,,
temporal.server.task.write.latency.bucket,count,,,,,0,temporal,task write latency bucket,,
temporal.server.task.write.latency.count,count,,,,,0,temporal,task write latency count,,
temporal.server.task.write.latency.sum,count,,millisecond,,,0,temporal,task write latency sum,,
temporal.server.task.write.throttle.count,count,,,,,0,temporal,task write throttle count,,
temporal.server.task_queue.started.count,count,,,,,0,temporal,task queue started count,,
temporal.server.task_queue.stopped.count,count,,,,,0,temporal,task queue stopped count,,
temporal.server.task_rescheduler.pending_tasks.bucket,count,,,,,0,temporal,task rescheduler pending tasks bucket,,
temporal.server.task_rescheduler.pending_tasks.count,count,,,,,0,temporal,task rescheduler pending tasks count,,
temporal.server.task_rescheduler.pending_tasks.sum,count,,,,,0,temporal,task rescheduler pending tasks sum,,
temporal.server.task_rewrites.count,count,,,,,0,temporal,task rewrites count,,
temporal.server.task_scheduler.throttled.count,count,,,,,0,temporal,task scheduler throttled count,,
temporal.server.taskqueue.deleted,gauge,,,,,0,temporal,taskqueue deleted,,
temporal.server.taskqueue.outstanding,gauge,,,,,0,temporal,taskqueue outstanding,,
temporal.server.taskqueue.processed,gauge,,,,,0,temporal,taskqueue processed,,
temporal.server.tasks.per_shardinfo_update.bucket,count,,,,,0,temporal,tasks per shardinfo update bucket,,
temporal.server.tasks.per_shardinfo_update.count,count,,,,,0,temporal,tasks per shardinfo update count,,
temporal.server.tasks.per_shardinfo_update.sum,count,,,,,0,temporal,tasks per shardinfo update sum,,
temporal.server.tasks_expired.count,count,,,,,0,temporal,tasks expired count,,
temporal.server.time_between_shardinfo_update.bucket,count,,,,,0,temporal,time between shardinfo update bucket,,
temporal.server.time_between_shardinfo_update.count,count,,,,,0,temporal,time between shardinfo update count,,
temporal.server.time_between_shardinfo_update.sum,count,,millisecond,,,0,temporal,time between shardinfo update sum,,
temporal.server.timer_info.bucket,count,,,,,0,temporal,timer info bucket,,
temporal.server.timer_info.count,count,,,,,0,temporal,timer info count,,
temporal.server.timer_info.size.bucket,count,,,,,0,temporal,timer info size bucket,,
temporal.server.timer_info.size.count,count,,,,,0,temporal,timer info size count,,
temporal.server.timer_info.size.sum,count,,byte,,,0,temporal,timer info size sum,,
temporal.server.timer_info.sum,count,,,,,0,temporal,timer info sum,,
temporal.server.total_activity_count.bucket,count,,,,,0,temporal,total activity count bucket,,
temporal.server.total_activity_count.count,count,,,,,0,temporal,total activity count count,,
temporal.server.total_activity_count.sum,count,,,,,0,temporal,total activity count sum,,
temporal.server.total_child_execution_count.bucket,count,,,,,0,temporal,total child execution count bucket,,
temporal.server.total_child_execution_count.count,count,,,,,0,temporal,total child execution count count,,
temporal.server.total_child_execution_count.sum,count,,,,,0,temporal,total child execution count sum,,
temporal.server.total_request_cancel_external_count.bucket,count,,,,,0,temporal,total request cancel external count bucket,,
temporal.server.total_request_cancel_external_count.count,count,,,,,0,temporal,total request cancel external count count,,
temporal.server.total_request_cancel_external_count.sum,count,,,,,0,temporal,total request cancel external count sum,,
temporal.server.total_signal_count.bucket,count,,,,,0,temporal,total signal count bucket,,
temporal.server.total_signal_count.count,count,,,,,0,temporal,total signal count count,,
temporal.server.total_signal_count.sum,count,,,,,0,temporal,total signal count sum,,
temporal.server.total_signal_external_count.bucket,count,,,,,0,temporal,total signal external count bucket,,
temporal.server.total_signal_external_count.count,count,,,,,0,temporal,total signal external count count,,
temporal.server.total_signal_external_count.sum,count,,,,,0,temporal,total signal external count sum,,
temporal.server.total_user_timer_count.bucket,count,,,,,0,temporal,total user timer count bucket,,
temporal.server.total_user_timer_count.count,count,,,,,0,temporal,total user timer count count,,
temporal.server.total_user_timer_count.sum,count,,,,,0,temporal,total user timer count sum,,
temporal.server.transfer_task.missing_event_counter.count,count,,,,,0,temporal,transfer task missing event counter count,,
temporal.server.unbuffer_replication_tasks.bucket,count,,,,,0,temporal,unbuffer replication tasks bucket,,
temporal.server.unbuffer_replication_tasks.count,count,,,,,0,temporal,unbuffer replication tasks count,,
temporal.server.unbuffer_replication_tasks.sum,count,,millisecond,,,0,temporal,unbuffer replication tasks sum,,
temporal.server.unknown_build.polls.count,count,,,,,0,temporal,unknown build polls count,,
temporal.server.unknown_build.tasks.count,count,,,,,0,temporal,unknown build tasks count,,
temporal.server.update_namespace.failures.count,count,,,,,0,temporal,update namespace failures count,,
temporal.server.upsert_workflow_search_attributes_command.count,count,,,,,0,temporal,upsert workflow search attributes command count,,
temporal.server.utf8_validation_errors.count,count,,,,,0,temporal,utf8 validation errors count,,
temporal.server.verify.describe_mutable_state_latency.bucket,count,,,,,0,temporal,verify describe mutable state latency bucket,,
temporal.server.verify.describe_mutable_state_latency.count,count,,,,,0,temporal,verify describe mutable state latency count,,
temporal.server.verify.describe_mutable_state_latency.sum,count,,millisecond,,,0,temporal,verify describe mutable state latency sum,,
temporal.server.verify.replication_task.failed.count,count,,,,,0,temporal,verify replication task failed count,,
temporal.server.verify.replication_task.not_found.count,count,,,,,0,temporal,verify replication task not found count,,
temporal.server.verify.replication_task.success.count,count,,,,,0,temporal,verify replication task success count,,
temporal.server.verify.replication_tasks.latency.bucket,count,,,,,0,temporal,verify replication tasks latency bucket,,
temporal.server.verify.replication_tasks.latency.count,count,,,,,0,temporal,verify replication tasks latency count,,
temporal.server.verify.replication_tasks.latency.sum,count,,millisecond,,,0,temporal,verify replication tasks latency sum,,
temporal.server.version_check.failed.count,count,,,,,0,temporal,version check failed count,,
temporal.server.version_check.latency.bucket,count,,,,,0,temporal,version check latency bucket,,
temporal.server.version_check.latency.count,count,,,,,0,temporal,version check latency count,,
temporal.server.version_check.latency.sum,count,,millisecond,,,0,temporal,version check latency sum,,
temporal.server.version_check.request_failed.count,count,,,,,0,temporal,version check request failed count,,
temporal.server.version_check.success.count,count,,,,,0,temporal,version check success count,,
temporal.server.visibility.archiver.archive.non_retryable_error.count,count,,,,,0,temporal,visibility archiver archive non retryable error count,,
temporal.server.visibility.archiver.archive.success.count,count,,,,,0,temporal,visibility archiver archive success count,,
temporal.server.visibility.archiver.archive.transient_error.count,count,,,,,0,temporal,visibility archiver archive transient error count,,
temporal.server.visibility.persistence.error_with_type.count,count,,,,,0,temporal,visibility persistence error with type count,,
temporal.server.visibility.persistence.errors.count,count,,,,,0,temporal,visibility persistence errors count,,
temporal.server.visibility.persistence.latency.bucket,count,,,,,0,temporal,visibility persistence latency bucket,,
temporal.server.visibility.persistence.latency.count,count,,,,,0,temporal,visibility persistence latency count,,
temporal.server.visibility.persistence.latency.sum,count,,millisecond,,,0,temporal,visibility persistence latency sum,,
temporal.server.visibility.persistence.requests.count,count,,,,,0,temporal,visibility persistence requests count,,
temporal.server.visibility.persistence.resource_exhausted.count,count,,,,,0,temporal,visibility persistence resource exhausted count,,
temporal.server.wf_too_many_pending.activities.count,count,,,,,0,temporal,wf too many pending activities count,,
temporal.server.wf_too_many_pending.cancel_requests.count,count,,,,,0,temporal,wf too many pending cancel requests count,,
temporal.server.wf_too_many_pending.child_workflows.count,count,,,,,0,temporal,wf too many pending child workflows count,,
temporal.server.wf_too_many_pending.external_workflow_signals.count,count,,,,,0,temporal,wf too many pending external workflow signals count,,
temporal.server.worker_deployment_created.count,count,,,,,0,temporal,worker deployment created count,,
temporal.server.worker_deployment_version_created.count,count,,,,,0,temporal,worker deployment version created count,,
temporal.server.worker_deployment_version_created_managed_by_controller.count,count,,,,,0,temporal,worker deployment version created managed by controller count,,
temporal.server.worker_deployment_version_visibility_query_count.count,count,,,,,0,temporal,worker deployment version visibility query count count,,
temporal.server.worker_deployment_versioning_override_count.count,count,,,,,0,temporal,worker deployment versioning override count count,,
temporal.server.worker_not_supports_consistent_query.count,count,,,,,0,temporal,worker not supports consistent query count,,
temporal.server.workflow.cancel.count,count,,,,,0,temporal,workflow cancel count,,
temporal.server.workflow.cleanup.archive.count,count,,,,,0,temporal,workflow cleanup archive count,,
temporal.server.workflow.cleanup.delete.count,count,,,,,0,temporal,workflow cleanup delete count,,
temporal.server.workflow.cleanup.delete_history_inline.count,count,,,,,0,temporal,workflow cleanup delete history inline count,,
temporal.server.workflow.cleanup.nop.count,count,,,,,0,temporal,workflow cleanup nop count,,
temporal.server.workflow.context_cleared.count,count,,,,,0,temporal,workflow context cleared count,,
temporal.server.workflow.continued_as_new.count,count,,,,,0,temporal,workflow continued as new count,,
temporal.server.workflow.cron_backoff.timer.count,count,,,,,0,temporal,workflow cron backoff timer count,,
temporal.server.workflow.eager_execution.count,count,,,,,0,temporal,workflow eager execution count,,
temporal.server.workflow.eager_execution.denied.count,count,,,,,0,temporal,workflow eager execution denied count,,
temporal.server.workflow.failed.count,count,,,,,0,temporal,workflow failed count,,
temporal.server.workflow.retry_backoff.timer.count,count,,,,,0,temporal,workflow retry backoff timer count,,
temporal.server.workflow.run_timeout_overrides.count,count,,,,,0,temporal,workflow run timeout overrides count,,
temporal.server.workflow.success.count,count,,,,,0,temporal,workflow success count,,
temporal.server.workflow.task.attempt.bucket,count,,,,,0,temporal,workflow task attempt bucket,,
temporal.server.workflow.task.attempt.count,count,,,,,0,temporal,workflow task attempt count,,
temporal.server.workflow.task.attempt.sum,count,,,,,0,temporal,workflow task attempt sum,,
temporal.server.workflow.task.heartbeat_timeout.count,count,,,,,0,temporal,workflow task heartbeat timeout count,,
temporal.server.workflow.task.query_latency.bucket,count,,,,,0,temporal,workflow task query latency bucket,,
temporal.server.workflow.task.query_latency.count,count,,,,,0,temporal,workflow task query latency count,,
temporal.server.workflow.task.query_latency.sum,count,,millisecond,,,0,temporal,workflow task query latency sum,,
temporal.server.workflow.task.timeout_overrides.count,count,,,,,0,temporal,workflow task timeout overrides count,,
temporal.server.workflow.terminate.count,count,,,,,0,temporal,workflow terminate count,,
temporal.server.workflow.timeout.count,count,,,,,0,temporal,workflow timeout count,,
temporal.server.workflow_backoff_timer.count,count,,,,,0,temporal,workflow backoff timer count,,
temporal.server.workflow_delayed_start.backoff_timer.count,count,,,,,0,temporal,workflow delayed start backoff timer count,,
temporal.server.workflow_query.failure_count.count,count,,,,,0,temporal,workflow query failure count count,,
temporal.server.workflow_query.success_count.count,count,,,,,0,temporal,workflow query success count count,,
temporal.server.workflow_query.timeout_count.count,count,,,,,0,temporal,workflow query timeout count count,,
temporal.server.workflow_reset_count.count,count,,,,,0,temporal,workflow reset count count,,
temporal.server.workflow_tasks.completed.count,count,,,,,0,temporal,workflow tasks completed count,,
temporal.server.workflow_update.aborted.count,count,,,,,0,temporal,workflow update aborted count,,
temporal.server.workflow_update.client_timeout.count,count,,,,,0,temporal,workflow update client timeout count,,
temporal.server.workflow_update.continue_as_new_suggestions.count,count,,,,,0,temporal,workflow update continue as new suggestions count,,
temporal.server.workflow_update.normal_workflow_task.count,count,,,,,0,temporal,workflow update normal workflow task count,,
temporal.server.workflow_update.registry_size.bucket,count,,,,,0,temporal,workflow update registry size bucket,,
temporal.server.workflow_update.registry_size.count,count,,,,,0,temporal,workflow update registry size count,,
temporal.server.workflow_update.registry_size.sum,count,,byte,,,0,temporal,workflow update registry size sum,,
temporal.server.workflow_update.registry_size_limited.count,count,,,,,0,temporal,workflow update registry size limited count,,
temporal.server.workflow_update.request_rate_limited.count,count,,,,,0,temporal,workflow update request rate limited count,,
temporal.server.workflow_update.request_too_many.count,count,,,,,0,temporal,workflow update request too many count,,
temporal.server.workflow_update.sent_to_worker.count,count,,,,,0,temporal,workflow update sent to worker count,,
temporal.server.workflow_update.sent_to_worker_again.count,count,,,,,0,temporal,workflow update sent to worker again count,,
temporal.server.workflow_update.server_timeout.count,count,,,,,0,temporal,workflow update server timeout count,,
temporal.server.workflow_update.speculative_workflow_task.count,count,,,,,0,temporal,workflow update speculative workflow task count,,
