metric_name,metric_type,interval,unit_name,per_unit_name,description,orientation,integration,short_name,curated_metric,sample_tags
temporal.server.elasticsearch.bulk_processor.request.latency.bucket,count,,,,,0,temporal,elasticsearch bulk processor request latency bucket,,
temporal.server.elasticsearch.bulk_processor.request.latency.count,count,,,,,0,temporal,elasticsearch bulk processor request latency count,,
temporal.server.elasticsearch.bulk_processor.request.latency.sum,count,,millisecond,,,0,temporal,elasticsearch bulk processor request latency sum,,
temporal.server.elasticsearch.bulk_processor.requests.count,count,,,,,0,temporal,elasticsearch bulk processor requests count,,
temporal.server.elasticsearch.bulk_processor.wait_add.latency.bucket,count,,,,,0,temporal,elasticsearch bulk processor wait add latency bucket,,
temporal.server.elasticsearch.bulk_processor.wait_add.latency.count,count,,,,,0,temporal,elasticsearch bulk processor wait add latency count,,
temporal.server.elasticsearch.bulk_processor.wait_add.latency.sum,count,,millisecond,,,0,temporal,elasticsearch bulk processor wait add latency sum,,
temporal.server.elasticsearch.bulk_processor.wait_start.latency.bucket,count,,,,,0,temporal,elasticsearch bulk processor wait start latency bucket,,
temporal.server.elasticsearch.bulk_processor.wait_start.latency.count,count,,,,,0,temporal,elasticsearch bulk processor wait start latency count,,
temporal.server.elasticsearch.bulk_processor.wait_start.latency.sum,count,,millisecond,,,0,temporal,elasticsearch bulk processor wait start latency sum,,
temporal.server.elasticsearch.bulk_processor_retries.count,count,,,,,0,temporal,elasticsearch bulk processor retries count,,
temporal.server.elasticsearch.custom_order_by_clause_counter.count,count,,,,,0,temporal,elasticsearch custom order by clause counter count,,
temporal.server.elasticsearch.document.generate_failures_counter.count,count,,,,,0,temporal,elasticsearch document generate failures counter count,,
temporal.server.elasticsearch.document.parse_failures_counter.count,count,,,,,0,temporal,elasticsearch document parse failures counter count,,
temporal.server.empty_completion_commands.count,count,,,,,0,temporal,empty completion commands count,,
temporal.server.empty_replication_events.count,count,,,,,0,temporal,empty replication events count,,
temporal.server.encounter_not_found_workflow_count.count,count,,,,,0,temporal,encounter not found workflow count count,,
temporal.server.encounter_pass_retention_workflow_count.count,count,,,,,0,temporal,encounter pass retention workflow count count,,
temporal.server.encounter_zombie_workflow_count.count,count,,,,,0,temporal,encounter zombie workflow count count,,
temporal.server.event.blob_size.bucket,count,,,,,0,temporal,event blob size bucket,,
temporal.server.event.blob_size.count,count,,,,,0,temporal,event blob size count,,
temporal.server.event.blob_size.sum,count,,byte,,,0,temporal,event blob size sum,,
temporal.server.event.reapply_skipped.count,count,,,,,0,temporal,event reapply skipped count,,
temporal.server.execution_info.size.bucket,count,,,,,0,temporal,execution info size bucket,,
temporal.server.execution_info.size.count,count,,,,,0,temporal,execution info size count,,
temporal.server.execution_info.size.sum,count,,byte,,,0,temporal,execution info size sum,,
temporal.server.execution_state.size.bucket,count,,,,,0,temporal,execution state size bucket,,
temporal.server.execution_state.size.count,count,,,,,0,temporal,execution state size count,,
temporal.server.execution_state.size.sum,count,,byte,,,0,temporal,execution state size sum,,
temporal.server.executions_outstanding,gauge,,,,,0,temporal,executions outstanding,,
temporal.server.executor.deferred.count,count,,,,,0,temporal,executor deferred count,,
temporal.server.executor.done.count,count,,,,,0,temporal,executor done count,,
temporal.server.executor.dropped.count,count,,,,,0,temporal,executor dropped count,,
temporal.server.executor.err.count,count,,,,,0,temporal,executor err count,,
temporal.server.fail_workflow_command.count,count,,,,,0,temporal,fail workflow command count,,
temporal.server.failed_workflow_tasks.count,count,,,,,0,temporal,failed workflow tasks count,,
temporal.server.finalizer.items_completed.count,count,,,,,0,temporal,finalizer items completed count,,
temporal.server.finalizer.items_unfinished.count,count,,,,,0,temporal,finalizer items unfinished count,,
temporal.server.finalizer.latency.bucket,count,,,,,0,temporal,finalizer latency bucket,,
temporal.server.finalizer.latency.count,count,,,,,0,temporal,finalizer latency count,,
temporal.server.finalizer.latency.sum,count,,millisecond,,,0,temporal,finalizer latency sum,,
temporal.server.force_loaded_task_queue_partition_unnecessarily_count.count,count,,,,,0,temporal,force loaded task queue partition unnecessarily count count,,
temporal.server.force_loaded_task_queue_partitions_count.count,count,,,,,0,temporal,force loaded task queue partitions count count,,
temporal.server.forward_poll.calls.count,count,,,,,0,temporal,forward poll calls count,,
temporal.server.forward_poll.errors.count,count,,,,,0,temporal,forward poll errors count,,
temporal.server.forward_poll.latency.bucket,count,,,,,0,temporal,forward poll latency bucket,,
temporal.server.forward_poll.latency.count,count,,,,,0,temporal,forward poll latency count,,
temporal.server.forward_poll.latency.sum,count,,millisecond,,,0,temporal,forward poll latency sum,,
temporal.server.forward_query.calls.count,count,,,,,0,temporal,forward query calls count,,
temporal.server.forward_query.errors.count,count,,,,,0,temporal,forward query errors count,,
temporal.server.forward_query.latency.bucket,count,,,,,0,temporal,forward query latency bucket,,
temporal.server.forward_query.latency.count,count,,,,,0,temporal,forward query latency count,,
temporal.server.forward_query.latency.sum,count,,millisecond,,,0,temporal,forward query latency sum,,
temporal.server.forward_task.calls.count,count,,,,,0,temporal,forward task calls count,,
temporal.server.forward_task.errors.count,count,,,,,0,temporal,forward task errors count,,
temporal.server.forward_task.latency.bucket,count,,,,,0,temporal,forward task latency bucket,,
temporal.server.forward_task.latency.count,count,,,,,0,temporal,forward task latency count,,
temporal.server.forward_task.latency.sum,count,,millisecond,,,0,temporal,forward task latency sum,,
temporal.server.forwarded.count,count,,,,,0,temporal,forwarded count,,
temporal.server.forwarded_per_tl.count,count,,,,,0,temporal,forwarded per tl count,,
temporal.server.generate_replication_tasks_latency.bucket,count,,,,,0,temporal,generate replication tasks latency bucket,,
temporal.server.generate_replication_tasks_latency.count,count,,,,,0,temporal,generate replication tasks latency count,,
temporal.server.generate_replication_tasks_latency.sum,count,,millisecond,,,0,temporal,generate replication tasks latency sum,,
temporal.server.get_dlq_replication_messages.bucket,count,,,,,0,temporal,get dlq replication messages bucket,,
temporal.server.get_dlq_replication_messages.count,count,,,,,0,temporal,get dlq replication messages count,,
temporal.server.get_dlq_replication_messages.sum,count,,millisecond,,,0,temporal,get dlq replication messages sum,,
temporal.server.get_engine_for_shard.errors.count,count,,,,,0,temporal,get engine for shard errors count,,
temporal.server.get_engine_for_shard.latency.bucket,count,,,,,0,temporal,get engine for shard latency bucket,,
temporal.server.get_engine_for_shard.latency.count,count,,,,,0,temporal,get engine for shard latency count,,
temporal.server.get_engine_for_shard.latency.sum,count,,millisecond,,,0,temporal,get engine for shard latency sum,,
temporal.server.get_replication_messages_for_shard.bucket,count,,,,,0,temporal,get replication messages for shard bucket,,
temporal.server.get_replication_messages_for_shard.count,count,,,,,0,temporal,get replication messages for shard count,,
temporal.server.get_replication_messages_for_shard.sum,count,,millisecond,,,0,temporal,get replication messages for shard sum,,
temporal.server.gomaxprocs,gauge,,,,,0,temporal,gomaxprocs,,
temporal.server.handover.ready_shard_count,gauge,,,,,0,temporal,handover ready shard count,,
temporal.server.handover.wait_latency.bucket,count,,,,,0,temporal,handover wait latency bucket,,
temporal.server.handover.wait_latency.count,count,,,,,0,temporal,handover wait latency count,,
temporal.server.handover.wait_latency.sum,count,,millisecond,,,0,temporal,handover wait latency sum,,
temporal.server.heartbeat.timeout.count,count,,,,,0,temporal,heartbeat timeout count,,
temporal.server.history.archiver.archive.non_retryable_error.count,count,,,,,0,temporal,history archiver archive non retryable error count,,
temporal.server.history.archiver.archive.success.count,count,,,,,0,temporal,history archiver archive success count,,
temporal.server.history.archiver.archive.transient_error.count,count,,,,,0,temporal,history archiver archive transient error count,,
temporal.server.history.archiver.blob_exists.count,count,,,,,0,temporal,history archiver blob exists count,,
temporal.server.history.archiver.blob_integrity_check_failed.count,count,,,,,0,temporal,history archiver blob integrity check failed count,,
temporal.server.history.archiver.blob_size.bucket,count,,,,,0,temporal,history archiver blob size bucket,,
temporal.server.history.archiver.blob_size.count,count,,,,,0,temporal,history archiver blob size count,,
temporal.server.history.archiver.blob_size.sum,count,,byte,,,0,temporal,history archiver blob size sum,,
temporal.server.history.archiver.deterministic_construction_check_failed.count,count,,,,,0,temporal,history archiver deterministic construction check failed count,,
temporal.server.history.archiver.duplicate_archivals.count,count,,,,,0,temporal,history archiver duplicate archivals count,,
temporal.server.history.archiver.history_mutated.count,count,,,,,0,temporal,history archiver history mutated count,,
temporal.server.history.archiver.history_size.bucket,count,,,,,0,temporal,history archiver history size bucket,,
temporal.server.history.archiver.history_size.count,count,,,,,0,temporal,history archiver history size count,,
temporal.server.history.archiver.history_size.sum,count,,byte,,,0,temporal,history archiver history size sum,,
temporal.server.history.archiver.running_blob_integrity_check.count,count,,,,,0,temporal,history archiver running blob integrity check count,,
temporal.server.history.archiver.running_deterministic_construction_check.count,count,,,,,0,temporal,history archiver running deterministic construction check count,,
temporal.server.history.archiver.total_upload_size.bucket,count,,,,,0,temporal,history archiver total upload size bucket,,
temporal.server.history.archiver.total_upload_size.count,count,,,,,0,temporal,history archiver total upload size count,,
temporal.server.history.archiver.total_upload_size.sum,count,,byte,,,0,temporal,history archiver total upload size sum,,
temporal.server.history.bucket,count,,,,,0,temporal,history bucket,,
temporal.server.history.conflicts.count,count,,,,,0,temporal,history conflicts count,,
temporal.server.history.count,count,,,,,0,temporal,history count,,
temporal.server.history.event_notification.fail_delivery.count,count,,,,,0,temporal,history event notification fail delivery count,,
temporal.server.history.event_notification.fanout_latency.bucket,count,,,,,0,temporal,history event notification fanout latency bucket,,
temporal.server.history.event_notification.fanout_latency.count,count,,,,,0,temporal,history event notification fanout latency count,,
temporal.server.history.event_notification.fanout_latency.sum,count,,millisecond,,,0,temporal,history event notification fanout latency sum,,
temporal.server.history.event_notification.inflight_message,gauge,,,,,0,temporal,history event notification inflight message,,
temporal.server.history.event_notification.queueing_latency.bucket,count,,,,,0,temporal,history event notification queueing latency bucket,,
temporal.server.history.event_notification.queueing_latency.count,count,,,,,0,temporal,history event notification queueing latency count,,
temporal.server.history.event_notification.queueing_latency.sum,count,,millisecond,,,0,temporal,history event notification queueing latency sum,,
temporal.server.history.size.bucket,count,,,,,0,temporal,history size bucket,,
temporal.server.history.size.count,count,,,,,0,temporal,history size count,,
temporal.server.history.size.sum,count,,byte,,,0,temporal,history size sum,,
temporal.server.history.sum,count,,,,,0,temporal,history sum,,
temporal.server.history.workflow_execution_cache_latency.bucket,count,,,,,0,temporal,history workflow execution cache latency bucket,,
temporal.server.history.workflow_execution_cache_latency.count,count,,,,,0,temporal,history workflow execution cache latency count,,
temporal.server.history.workflow_execution_cache_latency.sum,count,,millisecond,,,0,temporal,history workflow execution cache latency sum,,
temporal.server.history_workflow_execution_cache.lock_hold_duration.bucket,count,,,,,0,temporal,history workflow execution cache lock hold duration bucket,,
temporal.server.history_workflow_execution_cache.lock_hold_duration.count,count,,,,,0,temporal,history workflow execution cache lock hold duration count,,
temporal.server.history_workflow_execution_cache.lock_hold_duration.sum,count,,millisecond,,,0,temporal,history workflow execution cache lock hold duration sum,,
temporal.server.host.health,gauge,,,,,0,temporal,host health,,
temporal.server.host_rps_limit,gauge,,,,,0,temporal,host rps limit,,
temporal.server.http.service_requests.count,count,,,,,0,temporal,http service requests count,,
temporal.server.inordered_buffered_events.count,count,,,,,0,temporal,inordered buffered events count,,
temporal.server.invalid_state_transition_workflow_update_message.count,count,,,,,0,temporal,invalid state transition workflow update message count,,
temporal.server.invalid_task_queue_name.count,count,,,,,0,temporal,invalid task queue name count,,
temporal.server.invalid_task_queue_partition.count,count,,,,,0,temporal,invalid task queue partition count,,
temporal.server.last_processed_message_id,gauge,,,,,0,temporal,last processed message id,,
temporal.server.last_retrieved_message_id,gauge,,,,,0,temporal,last retrieved message id,,
temporal.server.lease.failures.count,count,,,,,0,temporal,lease failures count,,
temporal.server.lease.requests.count,count,,,,,0,temporal,lease requests count,,
temporal.server.list_executions.failures.count,count,,,,,0,temporal,list executions failures count,,
temporal.server.loaded_physical_task_queue_count,gauge,,,,,0,temporal,loaded physical task queue count,,
temporal.server.loaded_task_queue_count,gauge,,,,,0,temporal,loaded task queue count,,
temporal.server.loaded_task_queue_family_count,gauge,,,,,0,temporal,loaded task queue family count,,
temporal.server.loaded_task_queue_partition_count,gauge,,,,,0,temporal,loaded task queue partition count,,
temporal.server.local_to_local.matches.count,count,,,,,0,temporal,local to local matches count,,
temporal.server.local_to_remote.matches.count,count,,,,,0,temporal,local to remote matches count,,
temporal.server.lock.failures.count,count,,,,,0,temporal,lock failures count,,
temporal.server.lock.latency.bucket,count,,,,,0,temporal,lock latency bucket,,
temporal.server.lock.latency.count,count,,,,,0,temporal,lock latency count,,
temporal.server.lock.latency.sum,count,,millisecond,,,0,temporal,lock latency sum,,
temporal.server.lock.requests.count,count,,,,,0,temporal,lock requests count,,
temporal.server.membership_changed.count,count,,,,,0,temporal,membership changed count,,
temporal.server.memo_size.bucket,count,,,,,0,temporal,memo size bucket,,
temporal.server.memo_size.count,count,,,,,0,temporal,memo size count,,
temporal.server.memo_size.sum,count,,byte,,,0,temporal,memo size sum,,
temporal.server.memory.allocated,gauge,,,,,0,temporal,memory allocated,,
temporal.server.memory.frees,gauge,,,,,0,temporal,memory frees,,
temporal.server.memory.gc_pause_ms.bucket,count,,,,,0,temporal,memory gc pause ms bucket,,
temporal.server.memory.gc_pause_ms.count,count,,,,,0,temporal,memory gc pause ms count,,
temporal.server.memory.gc_pause_ms.sum,count,,millisecond,,,0,temporal,memory gc pause ms sum,,
temporal.server.memory.heap,gauge,,,,,0,temporal,memory heap,,
temporal.server.memory.heap_objects,gauge,,,,,0,temporal,memory heap objects,,
temporal.server.memory.heapidle,gauge,,,,,0,temporal,memory heapidle,,
temporal.server.memory.heapinuse,gauge,,,,,0,temporal,memory heapinuse,,
temporal.server.memory.mallocs,gauge,,,,,0,temporal,memory mallocs,,
temporal.server.memory.num_gc.bucket,count,,,,,0,temporal,memory num gc bucket,,
temporal.server.memory.num_gc.count,count,,,,,0,temporal,memory num gc count,,
temporal.server.memory.num_gc.sum,count,,byte,,,0,temporal,memory num gc sum,,
temporal.server.memory.num_gc_last,gauge,,,,,0,temporal,memory num gc last,,
temporal.server.memory.pause_total_ns_last,gauge,,,,,0,temporal,memory pause total ns last,,
temporal.server.memory.stack,gauge,,,,,0,temporal,memory stack,,
temporal.server.modify_workflow_properties_command.count,count,,,,,0,temporal,modify workflow properties command count,,
temporal.server.multiple_completion_commands.count,count,,,,,0,temporal,multiple completion commands count,,
temporal.server.mutable_state.size.bucket,count,,,,,0,temporal,mutable state size bucket,,
temporal.server.mutable_state.size.count,count,,,,,0,temporal,mutable state size count,,
temporal.server.mutable_state.size.sum,count,,byte,,,0,temporal,mutable state size sum,,
temporal.server.mutable_state_checksum.invalidated.count,count,,,,,0,temporal,mutable state checksum invalidated count,,
temporal.server.mutable_state_checksum.mismatch.count,count,,,,,0,temporal,mutable state checksum mismatch count,,
temporal.server.mutable_state_dirty.count,count,,,,,0,temporal,mutable state dirty count,,
temporal.server.namespace_cache.callbacks_latency.bucket,count,,,,,0,temporal,namespace cache callbacks latency bucket,,
temporal.server.namespace_cache.callbacks_latency.count,count,,,,,0,temporal,namespace cache callbacks latency count,,
temporal.server.namespace_cache.callbacks_latency.sum,count,,millisecond,,,0,temporal,namespace cache callbacks latency sum,,
temporal.server.namespace_cache.prepare_callbacks_latency.bucket,count,,,,,0,temporal,namespace cache prepare callbacks latency bucket,,
temporal.server.namespace_cache.prepare_callbacks_latency.count,count,,,,,0,temporal,namespace cache prepare callbacks latency count,,
temporal.server.namespace_cache.prepare_callbacks_latency.sum,count,,millisecond,,,0,temporal,namespace cache prepare callbacks latency sum,,
temporal.server.namespace_dlq.ack_level,gauge,,,,,0,temporal,namespace dlq ack level,,
temporal.server.namespace_dlq.max_level,gauge,,,,,0,temporal,namespace dlq max level,,
temporal.server.namespace_host_rps_limit,gauge,,,,,0,temporal,namespace host rps limit,,
temporal.server.namespace_registry.callback_lock_latency.bucket,count,,,,,0,temporal,namespace registry callback lock latency bucket,,
temporal.server.namespace_registry.callback_lock_latency.count,count,,,,,0,temporal,namespace registry callback lock latency count,,
temporal.server.namespace_registry.callback_lock_latency.sum,count,,millisecond,,,0,temporal,namespace registry callback lock latency sum,,
temporal.server.namespace_registry.lock_latency.bucket,count,,,,,0,temporal,namespace registry lock latency bucket,,
temporal.server.namespace_registry.lock_latency.count,count,,,,,0,temporal,namespace registry lock latency count,,
temporal.server.namespace_registry.lock_latency.sum,count,,millisecond,,,0,temporal,namespace registry lock latency sum,,
temporal.server.namespace_replication.dlq_enqueue_requests.count,count,,,,,0,temporal,namespace replication dlq enqueue requests count,,
temporal.server.namespace_replication.task_ack_level,gauge,,,,,0,temporal,namespace replication task ack level,,
temporal.server.new_timer_notifications.count,count,,,,,0,temporal,new timer notifications count,,
temporal.server.nexus.completion_latency.bucket,count,,,,,0,temporal,nexus completion latency bucket,,
temporal.server.nexus.completion_latency.count,count,,,,,0,temporal,nexus completion latency count,,
temporal.server.nexus.completion_latency.sum,count,,millisecond,,,0,temporal,nexus completion latency sum,,
temporal.server.nexus.completion_request_preprocess_errors.count,count,,,,,0,temporal,nexus completion request preprocess errors count,,
temporal.server.nexus.completion_requests.count,count,,,,,0,temporal,nexus completion requests count,,
temporal.server.nexus.latency.bucket,count,,,,,0,temporal,nexus latency bucket,,
temporal.server.nexus.latency.count,count,,,,,0,temporal,nexus latency count,,
temporal.server.nexus.latency.sum,count,,millisecond,,,0,temporal,nexus latency sum,,
temporal.server.nexus.request_preprocess_errors.count,count,,,,,0,temporal,nexus request preprocess errors count,,
temporal.server.nexus.requests.count,count,,,,,0,temporal,nexus requests count,,
temporal.server.no_poller_tasks.count,count,,,,Tasks added to a task queue that has no poller.,0,temporal,no poller tasks count,,
temporal.server.non_retryable_tasks.count,count,,,,,0,temporal,non retryable tasks count,,
temporal.server.num_goroutines,gauge,,,,,0,temporal,num goroutines,,
temporal.server.numshards,gauge,,,,,0,temporal,numshards,,
temporal.server.operation.count,count,,,,,0,temporal,operation count,,
temporal.server.out_of_order_buffered_events.count,count,,,,,0,temporal,out of order buffered events count,,
temporal.server.parent_close_policy_processor.errors.count,count,,,,,0,temporal,parent close policy processor errors count,,
temporal.server.parent_close_policy_processor.requests.count,count,,,,,0,temporal,parent close policy processor requests count,,
temporal.server.paused_activities.count,count,,,,,0,temporal,paused activities count,,
temporal.server.pending_tasks.bucket,count,,,,,0,temporal,pending tasks bucket,,
temporal.server.pending_tasks.count,count,,,,,0,temporal,pending tasks count,,
temporal.server.pending_tasks.sum,count,,,,,0,temporal,pending tasks sum,,
temporal.server.persisted_mutable_state_size.bucket,count,,,,,0,temporal,persisted mutable state size bucket,,
temporal.server.persisted_mutable_state_size.count,count,,,,,0,temporal,persisted mutable state size count,,
temporal.server.persisted_mutable_state_size.sum,count,,byte,,,0,temporal,persisted mutable state size sum,,
temporal.server.persistence.error_with_type.count,count,,,,"Number of persistence errors, tagged by error type.",0,temporal,persistence error with type count,,
temporal.server.persistence.errors.bad_request.count,count,,,,,0,temporal,persistence errors bad request count,,
temporal.server.persistence.errors.busy.count,count,,,,,0,temporal,persistence errors busy count,,
temporal.server.persistence.errors.condition_failed.count,count,,,,,0,temporal,persistence errors condition failed count,,
temporal.server.persistence.errors.count,count,,,,Number of persistence errors.,0,temporal,persistence errors count,,
temporal.server.persistence.errors.current_workflow_condition_failed.count,count,,,,,0,temporal,persistence errors current workflow condition failed count,,
temporal.server.persistence.errors.entity_not_exists.count,count,,,,,0,temporal,persistence errors entity not exists count,,
temporal.server.persistence.errors.namespace_already_exists.count,count,,,,,0,temporal,persistence errors namespace already exists count,,
temporal.server.persistence.errors.resource_exhausted.count,count,,,,,0,temporal,persistence errors resource exhausted count,,
temporal.server.persistence.errors.shard_exists.count,count,,,,,0,temporal,persistence errors shard exists count,,
temporal.server.persistence.errors.shard_ownership_lost.count,count,,,,,0,temporal,persistence errors shard ownership lost count,,
temporal.server.persistence.errors.timeout.count,count,,,,,0,temporal,persistence errors timeout count,,
temporal.server.persistence.errors.workflow_condition_failed.count,count,,,,,0,temporal,persistence errors workflow condition failed count,,
temporal.server.persistence.latency.bucket,count,,,,Distribution of latencies on persistence operations.,0,temporal,persistence latency bucket,,
temporal.server.persistence.latency.count,count,,,,Count of latencies on persistence operations.,0,temporal,persistence latency count,,
temporal.server.persistence.latency.sum,count,,millisecond,,Sum of latencies on persistence operations.,0,temporal,persistence latency sum,,
temporal.server.persistence.requests.count,count,,,,Number of persistence requests.,0,temporal,persistence requests count,,
temporal.server.persistence.session_refresh_attempts.count,count,,,,,0,temporal,persistence session refresh attempts count,,
temporal.server.persistence.session_refresh_failures.count,count,,,,,0,temporal,persistence session refresh failures count,,
temporal.server.persistence.shard_rps.bucket,count,,,,,0,temporal,persistence shard rps bucket,,
temporal.server.persistence.shard_rps.count,count,,,,,0,temporal,persistence shard rps count,,
temporal.server.persistence.shard_rps.sum,count,,,,,0,temporal,persistence shard rps sum,,
temporal.server.poll.success.count,count,,,,Number of tasks successfully matched by the poller.,0,temporal,poll success count,,
temporal.server.poll.success_sync.count,count,,,,Number of tasks successfully matched synchronously. ,0,temporal,poll success sync count,,
temporal.server.poll.timeouts.count,count,,,,Number of times a poller timed out due to no tasks being available.,0,temporal,poll timeouts count,,
temporal.server.poll_latency.bucket,count,,,,,0,temporal,poll latency bucket,,
temporal.server.poll_latency.count,count,,,,,0,temporal,poll latency count,,
temporal.server.poll_latency.sum,count,,millisecond,,,0,temporal,poll latency sum,,
