metric_name,metric_type,interval,unit_name,per_unit_name,description,orientation,integration,short_name,curated_metric,sample_tags
temporal.server.protocol_message_command.count,count,,,,,0,temporal,protocol message command count,,
temporal.server.query_before_first_workflow_task.count,count,,,,,0,temporal,query before first workflow task count,,
temporal.server.query_buffer_exceeded.count,count,,,,,0,temporal,query buffer exceeded count,,
temporal.server.query_registry_invalid_state.count,count,,,,,0,temporal,query registry invalid state count,,
temporal.server.queue.action_errors.count,count,,,,,0,temporal,queue action errors count,,
temporal.server.queue.actions.count,count,,,,,0,temporal,queue actions count,,
temporal.server.queue.latency_schedule.bucket,count,,,,,0,temporal,queue latency schedule bucket,,
temporal.server.queue.latency_schedule.count,count,,,,,0,temporal,queue latency schedule count,,
temporal.server.queue.latency_schedule.sum,count,,millisecond,,,0,temporal,queue latency schedule sum,,
temporal.server.queue.reader.bucket,count,,,,,0,temporal,queue reader bucket,,
temporal.server.queue.reader.count,count,,,,,0,temporal,queue reader count,,
temporal.server.queue.reader.sum,count,,,,,0,temporal,queue reader sum,,
temporal.server.queue.slice.bucket,count,,,,,0,temporal,queue slice bucket,,
temporal.server.queue.slice.count,count,,,,,0,temporal,queue slice count,,
temporal.server.queue.slice.sum,count,,,,,0,temporal,queue slice sum,,
temporal.server.rate_limited_task.runnable_wait_time.bucket,count,,,,,0,temporal,rate limited task runnable wait time bucket,,
temporal.server.rate_limited_task.runnable_wait_time.count,count,,,,,0,temporal,rate limited task runnable wait time count,,
temporal.server.rate_limited_task.runnable_wait_time.sum,count,,millisecond,,,0,temporal,rate limited task runnable wait time sum,,
temporal.server.rate_limiter.failures.count,count,,,,,0,temporal,rate limiter failures count,,
temporal.server.reachability_exit_point_count.count,count,,,,,0,temporal,reachability exit point count count,,
temporal.server.read_namespace.errors.count,count,,,,,0,temporal,read namespace errors count,,
temporal.server.read_namespace.failures.count,count,,,,,0,temporal,read namespace failures count,,
temporal.server.reclaim_resources.delete_executions.failure.count,count,,,,,0,temporal,reclaim resources delete executions failure count,,
temporal.server.reclaim_resources.delete_executions.success.count,count,,,,,0,temporal,reclaim resources delete executions success count,,
temporal.server.reclaim_resources.namespace_delete.failure.count,count,,,,,0,temporal,reclaim resources namespace delete failure count,,
temporal.server.reclaim_resources.namespace_delete.success.count,count,,,,,0,temporal,reclaim resources namespace delete success count,,
temporal.server.record_marker_command.count,count,,,,,0,temporal,record marker command count,,
temporal.server.reject_workflow_update_message.count,count,,,,,0,temporal,reject workflow update message count,,
temporal.server.remote_to_local.matches.count,count,,,,,0,temporal,remote to local matches count,,
temporal.server.remote_to_remote.matches.count,count,,,,,0,temporal,remote to remote matches count,,
temporal.server.remove_engine_for_shard.latency.bucket,count,,,,,0,temporal,remove engine for shard latency bucket,,
temporal.server.remove_engine_for_shard.latency.count,count,,,,,0,temporal,remove engine for shard latency count,,
temporal.server.remove_engine_for_shard.latency.sum,count,,millisecond,,,0,temporal,remove engine for shard latency sum,,
temporal.server.rename_namespace.failures.count,count,,,,,0,temporal,rename namespace failures count,,
temporal.server.rename_namespace.success.count,count,,,,,0,temporal,rename namespace success count,,
temporal.server.replication.dlq.ack_level,gauge,,,,,0,temporal,replication dlq ack level,,
temporal.server.replication.dlq.enqueue_failed.count,count,,,,,0,temporal,replication dlq enqueue failed count,,
temporal.server.replication.dlq.max_level,gauge,,,,,0,temporal,replication dlq max level,,
temporal.server.replication.dlq_non_empty.count,count,,,,,0,temporal,replication dlq non empty count,,
temporal.server.replication.duplicated_task.count,count,,,,,0,temporal,replication duplicated task count,,
temporal.server.replication.latency.bucket,count,,,,,0,temporal,replication latency bucket,,
temporal.server.replication.latency.count,count,,,,,0,temporal,replication latency count,,
temporal.server.replication.latency.sum,count,,millisecond,,,0,temporal,replication latency sum,,
temporal.server.replication.outlier_namespace.count,count,,,,,0,temporal,replication outlier namespace count,,
temporal.server.replication.service_error.count,count,,,,,0,temporal,replication service error count,,
temporal.server.replication.stream_error.count,count,,,,,0,temporal,replication stream error count,,
temporal.server.replication.stream_panic.count,count,,,,,0,temporal,replication stream panic count,,
temporal.server.replication.stream_stuck.count,count,,,,,0,temporal,replication stream stuck count,,
temporal.server.replication.task_cleanup.count,count,,,,,0,temporal,replication task cleanup count,,
temporal.server.replication.task_cleanup.failed.count,count,,,,,0,temporal,replication task cleanup failed count,,
temporal.server.replication.task_generation_latency.bucket,count,,,,,0,temporal,replication task generation latency bucket,,
temporal.server.replication.task_generation_latency.count,count,,,,,0,temporal,replication task generation latency count,,
temporal.server.replication.task_generation_latency.sum,count,,millisecond,,,0,temporal,replication task generation latency sum,,
temporal.server.replication.task_load_latency.bucket,count,,,,,0,temporal,replication task load latency bucket,,
temporal.server.replication.task_load_latency.count,count,,,,,0,temporal,replication task load latency count,,
temporal.server.replication.task_load_latency.sum,count,,millisecond,,,0,temporal,replication task load latency sum,,
temporal.server.replication.task_load_size.bucket,count,,,,,0,temporal,replication task load size bucket,,
temporal.server.replication.task_load_size.count,count,,,,,0,temporal,replication task load size count,,
temporal.server.replication.task_load_size.sum,count,,,,,0,temporal,replication task load size sum,,
temporal.server.replication.task_processing_latency.bucket,count,,,,,0,temporal,replication task processing latency bucket,,
temporal.server.replication.task_processing_latency.count,count,,,,,0,temporal,replication task processing latency count,,
temporal.server.replication.task_processing_latency.sum,count,,millisecond,,,0,temporal,replication task processing latency sum,,
temporal.server.replication.task_send_attempt.bucket,count,,,,,0,temporal,replication task send attempt bucket,,
temporal.server.replication.task_send_attempt.count,count,,,,,0,temporal,replication task send attempt count,,
temporal.server.replication.task_send_attempt.sum,count,,,,,0,temporal,replication task send attempt sum,,
temporal.server.replication.task_send_backlog.bucket,count,,,,,0,temporal,replication task send backlog bucket,,
temporal.server.replication.task_send_backlog.count,count,,,,,0,temporal,replication task send backlog count,,
temporal.server.replication.task_send_backlog.sum,count,,,,,0,temporal,replication task send backlog sum,,
temporal.server.replication.task_send_error.count,count,,,,,0,temporal,replication task send error count,,
temporal.server.replication.task_send_latency.bucket,count,,,,,0,temporal,replication task send latency bucket,,
temporal.server.replication.task_send_latency.count,count,,,,,0,temporal,replication task send latency count,,
temporal.server.replication.task_send_latency.sum,count,,millisecond,,,0,temporal,replication task send latency sum,,
temporal.server.replication.task_transmission_latency.bucket,count,,,,,0,temporal,replication task transmission latency bucket,,
temporal.server.replication.task_transmission_latency.count,count,,,,,0,temporal,replication task transmission latency count,,
temporal.server.replication.task_transmission_latency.sum,count,,millisecond,,,0,temporal,replication task transmission latency sum,,
temporal.server.replication.tasks.applied.count,count,,,,,0,temporal,replication tasks applied count,,
temporal.server.replication.tasks.applied_latency.bucket,count,,,,,0,temporal,replication tasks applied latency bucket,,
temporal.server.replication.tasks.applied_latency.count,count,,,,,0,temporal,replication tasks applied latency count,,
temporal.server.replication.tasks.applied_latency.sum,count,,millisecond,,,0,temporal,replication tasks applied latency sum,,
temporal.server.replication.tasks.failed.count,count,,,,,0,temporal,replication tasks failed count,,
temporal.server.replication.tasks.fetched.bucket,count,,,,,0,temporal,replication tasks fetched bucket,,
temporal.server.replication.tasks.fetched.count,count,,,,,0,temporal,replication tasks fetched count,,
temporal.server.replication.tasks.fetched.sum,count,,millisecond,,,0,temporal,replication tasks fetched sum,,
temporal.server.replication.tasks.lag.bucket,count,,,,,0,temporal,replication tasks lag bucket,,
temporal.server.replication.tasks.lag.count,count,,,,,0,temporal,replication tasks lag count,,
temporal.server.replication.tasks.lag.sum,count,,millisecond,,,0,temporal,replication tasks lag sum,,
temporal.server.replication.tasks.returned.bucket,count,,,,,0,temporal,replication tasks returned bucket,,
temporal.server.replication.tasks.returned.count,count,,,,,0,temporal,replication tasks returned count,,
temporal.server.replication.tasks.returned.sum,count,,millisecond,,,0,temporal,replication tasks returned sum,,
temporal.server.replication.tasks_back_fill.count,count,,,,,0,temporal,replication tasks back fill count,,
temporal.server.replication.tasks_back_fill_latency.bucket,count,,,,,0,temporal,replication tasks back fill latency bucket,,
temporal.server.replication.tasks_back_fill_latency.count,count,,,,,0,temporal,replication tasks back fill latency count,,
temporal.server.replication.tasks_back_fill_latency.sum,count,,millisecond,,,0,temporal,replication tasks back fill latency sum,,
temporal.server.replication.tasks_recv.count,count,,,,,0,temporal,replication tasks recv count,,
temporal.server.replication.tasks_recv_backlog.bucket,count,,,,,0,temporal,replication tasks recv backlog bucket,,
temporal.server.replication.tasks_recv_backlog.count,count,,,,,0,temporal,replication tasks recv backlog count,,
temporal.server.replication.tasks_recv_backlog.sum,count,,,,,0,temporal,replication tasks recv backlog sum,,
temporal.server.replication.tasks_send.count,count,,,,,0,temporal,replication tasks send count,,
temporal.server.replication.tasks_skipped.count,count,,,,,0,temporal,replication tasks skipped count,,
temporal.server.replication_events_size.bucket,count,,,,,0,temporal,replication events size bucket,,
temporal.server.replication_events_size.count,count,,,,,0,temporal,replication events size count,,
temporal.server.replication_events_size.sum,count,,millisecond,,,0,temporal,replication events size sum,,
temporal.server.replicator.dlq_enqueue_fails.count,count,,,,,0,temporal,replicator dlq enqueue fails count,,
temporal.server.replicator.errors.count,count,,,,,0,temporal,replicator errors count,,
temporal.server.replicator.latency.bucket,count,,,,,0,temporal,replicator latency bucket,,
temporal.server.replicator.latency.count,count,,,,,0,temporal,replicator latency count,,
temporal.server.replicator.latency.sum,count,,millisecond,,,0,temporal,replicator latency sum,,
temporal.server.replicator.messages.count,count,,,,,0,temporal,replicator messages count,,
temporal.server.request_cancel_info.bucket,count,,,,,0,temporal,request cancel info bucket,,
temporal.server.request_cancel_info.count,count,,,,,0,temporal,request cancel info count,,
temporal.server.request_cancel_info.size.bucket,count,,,,,0,temporal,request cancel info size bucket,,
temporal.server.request_cancel_info.size.count,count,,,,,0,temporal,request cancel info size count,,
temporal.server.request_cancel_info.size.sum,count,,byte,,,0,temporal,request cancel info size sum,,
temporal.server.request_cancel_info.sum,count,,,,,0,temporal,request cancel info sum,,
temporal.server.request_workflow_update_message.count,count,,,,,0,temporal,request workflow update message count,,
temporal.server.respond_nexus_failed.count,count,,,,,0,temporal,respond nexus failed count,,
temporal.server.respond_query_failed.count,count,,,,,0,temporal,respond query failed count,,
temporal.server.respond_workflow_update_message.count,count,,,,,0,temporal,respond workflow update message count,,
temporal.server.restarts.count,count,,,,,0,temporal,restarts count,,
temporal.server.scan_duration.bucket,count,,,,,0,temporal,scan duration bucket,,
temporal.server.scan_duration.count,count,,,,,0,temporal,scan duration count,,
temporal.server.scan_duration.sum,count,,millisecond,,,0,temporal,scan duration sum,,
temporal.server.scavenger.errors.count,count,,,,,0,temporal,scavenger errors count,,
temporal.server.scavenger.skips.count,count,,,,,0,temporal,scavenger skips count,,
temporal.server.scavenger.success.count,count,,,,,0,temporal,scavenger success count,,
temporal.server.scavenger.validation.failures.count,count,,,,,0,temporal,scavenger validation failures count,,
temporal.server.scavenger.validation.requests.count,count,,,,,0,temporal,scavenger validation requests count,,
temporal.server.scavenger.validation.skips.count,count,,,,,0,temporal,scavenger validation skips count,,
temporal.server.schedule.action.errors.count,count,,,,,0,temporal,schedule action errors count,,
temporal.server.schedule.action.success.count,count,,,,,0,temporal,schedule action success count,,
temporal.server.schedule.buffer_overruns.count,count,,,,,0,temporal,schedule buffer overruns count,,
temporal.server.schedule.cancel_workflow.errors.count,count,,,,,0,temporal,schedule cancel workflow errors count,,
temporal.server.schedule.missed_catchup_window.count,count,,,,,0,temporal,schedule missed catchup window count,,
temporal.server.schedule.rate_limited.count,count,,,,,0,temporal,schedule rate limited count,,
temporal.server.schedule.terminate_workflow.errors.count,count,,,,,0,temporal,schedule terminate workflow errors count,,
temporal.server.schedule_action.attempt.count,count,,,,,0,temporal,schedule action attempt count,,
temporal.server.schedule_action.dropped.count,count,,,,,0,temporal,schedule action dropped count,,
temporal.server.schedule_action_delay.bucket,count,,,,,0,temporal,schedule action delay bucket,,
temporal.server.schedule_action_delay.count,count,,,,,0,temporal,schedule action delay count,,
temporal.server.schedule_action_delay.sum,count,,millisecond,,,0,temporal,schedule action delay sum,,
temporal.server.schedule_activity_command.count,count,,,,,0,temporal,schedule activity command count,,
temporal.server.schedule_to_close.timeout.count,count,,,,,0,temporal,schedule to close timeout count,,
temporal.server.schedule_to_start.timeout.count,count,,,,,0,temporal,schedule to start timeout count,,
temporal.server.search_attributes_size.bucket,count,,,,,0,temporal,search attributes size bucket,,
temporal.server.search_attributes_size.count,count,,,,,0,temporal,search attributes size count,,
temporal.server.search_attributes_size.sum,count,,byte,,,0,temporal,search attributes size sum,,
temporal.server.semaphore.failures.count,count,,,,,0,temporal,semaphore failures count,,
temporal.server.semaphore.latency.bucket,count,,,,,0,temporal,semaphore latency bucket,,
temporal.server.semaphore.latency.count,count,,,,,0,temporal,semaphore latency count,,
temporal.server.semaphore.latency.sum,count,,millisecond,,,0,temporal,semaphore latency sum,,
temporal.server.semaphore.requests.count,count,,,,,0,temporal,semaphore requests count,,
temporal.server.service.authorization_latency.bucket,count,,,,,0,temporal,service authorization latency bucket,,
temporal.server.service.authorization_latency.count,count,,,,,0,temporal,service authorization latency count,,
temporal.server.service.authorization_latency.sum,count,,millisecond,,,0,temporal,service authorization latency sum,,
temporal.server.service.error_with_type.count,count,,,,"Errors encountered by the service, tagged by type.",0,temporal,service error with type count,,
temporal.server.service.errors.authorize_failed.count,count,,,,,0,temporal,service errors authorize failed count,,
temporal.server.service.errors.bad_binary.count,count,,,,,0,temporal,service errors bad binary count,,
temporal.server.service.errors.cancellation_already_requested.count,count,,,,,0,temporal,service errors cancellation already requested count,,
temporal.server.service.errors.client_version_not_supported.count,count,,,,,0,temporal,service errors client version not supported count,,
temporal.server.service.errors.context_cancelled.count,count,,,,,0,temporal,service errors context cancelled count,,
temporal.server.service.errors.context_timeout.count,count,,,,,0,temporal,service errors context timeout count,,
temporal.server.service.errors.count,count,,,,,0,temporal,service errors count,,
temporal.server.service.errors.critical.count,count,,,,,0,temporal,service errors critical count,,
temporal.server.service.errors.entity_not_found.count,count,,,,,0,temporal,service errors entity not found count,,
temporal.server.service.errors.execution_already_started.count,count,,,,,0,temporal,service errors execution already started count,,
temporal.server.service.errors.incomplete_history.count,count,,,,,0,temporal,service errors incomplete history count,,
temporal.server.service.errors.invalid_argument.count,count,,,,,0,temporal,service errors invalid argument count,,
temporal.server.service.errors.namespace_already_exists.count,count,,,,,0,temporal,service errors namespace already exists count,,
temporal.server.service.errors.namespace_not_active.count,count,,,,,0,temporal,service errors namespace not active count,,
temporal.server.service.errors.nondeterministic.count,count,,,,,0,temporal,service errors nondeterministic count,,
temporal.server.service.errors.query_failed.count,count,,,,,0,temporal,service errors query failed count,,
temporal.server.service.errors.resource_exhausted.count,count,,,,,0,temporal,service errors resource exhausted count,,
temporal.server.service.errors.retry_task.count,count,,,,,0,temporal,service errors retry task count,,
temporal.server.service.errors.shard_ownership_lost.count,count,,,,,0,temporal,service errors shard ownership lost count,,
temporal.server.service.errors.task_already_started.count,count,,,,,0,temporal,service errors task already started count,,
temporal.server.service.errors.unauthorized.count,count,,,,,0,temporal,service errors unauthorized count,,
temporal.server.service.latency.bucket,count,,,,Distribution of latencies for all client request operations.,0,temporal,service latency bucket,,
temporal.server.service.latency.count,count,,,,Count of latencies for all client request operations.,0,temporal,service latency count,,
temporal.server.service.latency.nouserlatency.bucket,count,,,,,0,temporal,service latency nouserlatency bucket,,
temporal.server.service.latency.nouserlatency.count,count,,,,,0,temporal,service latency nouserlatency count,,
temporal.server.service.latency.nouserlatency.sum,count,,millisecond,,,0,temporal,service latency nouserlatency sum,,
temporal.server.service.latency.sum,count,,millisecond,,Sum of latencies for all client requests operations.,0,temporal,service latency sum,,
temporal.server.service.latency.userlatency.bucket,count,,,,,0,temporal,service latency userlatency bucket,,
temporal.server.service.latency.userlatency.count,count,,,,,0,temporal,service latency userlatency count,,
temporal.server.service.latency.userlatency.sum,count,,millisecond,,,0,temporal,service latency userlatency sum,,
temporal.server.service.panics.count,count,,,,,0,temporal,service panics count,,
temporal.server.service.pending_requests,gauge,,,,,0,temporal,service pending requests,,
temporal.server.service.requests.count,count,,,,Service requests received per Task Queue.,0,temporal,service requests count,,
temporal.server.shard.linger_success.bucket,count,,,,,0,temporal,shard linger success bucket,,
temporal.server.shard.linger_success.count,count,,,,,0,temporal,shard linger success count,,
temporal.server.shard.linger_success.sum,count,,millisecond,,,0,temporal,shard linger success sum,,
temporal.server.shard.linger_timeouts.count,count,,,,,0,temporal,shard linger timeouts count,,
temporal.server.shard.lock_latency.bucket,count,,,,,0,temporal,shard lock latency bucket,,
temporal.server.shard.lock_latency.count,count,,,,,0,temporal,shard lock latency count,,
temporal.server.shard.lock_latency.sum,count,,millisecond,,,0,temporal,shard lock latency sum,,
temporal.server.shard_closed.count,count,,,,,0,temporal,shard closed count,,
temporal.server.shard_controller.lock_latency.bucket,count,,,,,0,temporal,shard controller lock latency bucket,,
temporal.server.shard_controller.lock_latency.count,count,,,,,0,temporal,shard controller lock latency count,,
temporal.server.shard_controller.lock_latency.sum,count,,millisecond,,,0,temporal,shard controller lock latency sum,,
temporal.server.shardinfo.immediate_queue.lag.bucket,count,,,,,0,temporal,shardinfo immediate queue lag bucket,,
temporal.server.shardinfo.immediate_queue.lag.count,count,,,,,0,temporal,shardinfo immediate queue lag count,,
temporal.server.shardinfo.immediate_queue.lag.sum,count,,,,,0,temporal,shardinfo immediate queue lag sum,,
temporal.server.shardinfo.replication.lag.bucket,count,,,,,0,temporal,shardinfo replication lag bucket,,
temporal.server.shardinfo.replication.lag.count,count,,,,,0,temporal,shardinfo replication lag count,,
temporal.server.shardinfo.replication.lag.sum,count,,,,,0,temporal,shardinfo replication lag sum,,
temporal.server.shardinfo.replication.pending_task.bucket,count,,,,,0,temporal,shardinfo replication pending task bucket,,
temporal.server.shardinfo.replication.pending_task.count,count,,,,,0,temporal,shardinfo replication pending task count,,
temporal.server.shardinfo.replication.pending_task.sum,count,,,,,0,temporal,shardinfo replication pending task sum,,
temporal.server.shardinfo.scheduled_queue.lag.bucket,count,,,,,0,temporal,shardinfo scheduled queue lag bucket,,
temporal.server.shardinfo.scheduled_queue.lag.count,count,,,,,0,temporal,shardinfo scheduled queue lag count,,
temporal.server.shardinfo.scheduled_queue.lag.sum,count,,millisecond,,,0,temporal,shardinfo scheduled queue lag sum,,
temporal.server.shardinfo.timer.active.pending_task.bucket,count,,,,,0,temporal,shardinfo timer active pending task bucket,,
temporal.server.shardinfo.timer.active.pending_task.count,count,,,,,0,temporal,shardinfo timer active pending task count,,
temporal.server.shardinfo.timer.active.pending_task.sum,count,,,,,0,temporal,shardinfo timer active pending task sum,,
temporal.server.shardinfo.timer.lag.bucket,count,,,,,0,temporal,shardinfo timer lag bucket,,
temporal.server.shardinfo.timer.lag.count,count,,,,,0,temporal,shardinfo timer lag count,,
temporal.server.shardinfo.timer.lag.sum,count,,millisecond,,,0,temporal,shardinfo timer lag sum,,
temporal.server.shardinfo.timer.standby.pending_task.bucket,count,,,,,0,temporal,shardinfo timer standby pending task bucket,,
temporal.server.shardinfo.timer.standby.pending_task.count,count,,,,,0,temporal,shardinfo timer standby pending task count,,
temporal.server.shardinfo.timer.standby.pending_task.sum,count,,,,,0,temporal,shardinfo timer standby pending task sum,,
temporal.server.shardinfo.timer_diff.bucket,count,,,,,0,temporal,shardinfo timer diff bucket,,
temporal.server.shardinfo.timer_diff.count,count,,,,,0,temporal,shardinfo timer diff count,,
temporal.server.shardinfo.timer_diff.sum,count,,millisecond,,,0,temporal,shardinfo timer diff sum,,
temporal.server.shardinfo.timer_failover_in_progress.bucket,count,,,,,0,temporal,shardinfo timer failover in progress bucket,,
temporal.server.shardinfo.timer_failover_in_progress.count,count,,,,,0,temporal,shardinfo timer failover in progress count,,
temporal.server.shardinfo.timer_failover_in_progress.sum,count,,,,,0,temporal,shardinfo timer failover in progress sum,,
temporal.server.shardinfo.timer_failover_latency.bucket,count,,,,,0,temporal,shardinfo timer failover latency bucket,,
temporal.server.shardinfo.timer_failover_latency.count,count,,,,,0,temporal,shardinfo timer failover latency count,,
temporal.server.shardinfo.timer_failover_latency.sum,count,,millisecond,,,0,temporal,shardinfo timer failover latency sum,,
temporal.server.shardinfo.transfer.active.pending_task.bucket,count,,,,,0,temporal,shardinfo transfer active pending task bucket,,
temporal.server.shardinfo.transfer.active.pending_task.count,count,,,,,0,temporal,shardinfo transfer active pending task count,,
temporal.server.shardinfo.transfer.active.pending_task.sum,count,,,,,0,temporal,shardinfo transfer active pending task sum,,
temporal.server.shardinfo.transfer.diff.bucket,count,,,,,0,temporal,shardinfo transfer diff bucket,,
temporal.server.shardinfo.transfer.diff.count,count,,,,,0,temporal,shardinfo transfer diff count,,
temporal.server.shardinfo.transfer.diff.sum,count,,,,,0,temporal,shardinfo transfer diff sum,,
temporal.server.shardinfo.transfer.failover_in_progress.bucket,count,,,,,0,temporal,shardinfo transfer failover in progress bucket,,
temporal.server.shardinfo.transfer.failover_in_progress.count,count,,,,,0,temporal,shardinfo transfer failover in progress count,,
temporal.server.shardinfo.transfer.failover_in_progress.sum,count,,,,,0,temporal,shardinfo transfer failover in progress sum,,
temporal.server.shardinfo.transfer.failover_latency.bucket,count,,,,,0,temporal,shardinfo transfer failover latency bucket,,
temporal.server.shardinfo.transfer.failover_latency.count,count,,,,,0,temporal,shardinfo transfer failover latency count,,
